6000,"Arms Trade: A Global Epidemic","Political Science/International Relations/Conflict, Peace, and Security/Arms Control           "
6001,"One Rogue State Crisis at a Time!: The United States and North Korea's Nuclear Weapons Program","Political Science/International Relations/Conflict, Peace, and Security/Arms Control           "
6002,"The Political Economy of Reform: A Coalition for Peace","Political Science/International Relations/Conflict, Peace, and Security/Arms Control           "
6003,"Who Participates in Global Environmental Governance? Partial Answers from International Relations Theory","Political Science/International Relations/Approach, Critique of International Relations Theory, and Methodology           "
6004,"An Ethnographer in the Global Arena: Globography Perhaps?","Sociology/Culture and Society/Globalization, Cultures, and Communication           "
6005,"International Law and International Relations Theory: A Dual Agenda","Political Science/International Relations/Approach, Critique of International Relations Theory, and Methodology           "
6006,"International Relations Theory and the Discourse on Terrorism: Preliminary Reflections on Context and Limits","Political Science/International Relations/Approach, Critique of International Relations Theory, and Methodology           "
6007,"Tales from the Dark Side: Africa's Challenge to the International Relations Theory","Political Science/International Relations/Approach, Critique of International Relations Theory, and Methodology           "
6008,"The Evolution of International Norms","Political Science/International Relations/Approach, Critique of International Relations Theory, and Methodology           "
6009,"Nationalism and International Relations Theory","Political Science/International Relations/Approach, Critique of International Relations Theory, and Methodology           "
6010,"The Promise of Constructivism in International Relations Theory","Political Science/International Relations/Approach, Critique of International Relations Theory, and Methodology           "
6011,"The Limits of Neorealism: Marginal States and International Relations Theory","Political Science/International Relations/Approach, Critique of International Relations Theory, and Methodology           "
6012,"Postcolonialism in an Age of Globalization: Opening International Relations Theory to Identities in Movement","Political Science/International Relations/Approach, Critique of International Relations Theory, and Methodology           "
6013,"Issac Deutscher and the Lost History of International Relations","Political Science/International Relations/Approach, Critique of International Relations Theory, and Methodology           "
6014,"You Just Don't Understand: Troubled Engagements Between Feminists and IR Theorists","Political Science/International Relations/Approach, Critique of International Relations Theory, and Methodology           "
6015,"The Politics of Confusion in International Relations Theory","Political Science/International Relations/Approach, Critique of International Relations Theory, and Methodology           "
6016,"Engaging Globalization: Critical Theory and Global Political Change","Political Science/International Relations/Approach, Critique of International Relations Theory, and Methodology           "
6017,"Perilous Partnerships: The UN's Corporate Outreach Program","Political Science/International Relations/Poverty, Inequality, and Rights/Human Rights           "
6018,"Promoting Corporate Social Responsibility Abroad: The Human Rghts and Democracy Perspective","Political Science/International Relations/Power, Alliance, Leadership, and Hegemony/Democratic Consolidation in the World           "
6019,"Comparative Review of Children's Rights and Women's Rights in Korea","Political Science/International Relations/Poverty, Inequality, and Rights/Human Rights           "
6020,"Toward Eradicating Impunity: The Establishment of an International Criminal Court","Political Science/International Relations/Poverty, Inequality, and Rights/Human Rights           "
6021,"Are There Collective Human Rights?","Political Science/International Relations/Poverty, Inequality, and Rights/Human Rights           "
6022,"The World Health Organization Addressing Violence Against Women","Political Science/International Relations/Poverty, Inequality, and Rights/Women's Issues           "
6023,"To See and Not be Seen: Latin American Illegal Foreign Workers in Jerusalem","Sociology/Culture and Society/Globalization, Cultures, and Communication           "
6024,"Realizing Human Rights of Women and Children: Some Reflections on Law and Policy","Political Science/International Relations/Poverty, Inequality, and Rights/Women's Issues           "
6025,"Conceptualising Globalisation and Human Rights: Boomerangs and Borders","Political Science/International Relations/Poverty, Inequality, and Rights/Human Rights           "
6026,"Strategies to End Gender Based Violence: The USAID approach","Political Science/International Relations/Poverty, Inequality, and Rights/Human Rights           "
6027,"The Human Rights NGOs: The Power of Persuasion","Political Science/International Relations/Poverty, Inequality, and Rights/Human Rights           "
6028,"Human Rights and Multinationals: Is there a Problem?","Political Science/International Relations/Poverty, Inequality, and Rights/Human Rights           "
6029,"Sexual Violence During Armed Conflict: Institutional & Judicial Responses","Political Science/International Relations/Poverty, Inequality, and Rights/Women's Issues           "
6030,"Inconsistency and Impunity in International Human Rights Law: Can the International Criminal Court Solve the Problems Raised by the Rwanda and Augusto Pinochet Cases","Political Science/International Relations/Poverty, Inequality, and Rights/Human Rights           "
6031,"Redefining the Child's Right to Identity","Political Science/International Relations/Poverty, Inequality, and Rights/Human Rights           "
6032,"Realizing the Right to Development","Political Science/International Relations/Poverty, Inequality, and Rights/Human Rights           "
6033,"Transnational Politics, International Relations Theory, and Human Rights: A New Model Of International Politics Is Needed To Explain The Politics Of Human Rights","Political Science/International Relations/Poverty, Inequality, and Rights/Human Rights           "
6034,"Corporate Voluntarism and Human Rights: The Adequacy and Effectiveness of Voluntary Self-regulation Regimes","Political Science/International Relations/Poverty, Inequality, and Rights/Human Rights           "
6035,"Globalization of Insecurity: The Democratic Imperative","Political Science/International Relations/Power, Alliance, Leadership, and Hegemony/Democratic Consolidation in the World           "
6036,"11 September and the Widening North-South Gap: Root Causes of Terrorism in the Global Order","Political Science/International Relations/Conflict, Peace, and Security/International Security           "
6037,"Peoples' Security versus National Security","Political Science/International Relations/Conflict, Peace, and Security/International Security           "
6038,"Caribbean Security: Retrospect and Prospect","Political Science/International Relations/Conflict, Peace, and Security/International Security           "
6039,"The Private Side of Global Governance: New Definitions of Development and Human Security","Political Science/International Relations/Conflict, Peace, and Security/International Security           "
6040,"Global Mobility, Inequality and Security","Political Science/International Relations/Globalization/Migration           "
6041,"Migration To Israel: The Mythology of “Uniqueness”","Sociology/Culture and Society/Globalization, Cultures, and Communication           "
6042,"New Patterns of Migration","Political Science/International Relations/Globalization/Migration           "
6043,"Migration, Globalisation and the Spirit of Peter Bauer","Political Science/International Relations/Globalization/Migration           "
6044,"Migration Research and Migration Policy Making: A Study of Australia, the Philippines, and Thailand","Political Science/International Relations/Globalization/Migration           "
6045,"The Encounter on Globalization, Migration, and Militarization: A Dialogue between NGOs","Political Science/International Relations/Globalization/Migration           "
6046,"The Migration-Development Nexus: Evidence and Policy Options","Political Science/International Relations/Globalization/Migration           "
6047,"The Migration-Development Nexus: Evidence and Policy Options State-of-the-Art Overview","Political Science/International Relations/Globalization/Migration           "
6048,"The Socio-economic and Cultural Impediments to Well-being along the US-Mexico Border","Political Science/International Relations/Globalization/Migration           "
6049,"The Spread of Nuclear Arms: The Necessity of Treaties","Political Science/International Relations/Global Treaties and Institutions/Multilateral Institutions and Treaties           "
6050,"The Chinese in Spain","Sociology/Culture and Society/Globalization, Cultures, and Communication           "
6051,"The Emerging Roles of NGOs in the UN System: From Article 71 to a People's Millennium Assembly","Political Science/International Relations/Global Treaties and Institutions/Multilateral Institutions and Treaties           "
6052,"U.S. Unilateralism at the UN: Why Great Powers Do Not Make Great Multilateralists","Political Science/International Relations/Global Treaties and Institutions/Multilateral Institutions and Treaties           "
6053,"Socialization of Permanent Representatives in the United Nations: Some Evidence","Political Science/International Relations/Global Treaties and Institutions/Multilateral Institutions and Treaties           "
6054,"The Oslo Land Mine Treaty and an Analysis of the United States Decision Not to Sign","Political Science/International Relations/Global Treaties and Institutions/Multilateral Institutions and Treaties           "
6055,"Globalism, Biodiversity, and the Third World","Political Science/International Relations/Global Treaties and Institutions/Multilateral Institutions and Treaties           "
6056,"Democratizing the International Monetary Fund and the World Bank: Governance and Accountability","Political Science/International Relations/Global Treaties and Institutions/Multilateral Institutions and Treaties           "
6057,"New Bridges Across the Chasm: Macro and Institutional Strategies for Transitional Economies","Economics/Development/Transition from Socialism to Markets           "
6058,"Home, Work and Community: Skilled International Migration and Expatriate Women in Singapore","Sociology/Culture and Society/Globalization, Cultures, and Communication           /           /History/World/Global History/Migration/Migration Patterns"
6059,"South Pacific Agendas in the Quest to Protect Natural Areas","Political Science/International Relations/Environmental Issues           "
6060,"The United Nations Rediscovered?","Political Science/International Relations/Global Treaties and Institutions/Multilateral Institutions and Treaties           "
6061,"Challenges in the Governance of North-South Solidarity in the Age of Globalization","Political Science/International Relations/NorthSouth Relations and Politics of Development           "
6062,"International Co-operation: Towards a European View","Political Science/International Relations/NorthSouth Relations and Politics of Development           "
6063,"Challenges to Development: The North-South Roundtable (NSRT) in Perspective","Political Science/International Relations/NorthSouth Relations and Politics of Development           "
6064,"Vulnerable Women and Neo-Liberal Globalization: Debt Burdens Undermine Women's Health in the Global South","Political Science/International Relations/Poverty, Inequality, and Rights/Women's Issues           "
6065,"The Politics of Inclusion and Exclusion: Fortress Europe and the Reproductive Rights Agenda","Political Science/International Relations/Poverty, Inequality, and Rights/Women's Issues           "
6066,"Global Justice, Capitalism and the Third World","Political Science/International Relations/NorthSouth Relations and Politics of Development           "
6067,"Trade and Competitiveness of African Economies in the 21st Century","Political Science/International Relations/NorthSouth Relations and Politics of Development           "
6068,"Spiritual Wealth and Neo-Orientalism","Sociology/Culture and Society/Globalization, Cultures, and Communication           "
6069,"Poorest Nations and Development Co-operation: In Search of an Elusive Ethic","Political Science/International Relations/NorthSouth Relations and Politics of Development           "
6070,"Global Growth through Third World Technological Progress","Political Science/International Relations/NorthSouth Relations and Politics of Development           "
6071,"Investing or Squandering Social Capital? Community-Based Organizations for Indigent Health Care","Political Science/International Relations/NorthSouth Relations and Politics of Development           "
6072,"Paths to Sustainability","Political Science/International Relations/NorthSouth Relations and Politics of Development           "
6073,"Foreign Aid, Poverty Reduction, and Democracy","Political Science/International Relations/Power, Alliance, Leadership, and Hegemony/Democratic Consolidation in the World           "
6074,"The Political Enforcement of Liberalism: Bargaining, Institutions, and Auto Multinationals in Hungary","Political Science/International Relations/Power, Alliance, Leadership, and Hegemony/Democratic Consolidation in the World           "
6075,"Donor Characteristics and the Dispersion of Foreign Assistance","Political Science/International Relations/NorthSouth Relations and Politics of Development           "
6076,"The New 'Partnership' Era: But where is the Third Partner?","Political Science/International Relations/NorthSouth Relations and Politics of Development           "
6077,"What Happens to the State in Conflict?: Political Analysis as a Tool for Planning Humanitarian Assistance","Political Science/International Relations/Power, Alliance, Leadership, and Hegemony/Democratic Consolidation in the World           "
6078,"Between the Global and the Local There are Regions, Culture Areas and National States: A Review Article","Sociology/Culture and Society/Globalization, Cultures, and Communication           "
6079,"Good Governance: The Metamorphosis of a Policy Metaphor","Political Science/International Relations/Power, Alliance, Leadership, and Hegemony/Democratic Consolidation in the World           "
6080,"Social Reconstruction and the Radicalization of Development: Aid as a Relation of Global Liberal Governance","Political Science/International Relations/Power, Alliance, Leadership, and Hegemony/Democratic Consolidation in the World           "
6081,"The Politics of Food Aid: John F. Kennedy and Famine in China","Political Science/International Relations/NorthSouth Relations and Politics of Development           "
6082,"Fighting Governmental Corruption: The New World Bank Programme Evaluated","Political Science/International Relations/NorthSouth Relations and Politics of Development           "
6083,"Does Foreign Aid Promote Democracy?","Political Science/International Relations/Power, Alliance, Leadership, and Hegemony/Democratic Consolidation in the World           "
6084,"Whose Civil Society? Whose Governance? Decisionmaking and Practice in the New Agenda at the Inter-American Development Bank and the World Bank","Political Science/International Relations/NorthSouth Relations and Politics of Development           "
6085,"Private Voluntary Aid and Nation Building in South Vietnam: The Humanitarian Politics of CARE, 1954-61","Political Science/International Relations/NorthSouth Relations and Politics of Development           "
6086,"The Politics of Aid: The Normatives of Giving and Receiving","Political Science/International Relations/NorthSouth Relations and Politics of Development           "
6087,"Traditional Aid is Passé ... And there is Not Enough of It","Political Science/International Relations/NorthSouth Relations and Politics of Development           "
6088,"The Politics of Aid and Development in a Globalizing World","Political Science/International Relations/NorthSouth Relations and Politics of Development           "
6089,"Public Support and the Politics of Aid","Political Science/International Relations/NorthSouth Relations and Politics of Development           "
6090,"The Political Economy of Reform: The Politics of Aid","Political Science/International Relations/NorthSouth Relations and Politics of Development           "
6091,"Development Aid and Structural Violence: The Case of Rwanda","Political Science/International Relations/NorthSouth Relations and Politics of Development           "
6092,"The Gendered Time Politics of Globalization: Of Shadowlands and Elusive Justice","Political Science/International Relations/Globalization/Politics of Globalization           "
6093,"Citizens, Residents, and Aliens in a Changing World: Political Membership in the Global Era","Political Science/International Relations/Power, Alliance, Leadership, and Hegemony/Democratic Consolidation in the World           "
6094,"International Regimes and Democratic Governance: Political Equality and Influence in Global Institutions","Political Science/International Relations/Power, Alliance, Leadership, and Hegemony/Democratic Consolidation in the World           "
6095,"The Global Transformation of National Health Systems","Political Science/International Relations/Globalization/Politics of Globalization           "
6096,"Globalization and the Erosion of Democracy","Political Science/International Relations/Globalization/Politics of Globalization           "
6097,"New Threats to Human Security in the Era of Globalization","Political Science/International Relations/Globalization/Politics of Globalization           "
6098,"The End of Nature","Sociology/Culture and Society/Nature           "
6099,"A Deleuzian Critique of Resource-use Management Politics in Industria","Political Science/International Relations/Globalization/Politics of Globalization           "
6100,"The Impact of Globalization on Civil Liberties: Asian vs. Non-Asian States","Political Science/International Relations/Globalization/Politics of Globalization           "
6101,"Global Crisis and Latin America","Political Science/International Relations/Globalization/Politics of Globalization           "
6102,"Globalization, Inequality and Global Protest","Political Science/International Relations/Globalization/Politics of Globalization           "
6103,"Science, Research, Knowledge and Capacity Building","Political Science/International Relations/Globalization/Politics of Globalization           "
6104,"Making Globalization Work for Better Health","Political Science/International Relations/Globalization/Politics of Globalization           "
6105,"The Scorecard on Globalization 1980-2000: Its Consequences for Economic and Social Well-being","Political Science/International Relations/Globalization/Politics of Globalization           "
6106,"The Second Great Transformation: The Politics of Globalisation in the Global North","Political Science/International Relations/Globalization/Politics of Globalization           "
6107,"Medicine, Health, and Society: Health and Society","Sociology/Culture and Society/Nature           "
6108,"The Global Problematique","Political Science/International Relations/Poverty, Inequality, and Rights/Poverty and Global Inequality           "
6109,"Constitutionalizing Inequality and the Clash of Globalizations","Political Science/International Relations/Poverty, Inequality, and Rights/Poverty and Global Inequality           "
6110,"The Secular Salvation Story of the Digital Divide","Political Science/International Relations/Poverty, Inequality, and Rights/Poverty and Global Inequality           "
6111,"Global Inequality: Bringing Politics Back In","Political Science/International Relations/Poverty, Inequality, and Rights/Poverty and Global Inequality           "
6112,"A Critical Reflection on Globalisation and Inequality: A New Approach to the Development of the South","Political Science/International Relations/Poverty, Inequality, and Rights/Poverty and Global Inequality           "
6113,"Reconstituting the 'Third World'? Poverty Reduction and Territoriality in the Global Politics of Development","Political Science/International Relations/Poverty, Inequality, and Rights/Poverty and Global Inequality           "
6114,"Hegemony in Two Paradigms","Political Science/International Relations/Power, Alliance, Leadership, and Hegemony/Regionalism, Power Blocs, and Hegemony           "
6115,"The Balance of Power","Political Science/International Relations/Power, Alliance, Leadership, and Hegemony/Regionalism, Power Blocs, and Hegemony           "
6116,"Inside Nature","Sociology/Culture and Society/Nature           "
6117,"US Foreign Relations in the Twentieth Century: From World Power to Global Hegemony","Political Science/International Relations/Power, Alliance, Leadership, and Hegemony/Regionalism, Power Blocs, and Hegemony           "
6118,"Solidarity in the Age of Globalization: Lessons from the Anti-MAI and Zapatista Struggles","Political Science/International Relations/Power, Alliance, Leadership, and Hegemony/Regionalism, Power Blocs, and Hegemony           "
6119,"Caring at a Distance: Gift Theory, Aid Chains and Social Movements","Political Science/International Relations/Power, Alliance, Leadership, and Hegemony/Regionalism, Power Blocs, and Hegemony           "
6120,"The EU, NATO, and the Extension of Institutional Order in Europe","Political Science/International Relations/Power, Alliance, Leadership, and Hegemony/Regionalism, Power Blocs, and Hegemony           "
6121,"The Unfinished Business: Conflicts, the African Union and the New Partnership for Africa's Development","Political Science/International Relations/Power, Alliance, Leadership, and Hegemony/Regionalism, Power Blocs, and Hegemony           "
6122,"The Fight against Terrorism: Where's NATO?","Political Science/International Relations/Power, Alliance, Leadership, and Hegemony/Regionalism, Power Blocs, and Hegemony           "
6123,"Regulating Economic Globalization","Political Science/International Relations/Global Treaties and Institutions/Trade and Economic Politics           "
6124,"Regions and Interaction Networks: An Institutional-Materialist Perspective","Sociology/Culture and Society/Nature           "
6125,"Will Globalization go Bankrupt?","Political Science/International Relations/Global Treaties and Institutions/Trade and Economic Politics           "
6126,"Ethical Development and the Social Impact of Globalization","Political Science/International Relations/Global Treaties and Institutions/Trade and Economic Politics           "
6127,"Patent Necessity: Intellectual Property Dilemmas in the Biotech Domain & Treatment Equity for Developing Countries","Political Science/International Relations/Global Treaties and Institutions/Trade and Economic Politics           "
6128,"A Review of WTO and Environmental Issues","Political Science/International Relations/Global Treaties and Institutions/Trade and Economic Politics           "
6129,"The Failure of Globalisation","Political Science/International Relations/Globalization/Transnational Corporations and Sovereignty           "
6130,"Human Rights, Corporate Wrongs?","Political Science/International Relations/Globalization/Transnational Corporations and Sovereignty           "
6131,"Crossing Borders: Global Civil Society and the Reconfiguration of Transnational Political Space","Political Science/International Relations/Globalization/Transnational Corporations and Sovereignty           "
6132,"Engaging the Private Sector","Political Science/International Relations/Globalization/Transnational Corporations and Sovereignty           "
6133,"The Role of the Concept of the Natural (Naturalness) in Organic Farming","Sociology/Culture and Society/Nature           "
6134,"Treading the Sacred Ground","Political Science/International Relations/Globalization/Transnational Corporations and Sovereignty           "
6135,"NGO Strategies for Promoting Corporate Social Responsibility","Political Science/International Relations/Globalization/Transnational Corporations and Sovereignty           "
6136,"The Political Economy of Zimbabwe's Descent into Conflict","Political Science/International Relations/Conflict, Peace, and Security/War and Conflict Resolution           "
6137,"The Development Imperative: Creating the Preconditions for Peace","Political Science/International Relations/Conflict, Peace, and Security/War and Conflict Resolution           "
6138,"Getting Beyond New York: Reforming Peacekeeping in the Field","Political Science/International Relations/Conflict, Peace, and Security/War and Conflict Resolution           "
6139,"System of Disparate Exchange","Political Science/International Relations/Conflict, Peace, and Security/War and Conflict Resolution           "
6140,"Peace Operations Finance and the Political Economy of a Way Out: Living Off the Land","Political Science/International Relations/Conflict, Peace, and Security/War and Conflict Resolution           "
6141,"The New Interventionism","Political Science/International Relations/Conflict, Peace, and Security/War and Conflict Resolution           "
6142,"Water in the Middle East Peace Process","Political Science/International Relations/Environmental Issues           "
