3599,"Does International Harmonization of Environmental Policy Instruments Make Economic Sense?","Economics/Economic Policy/Environment/Theory and Policy Analysis           "
3600,"Towards a New Approach to Income Distribution and Environmental Sustainability","Economics/Economic Policy/Environment/Theory and Policy Analysis           "
3601,"Unpackaging the Environment","Economics/Economic Policy/Environment/Theory and Policy Analysis           "
3602,"Limits and Cycles of Environmental Policy","Economics/Economic Policy/Environment/Theory and Policy Analysis           "
3603,"Economic Policy and Sustainable Natural Resource","Economics/Economic Policy/Environment/Sustainability           "
3604,"Priorities for a Sustainable Future: The Role of Education, the Media, and Tax Reform","Economics/Economic Policy/Environment/Sustainability           "
3605,"Ecological Economic Policy for Sustainable Development: Potentials and Domains of Intervention for Delinking Approaches","Economics/Economic Policy/Environment/Sustainability           "
3606,"The Creation of Waste","Economics/Economic Policy/Environment/Sustainability           "
3607,"Sustainable Development - A New Challenge for the Countries in Central and Eastern Europe","Economics/Economic Policy/Environment/Sustainability           "
3608,"Incentives for Technology Adoption Under Environmental Policy Uncertainty: Implications for Green Payment Programs","Economics/Economic Policy/Environment/Markets           "
3609,"Finding a Precautionary Approach to Technological Developments - Lessons for the Evaluation of GM Crops","Economics/Economic Policy/Environment/Markets           "
3610,"Green and Competitive: Ending the Stalemate","Economics/Economic Policy/Environment/Markets           "
3611,"Recuperating from Market Failure: Planning for Biodiversity and Technological Competitiveness","Economics/Economic Policy/Environment/Markets           "
3612,"The Macroeconomics of Food and Agriculture","Economics/Growth, Allocation and Distribution/Factors of Growth/Agriculture           "
3613,"A Political Economy in an Ecological Web","Economics/Economic Policy/Environment/Theory and Policy Analysis           "
3614,"On Impatience, Economic Growth and the Environmental Kuznets Curve: A Dynamic Analysis of Resource Management","Economics/Economic Policy/Environment/Theory and Policy Analysis           "
3615,"Ecology and Freedom: Political Economy and Ecology: Marx and Illich","Economics/Economic Policy/Environment/Theory and Policy Analysis           "
3616,"Solving the Production and Processing Methods (PPMs) Puzzle","Economics/Economic Policy/Environment/Markets           "
3617,"Evaluation of Urban Sustainability in Specific Sectors in Latvia","Economics/Economic Policy/Environment/Sustainability           "
3618,"Proposal of Indicators to Assess Urban Sustainability in Brazil","Economics/Economic Policy/Environment/Sustainability           "
3619,"The Revolution in Welfare Economics and Its Implications for Environmental Valuation and Policy","Economics/Economic Policy/Environment/Valuation           "
3620,"Measuring Asset Values and Flow Benefits of Non-Traded Products and Ecosystems Services of Forest and Woodland Resources in South Africa","Economics/Economic Policy/Environment/Valuation           "
3621,"For an Anthropology of Ethics and Freedom","Anthropology/Methods and Approaches/Idealism           "
3622,"Introduction and Valuing the Environment","Economics/Economic Policy/Environment/Valuation           "
3623,"Making Environmental Decisions (1): The Limits of Cost-Benefit Analysis","Economics/Economic Policy/Environment/Valuation           "
3624,"Markets and Ecosystems","Economics/Economic Policy/Ecology and Natural Resources           "
3625,"Making Water Competition a Reality","Economics/Economic Policy/Ecology and Natural Resources           "
3626,"Water for Sustainable Development in Africa","Economics/Economic Policy/Ecology and Natural Resources           "
3627,"Growth, Crisis, and Recovery in East Asia","Economics/Economic Policy/Financial Crises and Recovery Efforts           "
3628,"Exchange Rate Policy Options for Post-Crisis Southeast Asia: Is There a Case for Currency Baskets?","Economics/Economic Policy/Financial Crises and Recovery Efforts           "
3629,"Responding to Economic Crises: Policy Alternatives for Equitable Recovery and Development","Economics/Economic Policy/Financial Crises and Recovery Efforts           "
3630,"Russian Agriculture during Putin's First Term and Beyond","Economics/Growth, Allocation and Distribution/Factors of Growth/Agriculture           "
3631,"Neoliberal Finance and Crisis in the Developing World","Economics/Economic Policy/Financial Crises and Recovery Efforts           "
3632,"The Argentine Crisis","Economics/Economic Policy/Financial Crises and Recovery Efforts           "
3633,"What Can Countries do to Avoid a Financial Crisis?","Economics/Economic Policy/Financial Crises and Recovery Efforts           "
3634,"Comparative Analysis and Economic Policies with Special Reference to Financial Crises","Economics/Economic Policy/Financial Crises and Recovery Efforts           "
3635,"Currency and Financial Crises in Turkey 2000-2001: Bad Fundamentals or Bad Luck?","Economics/Economic Policy/Financial Crises and Recovery Efforts           "
3636,"Capital Market Crises: Liberalisation, Fixed Exchange Rates and Market-driven Destabilisation","Economics/Economic Policy/Financial Crises and Recovery Efforts           "
3637,"Financial Structure and Financing Models: the Brazilian Experience over the 1964-1997 Period","Economics/Economic Policy/Financial Crises and Recovery Efforts           "
3638,"Does Financial Structure Matter?","Economics/Economic Policy/Financial Crises and Recovery Efforts           "
3639,"Financialization and the Role of Real Estate in Hong Kong's Regime of Accumulation","Economics/Economic Policy/Financial Crises and Recovery Efforts           "
3640,"Stigmatized Spaces: Gender and Mobility under Crisis in South Sulawesi, Indonesia","Economics/Economic Policy/Financial Crises and Recovery Efforts           "
3641,"Fiscal Crisis and Fiscal Reform in Developing Countries","Economics/Economic Policy/Fiscal Policy/Government Policies           "
3642,"Military Spending as Another Cause of the Failure of the PPP","Economics/Economic Policy/Fiscal Policy/Government Policies           "
3643,"Public Enterprises in Developing Countries and Economic Efficiency: A Critical Examination of Analytical, Empirical and Policy Issues","Economics/Economic Policy/Fiscal Policy/Government Policies           "
3644,"The Political Economy of Industrial Policy","Economics/Economic Policy/Economic Management and Reforms           "
3645,"The Big Fix: The Case for Public Spending","Economics/Economic Policy/Fiscal Policy/Government Policies           "
3646,"On Constraining Fiscal Policy Discretion in EMU","Economics/Economic Policy/Fiscal Policy/Social/Political Issues           "
3647,"The Brazilian Swindle and the Larger International Monetary Problem","Economics/Economic Policy/Fiscal Policy/Social/Political Issues           "
3648,"Government Spending and Welfare with Returns to Specialization","Economics/Economic Policy/Fiscal Policy/Social/Political Issues           "
3649,"Crop Insurance in a Political Economy: An Alternative Perspective on Agricultural Policy","Economics/Economic Policy/Fiscal Policy/Government Policies           "
3650,"Work vs. Freedom: A Liberal Challenge to Employment Subsidies","Economics/Economic Policy/Fiscal Policy/Government Policies           "
3651,"Mine Closure Legislation in Indonesia: The Role of Mineral Industry Involvement","Economics/Development/Agrarian Economy and Society/Agriculture and Industry           "
3652,"Survey on Kuwait: Maintaining Checks and Balances","Economics/Economic Policy/Fiscal Policy/Government Policies           "
3653,"Inflation, Taxes, and the Coordination of Monetary and Fiscal Policy by Use of a Game of Chicken","Economics/Economic Policy/Fiscal Policy/Government Policies           "
3654,"Direct Versus Indirect Taxation: The Design of the Tax Structure Revisited","Economics/Economic Policy/Fiscal Policy/Government Policies           "
3655,"Tax Uncertainty and Investment: A Cross-Country Empirical Examination","Economics/Economic Policy/Fiscal Policy/Government Policies           "
3656,"Distinguishing Development Incentives from Developer Give-aways: A Critical Guide for Development Practitioners and Citizens","Economics/Economic Policy/Fiscal Policy/Government Policies           "
3657,"Strategies for Fiscal Reform in the Context of the EMU: the Case of Portugal","Economics/Economic Policy/Fiscal Policy/Government Policies           "
3658,"The Case for Fiscal Policy","Economics/Economic Policy/Fiscal Policy/Theory           "
3659,"Reinventing Fiscal Policy","Economics/Economic Policy/Fiscal Policy/Theory           "
3660,"Local Government Support for Women in the Informal Economy in Durban, South Africa","Economics/Economic Policy/Fiscal Policy/Social/Political Issues           "
3661,"Sociobiology and Creationism: Two Ethnosociologies of American Culture","Anthropology/Methods and Approaches/Idealism           "
3662,"The Role of the State in Agricultural Development","Economics/Economic Policy/Food and Agricultural Policies           "
3663,"The Impact of Changing Affluence on Diets and Demand Patterns for Agricultural Commodities","Economics/Economic Policy/Food and Agricultural Policies           "
3664,"Introduction to Food Policy Analysis","Economics/Economic Policy/Food and Agricultural Policies           "
3665,"Marketing Functions, Markets, and Food Price Formation","Economics/Economic Policy/Food and Agricultural Policies           "
3666,"The Formation of Indonesian Rice Policy: A Historical Perspective","Economics/Economic Policy/Food and Agricultural Policies           "
3667,"Food Prices and Agricultural Development: The Relevance of the Asian Experience to Africa","Economics/Economic Policy/Food and Agricultural Policies           "
3668,"Macro Prices and Structural Change","Economics/Economic Policy/Food and Agricultural Policies           "
3669,"Mises and Bastiat on How Democracy Goes Wrong, Part I","Economics/Economic Policy/Governance and Forms of Governments           "
3670,"Mises and Bastiat on How Democracy Goes Wrong, Part II","Economics/Economic Policy/Governance and Forms of Governments           "
3671,"Redistribution with Growth? The Dilemmas of State-Sponsored Economic Development in Malaysia","Economics/Growth, Allocation and Distribution/Factors of Growth/Case Studies           "
3672,"Autonomy and Sovereignty in the Era of Global Restructuring","Economics/Economic Policy/Governance and Forms of Governments           "
3673,"Imperialism and International Governance: the Case of US Policy Towards Africa","Economics/Economic Policy/Governance and Forms of Governments           "
3674,"Reframing Development and Accountability: The Influence of Sovereign Credit Ratings on Policy Making in Developing Countries","Economics/Economic Policy/Governance and Forms of Governments           "
3675,"Local Social Knowledge Management: Community Actors, Institutions and Multilevel Governance in Regional Foresight Exercises","Economics/Economic Policy/Governance and Forms of Governments           "
3676,"Governance, Democracy and Recent Political Struggles in Mainland Tanzania","Economics/Economic Policy/Governance and Forms of Governments           "
3677,"The Determinants of Gender Equity in India: Examining Dyson and Moore's Thesis with New Data","Economics/Economics as a Social Science/Economic Ideas/Women and Families           "
3678,"Another Lost Decade? The Future of Reform in Latin America","Economics/Economic Policy/Economic Management and Reforms           "
3679,"Theorizing the State in Local Economic Governance","Economics/Economic Policy/Governance and Forms of Governments           "
3680,"Form of Government, Administrative Organization, and Local Economic Development Policy","Economics/Economic Policy/Governance and Forms of Governments           "
3681,"Political Process and the Formation of Economic Policy","Economics/Economic Policy/Governance and Forms of Governments           "
3682,"A Political Economy Approach to the Neoclassical Model of Transition","Economics/Economic Policy/Governance and Forms of Governments           "
3683,"The Future of the European “Social Model” in the Global Economy","Economics/Economic Policy/Governance and Forms of Governments           "
3684,"Planning in the Welfare State","Economics/Economic Policy/Governance and Forms of Governments           "
3685,"Should Banks Be Narrowed?","Economics/Economic Policy/Institutions/Capital Markets           "
3686,"Public Finance, Government Spending and Economic Growth: the Case of Local Governments in Brazil","Economics/Growth, Allocation and Distribution/Factors of Growth/Case Studies           "
3687,"A Signal of Imperfect Portfolio Capital Adjustments from the Domestic and Foreign Colombian Debt","Economics/Economic Policy/Institutions/Capital Markets           "
3688,"Public Investment and the Risk Premium for Equity","Economics/Economic Policy/Institutions/Capital Markets           "
3689,"Economic Theory and Social Problems: The Changing Basis of Economic Responsibility","Economics/Development/Markets/Corporate Social and Environmental Impacts           "
3690,"Beyond Good Deeds: For Multinational Corporations to Adopt Socially Responsible Business Practices, Voluntary Measures Are Not Enough","Economics/Development/Markets/Corporate Social and Environmental Impacts           "
3691,"Public and Private Partnerships","Economics/Development/Markets/Corporate Social and Environmental Impacts           "
3692,"Corporate Objectives-Maximizing Social versus Private Equity","Economics/Development/Markets/Corporate Social and Environmental Impacts           "
3693,"Corruption Under Moral Hazard","Economics/Economic Policy/Institutions/Corruption           "
3694,"Anthropology and Historicity","Anthropology/Methods and Approaches/Marxian and NeoMarxian Approaches           "
3695,"State, Corruption, and Criminalization in China","Economics/Economic Policy/Institutions/Corruption           "
3696,"Bribes in a Supply Line","Economics/Economic Policy/Institutions/Corruption           "
3697,"Oil, Diamonds, and Sunlight: Fostering Human Rights Through Transparency in Revenues from Natural Resources","Economics/Economic Policy/Institutions/Corruption           "
3698,"Institutional Structure and Deindustrialization","Economics/Economic Policy/Institutions/Theory and Policy           "
3699,"Has the Hong Kong Model Worked? Industrial Policy in Retrospect and Prospect","Economics/Economic Policy/Economic Management and Reforms           "
3700,"The Issues Involved in the Reform of the Bulgarian Judicial System","Economics/Economic Policy/Institutions/Justice           "
3701,"In Search of a Democratic Justice: What Courts Should Not Do: Argentina, 1983-2002","Economics/Economic Policy/Institutions/Justice           "
3702,"Trade Liberalization and Industrial Growth in Pakistan: A Cointegration Analysis","Economics/Growth, Allocation and Distribution/Factors of Growth/Case Studies           "
3703,"Authentic NGDO Partnerships in the New Policy Agenda for International Aid: Dead End or Light Ahead?","Economics/Economic Policy/Institutions/NGOs and Civil Society           "
3704,"Development NGOs and the Challenge of Partnership: Changing Relations between North and South","Economics/Economic Policy/Institutions/NGOs and Civil Society           "
3705,"Poverty Reach","Economics/Economic Policy/Institutions/NGOs and Civil Society           "
3706,"Transparency and Accountability in Non-Governmental Development Actions","Economics/Economic Policy/Institutions/NGOs and Civil Society           "
3707,"Some Aspects of State-NGO Relationships in India in the Post-Independence Era","Economics/Economic Policy/Institutions/NGOs and Civil Society           "
3708,"NGOs, Civil Society, and the State in Bangladesh: The Politics of Representing the Poor","Economics/Economic Policy/Institutions/NGOs and Civil Society           "
3709,"Retirement and the Parable of the Fishermen","Economics/Economic Policy/Institutions/Regulation/Deregulation           "
3710,"Globalisation, Uneven Development and Marginalisation: Dairy Restructuring in New South Wales","Economics/Economic Policy/Institutions/Regulation/Deregulation           "
3711,"Fieldwork and the Commodification of Culture: Why the Natives are Restless","Anthropology/Methods and Approaches/Marxian and NeoMarxian Approaches           "
3712,"A Few Things Transport Regulators Should Know About Risk and the Cost of Capital","Economics/Economic Policy/Institutions/Regulation/Deregulation           "
3713,"Flexible Production and Political Decentralization in the Developing World: Elective Affinities in the Pursuit of Competitiveness?","Economics/Economic Policy/Institutions/Regulation/Deregulation           "
3714,"Government Intervention in a Dynamic Economy","Economics/Economic Policy/Institutions/Regulation/Deregulation           "
3715,"Economic Reforms in Colombia: Regulation and Deregulation, 1990-94, v. 1","Economics/Economic Policy/Institutions/Regulation/Deregulation           "
3716,"Are We All Keynesians (Again)?","Economics/Economic Policy/Institutions/Regulation/Deregulation           "
3717,"Tanzania: Formalising the Informal","Economics/Economic Policy/Institutions/Regulation/Deregulation           "
3718,"State, Institutions and Structural Change","Economics/Economic Policy/Institutions/Theory and Policy           "
3719,"The Penalties of Inefficient Infrastructure","Economics/Growth, Allocation and Distribution/Factors of Growth/Case Studies           "
3720,"Introduction: Open Markets versus Welfare Citizenship: Conflicting Approaches to Policy Convergence in Europe","Economics/Economic Policy/Institutions/Theory and Policy           "
3721,"Theorizing the “Third Sphere”: A Critique of the Persistence of the “Economistic Fallacy”","Economics/Economic Policy/Theory of Economic Policy           /           /Economics/Economic Policy/Institutions/NGOs and Civil Society/           /Economics/Economics as a Social Science/Economic Ideas/Women and Families"
3722,"The Methodology of Economics and the Survival Principle Revisited and Revised: Some Welfare and Public Policy Implications of Modeling the Economic Agent","Economics/Economic Policy/Theory of Economic Policy           /           /Economics/Economics as a Social Science/Alternatives to Mainstream Economics/Behavioral Economics"
3723,"Decision Tools for Public Policy: Can We Do without Economics?","Economics/Economic Policy/Theory of Economic Policy           "
3724,"Keynesian Theorizing During Hard Times: Stock-Flow Consistent Models as an Unexplored “Frontier” of Keynesian Macroeconomics","Economics/Economic Policy/Theory of Economic Policy           "
3725,"Two Views on the Obstacles to Development (Part II: Wordly Philosophy and Twenty-First Century Capitalism)","Economics/Economic Policy/Theory of Economic Policy           "
3726,"The Geography of Segmentation of Informal Labor Markets: The Case of Motor Vehicle Repair in Calcutta","Economics/Economic Policy/Labor Markets           "
3727,"Sustainable Livelihoods: The Poor's Reconciliation of Environment and Development","Economics/Development/Community, Participation and Human Development           "
3728,"Do Workers with Low Lifetime Earnings Really Have Low Earnings Every Year?: Implications for Social Security Reform","Economics/Economic Policy/Labor Markets           "
3729,"To Honor and Obey: Efficiency, Inequality, and Patriarchal Property Rights","Economics/Economic Policy/Labor Markets           "
3730,"Women and Work in a Sustainable Society","Economics/Economic Policy/Labor Markets           "
3731,"Gender Inequalities in Regional Development","Economics/Economic Policy/Labor Markets           "
3732,"The Future of Public Pensions in the OECD","Economics/Economic Policy/Labor Markets           "
3733,"Employment and Unemployment in the New Market Economies","Economics/Economic Policy/Labor Markets           "
3734,"Rural-Urban Migration, the Informal Sector, Urban Unemployment, and Development Policies: A Theoretical Analysis","Economics/Economic Policy/Labor Markets           "
3735,"How to Reduce Unemployment, If We Want","Economics/Economic Policy/Labor Markets           "
3736,"Integration of Unemployment Insurance with Retirement Insurance","Economics/Economic Policy/Labor Markets           "
3737,"The Minimum Wage and the Cause of Democracy","Economics/Economic Policy/Labor Markets           "
3738,"The Minimum Wage and Regional Wage Structure: Implications for Income Distribution","Economics/Economic Policy/Labor Markets           "
3739,"The Economics and Ethics of Minimum Wage Legislation","Economics/Economic Policy/Labor Markets           "
3740,"Economic Constraints on Production and Consumption of Animal Source Foods for Nutrition in Developing Countries","Economics/Economic Policy/Market Formation and Regulation           "
3741,"Chance, Necessity, and Mode of Production: A Marxist Critique of Cultural Evolutionism","Anthropology/Methods and Approaches/Marxian and NeoMarxian Approaches           "
3742,"The Rise of Supermarkets in Africa, Asia, and Latin America","Economics/Economic Policy/Market Formation and Regulation           "
3743,"Interactive Economic Policy: Toward a Cooperative Policy Approach for a Negotiated Economy","Economics/Economic Policy/Market Formation and Regulation           "
3744,"A Simplified, Globally Competitive Economic Development Policy Framework","Economics/Economic Policy/Market Formation and Regulation           "
3745,"Jobs, Productivity, and Local Economic Development: What Implications Does Economic Research Have for the Role of Government?","Economics/Economic Policy/Market Formation and Regulation           "
3746,"How Would You Know a Good Economic Development Policy if You Tripped Over One? Hint: Don't Just Count Jobs","Economics/Economic Policy/Market Formation and Regulation           "
3747,"Imperfect Competition and Macroeconomics: A Survey","Economics/Economic Policy/Market Formation and Regulation           "
3748,"Community Competition Policy and Economic and Social Cohesion","Economics/Economic Policy/Market Formation and Regulation           "
3749,"State, Steel and Strength: Structural Competitiveness and Development in South Korea","Economics/Economic Policy/Market Formation and Regulation           "
3750,"On the Effectiveness of Economic Policy when Competition is Imperfect and Expectations are Rational","Economics/Economic Policy/Market Formation and Regulation           "
3751,"Conflicts and Conflict Resolution in International Anti-trust: Do We Need International Competition Rules?","Economics/Economic Policy/Market Formation and Regulation           "
3752,"The Ethics of Competition","Economics/Economic Policy/Market Formation and Regulation           "
3753,"Competitive Equilibrium","Economics/Economic Policy/Market Formation and Regulation           "
3754,"The Supply Curve under Perfect Competition","Economics/Economic Policy/Market Formation and Regulation           "
3755,"Impact Assessment of Microfinance Using Qualitative Dates: Communicating Between Social Scientists and Practitioners Using the QUIP","Economics/Economic Policy/Market Formation and Regulation           "
3756,"Small is Indeed Beautiful But ...: The Context of Microcredit Strategies in Nepal","Economics/Economic Policy/Market Formation and Regulation           "
3757,"Toward a Theory of Culture and Class: An Iberian Example","Anthropology/Methods and Approaches/Marxian and NeoMarxian Approaches           "
3758,"The Impact of Microfinance in Local Financial Markets: A Case Study from Kenya","Economics/Economic Policy/Market Formation and Regulation           "
3759,"Wider Impacts of Microfinance Institutions: Issues and Concepts","Economics/Economic Policy/Market Formation and Regulation           "
3760,"From Segmented Markets to Integrated Markets: an Analysis of Economic Integration and Antidumping Legislation","Economics/Economic Policy/Market Formation and Regulation           "
3761,"A World of Monopolies","Economics/Economic Policy/Market Formation and Regulation           "
3762,"Firms in a Neoliberal Transition: The Case of Mexico 1990-1994","Economics/Economic Policy/Neoliberal Regime           "
3763,"Competition Law and Commodity Markets: The Case of Wholesale Electricity","Economics/Economic Policy/Market Formation and Regulation           "
3764,"Markets and Power","Economics/Economic Policy/Market Formation and Regulation           "
3765,"Public-Value Failure: When Efficient Markets May Not Do","Economics/Development/Markets/Social Values           "
3766,"Expressing Values in Agricultural Markets: An Economic Policy Perspective","Economics/Development/Markets/Social Values           "
3767,"Educational and Economic Reforms, Gender Equity, and Access to Schooling in Africa","Economics/Growth, Allocation and Distribution/Factors of Growth/Education           /           /Economics/WellBeing/The Economy and WellBeing"
3768,"The Place of Values in Social Policy","Economics/Development/Markets/Social Values           "
3769,"A Socioeconomic Perspective","Economics/Development/Markets/Social Values           "
3770,"Is Dollarization Good for Cambodia?","Economics/Economic Policy/Monetary Policy           "
