5698,"The Effect of Education on Nationalism and Ethnic Exclusionism: An International Comparison",0162-895X,"Coenders, Marcel; Scheepers, Peer","Social Psychology/Applied Social Psychology/Education and Socialization           "
5699,"Distributed Cognition and the Shared Knowledge Model of the Mazahua: A Cultural Approach",1093-023X,"De Haan, Mariette","Social Psychology/Applied Social Psychology/Education and Socialization           "
5700,"Anti-Smoking Socialization Beliefs among Rural Native American and White Parents of Young Children",0268-1153,"Kegler, Michelle C; Malcoe, Lorraine Halinka","Social Psychology/Applied Social Psychology/Education and Socialization           "
5701,"Rethinking Literacy and Women's Health: A Bangladesh Case Study",0739-9332,"Mayuzumi, Kimine","Social Psychology/Applied Social Psychology/Education and Socialization           "
5702,"The French Colonial Policy of Assimilation and the Civility of the Originaires of the Four Communes (Senegal): A Nineteenth Century Globalization Project",0012-155X,"Diouf, Mamadou","Sociology/Culture and Society/Cultural Politics           "
5703,"Changes in Euro-American Values Needed for Sustainability",0022-4537,"Clark, Mary E.","Social Psychology/Applied Social Psychology/Environment and Sustainability           "
5704,"Global Concern for the Environment: Is Affluence a Prerequisite?",0022-4537,"Dunlap, Riley E.; Mertig, Angela G.","Social Psychology/Applied Social Psychology/Environment and Sustainability           "
5705,"Cognitive Dissonance and Energy Conservation",0021-9010,"Kantola, S. J.; Syme, Geoffrey; Campbell, N. A.","Social Psychology/Applied Social Psychology/Environment and Sustainability           "
5706,"The Social Psychology of Sustainability",0260-4027,"Myers, David G.","Social Psychology/Applied Social Psychology/Environment and Sustainability           "
5707,"Sustainability and Systemic Issues in a New Era",0-472-11142-6,"Alperovitz, Gar","Economics/Economic Policy/Welfare           "
5708,"US Environmental NGOs and the Cree: An Unnatural Alliance for the Preservation of Nature?",0020-8701,"Roue, Marie","Sociology/Culture and Society/Cultural Politics           "
5709,"Using Cognitive Dissonance to Encourage Water Conservation",0021-9029,"Thibodeau, Ruth; Aronson, Elliot; Miller, Dayna; Dickerson, Chris Ann","Social Psychology/Applied Social Psychology/Environment and Sustainability           "
5710,"Human Resilience in a Degrading Environment: A Case Study in China",1367-2223,"Van Haaften, E. Heleen; Zhenrong, Yu; Van de Vijver, Fons J. R.","Social Psychology/Applied Social Psychology/Environment and Sustainability           "
5711,"Social Psychology and the Cultural Frame. A Road towards New Perspectives and Developments",0212-8179,"Gonzalez, Jose Luis","Social Psychology/Group Dynamics/InGroup/OutGroup Dynamics           "
5712,"Ethnocentrism as a Social-Psychological Phenomenon: Findings of a Study of Ethnic Groups in Uzbekistan",1061-0405,"Levkovich, V. P.; Andrushchak, I. B.","Social Psychology/Group Dynamics/Inter and IntraGroup Dynamics           "
5713,"The Case for the Global Commons",0-472-11142-6,"Johnson, Baylor; Duchin, Faye","Economics/Globalization/Globalization: Positive Development Impacts           "
5714,"Psychology and the Study of Differences in Human Functioning Some Reflections",0033-2968,"Sharma, Sagar","Social Psychology/Group Dynamics/InGroup/OutGroup Dynamics           "
5715,"Apologetics and Ethnocentrism: Psychology and Religion within an Ideological Surround",1050-8619,"Watson, Paul J.","Social Psychology/Group Dynamics/Peer Groups, Reference Groups and Group Identity           "
5716,"Stigma, Identity Dissonance, and the Nonresidential Mother",1050-2556,"Babcock, Ginna M.","Social Psychology/Applied Social Psychology/Gender Issues           "
5717,"Psychology, Population, and Reproductive Behavior",0003-066X,"David, Henry P.; Russo, Nancy Felipe","Social Psychology/Applied Social Psychology/Gender Issues           "
5718,"Rape: Scope, Impact, Interventions, and Public Policy Responses",0003-066X,"Koss, Mary P.","Social Psychology/Applied Social Psychology/Gender Issues           "
5719,"Development Connections: The Hedgerow Model",0-472-11142-6,"Goodwin, Neva R.","Economics/Development/Institutions           /           /GDAE/Globalization and Trade/           /GDAE/Economic Theory"
5720,"Being Born Female Is Dangerous for Your Health",0003-066X,"Murphy, Elaine M.","Social Psychology/Applied Social Psychology/Gender Issues           "
5721,"Infanticide: Contrasting Views",1434-1816,"Spinelli, Margaret G.","Social Psychology/Applied Social Psychology/Gender Issues           "
5722,"Gender and Nature: A Psychological Analysis of Ecofeminist Theory",0021-9029,"Wang, Alvin Y.","Social Psychology/Applied Social Psychology/Gender Issues           "
5723,"Promoting Mental Health and Emotional Well-being Among Children and Youth: A Role for Community Child Health?",0305-1862,"Alperstein, G.; Raman S.","Social Psychology/Applied Social Psychology/Health and WellBeing           "
5724,"Housing and Health: Psychosocial and Situational Effects in a Rural Disease Control Program",0022-4537,"Briceno-Leon, Roberto; Gonzales, Silverio; Phelan, Mauricio","Social Psychology/Applied Social Psychology/Health and WellBeing           "
5725,"Wealth, Poverty, and Sustainable Development",0-472-11142-6,"Barkin, David","Economics/Development/Poverty and Inequality/Environment and Poverty           "
5726,"The Good Society",0395713285,"Galbraith, John Kenneth","Sociology/Culture and Society/Cultural Politics           "
5727,"Optimism across Cultures: In Response to the Severe Acute Respiratory Syndrome Outbreak",1367-2223,"Ji, Li-Jun; Zhang, Zhiyong; Usborne, Esther; Guan, Yanjun","Social Psychology/Applied Social Psychology/Health and WellBeing           "
5728,"Interventions to Prevent HIV/AIDS among Adolescents in less Developed Countries: Are They Effective?",0334-0139,"Magnussen, Lesley; Ehiri, John E.; Ejere, Henry O. D.; Jolly, Pauline E.","Social Psychology/Applied Social Psychology/Health and WellBeing           "
5729,"Therapy with Victims of Political Repression in Chile: The Challenge of Social Reparation",0022-4537,"Becker, David; Lira, Elizabeth; Castillo, Maria Isabel; Gomez, Elena; Kovalskys, Juana","Social Psychology/Applied Social Psychology/Human Rights and Social Justice           "
5730,"The Developmental Dialectic of International Human-Rights Advocacy",0162-895X,"Jennings, Todd E.","Social Psychology/Applied Social Psychology/Human Rights and Social Justice           "
5731,"Free Trade or Sustainable Trade? An Ecological Economics Perspective",0-472-11142-6,"Harris, Jonathan M.","Economics/Economic Policy/Trade/Social and Environmental Issues           /           /GDAE/Globalization and Trade/           /GDAE/Environmental Policy and Sustainable Development"
5732,"Humiliation and Human Rights: Mapping a Minefield",1524-8879,"Lindner, Evelin Gerda","Social Psychology/Applied Social Psychology/Human Rights and Social Justice           "
5733,"Human Rights and Mental Health in the United States: Lessons from Latin America",0022-4537,"Lykes, M. Brinton; Liem, Ramsay","Social Psychology/Applied Social Psychology/Human Rights and Social Justice           "
5734,"Canada as a New Place: The Immigrant's Experience",0272-4944,"Ng, Cheuk Fan","Social Psychology/Applied Social Psychology/Nation, State, and Politics           "
5735,"Migration and Caste Formation in Europe: The Belgian Case",0141-9870,"Roosens, Eugeen","Social Psychology/Group Dynamics/Caste, Class, Status, and Hierarchy           "
5736,"Stories People Tell: The Cultural Construction of Environmental Policy in Africa",0-472-11142-6,"Hoben, Allan","Economics/Development/Poverty and Inequality/Environment and Poverty           "
5737,"Must Nations Become States?",0090-5992,"Liebich, Andre","Sociology/Culture and Society/Cultural Politics           "
5738,"Political Power and Environmental Sustainability in Agriculture",0-472-11142-6,"Paarlberg, Robert L.","Economics/Economic Policy/Food and Agricultural Policies           "
5739,"Reactions to Organizational Politics: A Cross-Cultural Examination in Israel and Britain",0018-7267,"Vigoda, Eran","Sociology/Culture and Society/Cultural Politics           "
5740,"Skin Color as Post-Colonial Hierarchy: A Global Strategy for Conflict Resolution",0022-3980,"Hall, Ronald E.","Social Psychology/Applied Social Psychology/Nation, State, and Politics           "
5741,"Tradition in the Political Culture of Developing Countries",0260-4027,"Kubbel, L. E.","Social Psychology/Applied Social Psychology/Nation, State, and Politics           "
5742,"Social Representations of History in Malaysia and Singapore: On the Relationship between National and Ethnic Identity",1367-2223,"Liu, James H.; Lawrence, Belinda; Ward, Colleen; Abraham, Sheela","Social Psychology/Applied Social Psychology/Nation, State, and Politics           "
5743,"Democratization, Psychology, and the Construction of Cultures of Peace",1078-1919,"Montiel, Cristina Jayme; Wessells, Michael","Social Psychology/Applied Social Psychology/Nation, State, and Politics           "
5744,"The Appropriation of Difference: State and the Construction of Ethnic Identities in Nigeria",1528-3488,"Okolie, Andrew C.","Social Psychology/Applied Social Psychology/Nation, State, and Politics           "
5745,"'The Only Proper Scale of Representation': The Politics of Statistics and Stories",1058-4609,"Peters, John Durham","Social Psychology/Applied Social Psychology/Nation, State, and Politics           "
5746,"A Cognitive Approach to International Organization: Perspective and Application",0005-7940,"Shih, Chih-Yu","Social Psychology/Applied Social Psychology/Nation, State, and Politics           "
5747,"Toward a Learning Paradigm: New Professionalism and Institutions for Agriculture",0-472-11142-6,"Pretty, Jules N.; Chambers, Robert","Economics/Economic Policy/Food and Agricultural Policies           "
5748,"Fertility, Education, and Development: Evidence from India",0098-7921,"Dreze, Jean; Murthi, Mamta","Economics/Development/Population and Quality of Life/Family Planning and Structure           "
5749,"Affirmative Action in Theory and Practice: Issues of Power, Ambiguity, and Gender versus Race",0197-3533,"Eberhardt, Jennifer L.; Fiske, Susan T.","Social Psychology/Applied Social Psychology/Human Rights and Social Justice           /           /Social Psychology/Group Dynamics/Race, Religion, and Ethnicity/           /Social Psychology/Applied Social Psychology/Gender Issues"
5750,"The Myth of Third World Solidarity: Hypergamy by Skin Colour as a Vehicle of Racism vis--vis African Americans",1117-1421,"Hall, Ronald E.","Social Psychology/Social Cognition/Eurocentrism, Colonial and PostColonial Issues           "
5751,"Why Is There No Study of Cultural Equivalence in Standardized Cognitive Ability Testing?",0003-066X,"Helms, Janet E.","Social Psychology/Approaches to Social Psychology/Cultural Psychology and CrossCultural Issues           "
5752,"Talk Does Not Cook Rice: Beyond Anti-Racism Rhetoric to Strategies for Social Action",0005-0067,"Pedersen, Anne; Walker, Iain; Wise, Mike","Social Psychology/Social Cognition/Race and Ethnicity           "
5753,"Does Food Security Require Local Food Systems?",0-472-11142-6,"Anderson, Molly D.; Cook, John T.","Economics/Development/Agrarian Economy and Society/Food Security           "
5754,"Chinua Achebe Writing Culture: Representations of Gender and Tradition in Things Fall Apart",0034-5210,"Osei-Nyame, Kwadwo","Sociology/Culture and Society/Gender           "
5755,"Religion as an Instrument of Psychological Warfare",0022-4537,"Martin-Baro, Ignacio","Social Psychology/Applied Social Psychology/Religion and Ideology           "
5756,"The Doctrine of Karma: Its Psychosocial Consequences",0091-0562,"Omprakash, S.","Social Psychology/Applied Social Psychology/Religion and Ideology           "
5757,"Is Religion Adaptive?",0140-525X,"Sosis, Richard; Alcorta, Candace","Social Psychology/Applied Social Psychology/Religion and Ideology           "
5758,"Turning-Point Decisions: A Cognitive-Dissonance Analysis of Conflict Reduction in Israel-West German Relations",0162-895X,"Auerbach, Yehudit","Social Psychology/Applied Social Psychology/War, Conflict, and Terrorism           "
5759,"Community, Ecology, and Landscape Change in Zambrana-Chacuey",0-472-11142-6,"Rocheleau, Dianne; Ross, Laurie; Morrobel, Julio; Hernandez, Ricardo","Economics/Economic Policy/Food and Agricultural Policies           "
5760,"American and Chinese College Students' Predictions of People's Occupations, Housework Responsibilities, and Hobbies as a Function of Cultural and Gender Influences",0360-0025,"Zhou, Ling-Yi; Dawson, Michelle L; Herr, Candace L.; Stukas, Sarah K.","Sociology/Culture and Society/Gender           "
5761,"Ethnic Conflict and the Psychology of Liberation in Guatemala, Peru, and Puerto Rico",0003-066X,"Comas-Diaz, Lillian; Lykes, M. Brinton; Alarcon, Renato D.","Social Psychology/Applied Social Psychology/War, Conflict, and Terrorism           "
5762,"The Psychocultural Roots of Genocide: Legitimacy and Crisis in Rwanda",0003-066X,"Smith, David Norman","Social Psychology/Applied Social Psychology/War, Conflict, and Terrorism           "
5763,"A Duplex Theory of Hate: Development and Application to Terrorism, Massacres, and Genocide",0022-1309,"Sternberg, Robert J.","Social Psychology/Applied Social Psychology/War, Conflict, and Terrorism           "
5764,"The Prophecy of Place: A Labor Market Study of Young Women and Education",0002-9246,"Williams, L. Susan","Sociology/Culture and Society/Gender           "
5765,"Enhancement of Enemy's Power Motivation as a Dynamic of Escalation in Conflict Situations",0022-3514,"Winter, David","Social Psychology/Applied Social Psychology/War, Conflict, and Terrorism           "
5766,"The Rediscovery of the Human Mind: The Discursive Approach",1367-2223,"Harre, Rom","Social Psychology/Approaches to Social Psychology/Cognitive Theory           "
5767,"The Category of the Mind: Folk Psychology of Belief, Desire, and Intention",1367-2223,"Kashima, Yoshihisa; McKintyre, Allison; Clifford, Paul","Social Psychology/Approaches to Social Psychology/Cognitive Theory           "
5768,"The Cognitive Self and the Psychoanalytic Self: Can We Put Ourselves Together?",1532-7965,"Westen, Drew","Social Psychology/Approaches to Social Psychology/Cognitive Theory           "
5769,"Toward a Dialectical Model of Family Gender Discourse: Body, Identity and Sexuality",0022-2445,"Blume, Libby Balter; Blume, Thomas W.","Sociology/Culture and Society/Gender           "
5770,"Developmental Psychology and the Relevance of a Critical Metatheoretical Reflection",0018-716X,"Teo, Thomas","Social Psychology/Approaches to Social Psychology/Critical Psychology           "
5771,"Three Approaches to the Psychology of Culture: Where Do They Come From? Where Can They Go?",1367-2223,"Greenfield, Patricia M.","Social Psychology/Approaches to Social Psychology/Cultural Psychology and CrossCultural Issues           /           /History/Social and Cultural History/Festivals/Celebrations"
5772,"Why is Multiculturalism Good?",0003-066X,"Fowers, Blaine J.; Richardson, Frank C.","Social Psychology/Approaches to Social Psychology/Cultural Psychology and CrossCultural Issues           "
5773,"Critique of the Methodology of Empirical Research on Individual Modernity in Taiwan",1367-2223,"Hwang, Kwang-Kuo","Social Psychology/Approaches to Social Psychology/Cultural Psychology and CrossCultural Issues           "
5774,"Dialectics between Cultural and Cross-Cultural Psychology",1367-2223,"Triandis, Harry C.","Social Psychology/Approaches to Social Psychology/Cultural Psychology and CrossCultural Issues           "
5775,"Analyzing Gender, Health and Communicable Disease: Guidelines from the Liverpool School of Tropical Medicine",1011-6370,"Tolhurst, Rachael","Sociology/Culture and Society/Gender           "
5776,"Human Nature and Culture: an Evolutionary Psychological Perspective",0022-3506,"Buss, David M.","Social Psychology/Approaches to Social Psychology/Evolutionary Psychology           "
5777,"The Evolution of Truly Social Cognition: The Core Configurations Model",1088-8683,"Caporael, Linda R.","Social Psychology/Approaches to Social Psychology/Evolutionary Psychology           "
5778,"Feminist Approaches to Social Science: Epistemological and Methodological Tenets",0091-0562,"Campbell, Rebecca; Wasco, Sharon M.","Social Psychology/Approaches to Social Psychology/Feminist Approaches           "
5779,"The Science and Politics of Comparing Women and Men",0003-066X,"Eagly, Alice H.","Social Psychology/Approaches to Social Psychology/Feminist Approaches           /           /Social Psychology/Approaches to Social Psychology/Gender Issues"
5780,"The Psychology of Women and Conservatism: Rediscovering Social Change",0361-6843,"Kahn, Arnold S.; Yoder, Janice D.","Social Psychology/Approaches to Social Psychology/Feminist Approaches           "
5781,"Self-Determination and Empowerment: A Feminist Standpoint Analysis of Talk about Disability",0091-0562,"Sprague, Joey; Hayes, Jeanne","Social Psychology/Approaches to Social Psychology/Feminist Approaches           "
5782,"Why Are Some People Happier Than Others? The Role of Cognitive and Motivational Processes in Well-Being",0003-066X,"Lyubomirsky, Sonja","Social Psychology/Approaches to Social Psychology/Positive Psychology           "
5783,"Psychological Hedonism and the Nature of Motivation: Bertrand Russell's Anhedonic Desires",0951-5089,"Overskeid, Geir","Social Psychology/Social Cognition/Motivation           "
5784,"Developments in Satisfaction-Research",0303-8300,"Veenhoven, Ruut","Social Psychology/Approaches to Social Psychology/Positive Psychology           "
5785,"Essentialism, Culture, and Beliefs about Gender among the Aravanis of Tamil Nadu, India",0360-0025,"Mahalingam, Ramaswami","Sociology/Culture and Society/Gender           "
5786,"Scientists in the Swamp: Narrowing the Language-Practice Gap in Community Psychology",0091-0562,"Hess, Jacob Z.","Social Psychology/Approaches to Social Psychology/Deconstructionism and PostModernism           "
5787,"Working with Korean-American Families: Multicultural Hermeneutics in Understanding and Dealing with Marital Domestic Violence",0192-6187,"Lee, Sang Bok","Social Psychology/Approaches to Social Psychology/Deconstructionism and PostModernism           "
5788,"Islam, Gender, Culture and Democracy",0020-7152,"Inglehart, Ronald","Sociology/Culture and Society/Gender           "
5789,"A Philosophical Reflection on the Epistemology and Methodology of Indigenous Psychologies",1367-2223,"Hwang, Kwang-Kuo","Social Psychology/Approaches to Social Psychology/Indigenous, NonWestern and PostColonialist Approaches           "
5790,"Indigenous Theorizing in a Complex World",1367-2223,"Jackson, Paul R.","Social Psychology/Approaches to Social Psychology/Indigenous, NonWestern and PostColonialist Approaches           "
5791,"Modulative and Generative Orientations in Psychology: Implications for Psychology in the Three Worlds",0022-4537,"Moghaddam, Fathali M.","Social Psychology/Approaches to Social Psychology/Indigenous, NonWestern and PostColonialist Approaches           "
5792,"Measuring Attitudes in Test-Alien Cultures: When Illiteracy and Unfamiliarity Do Not Matter",1367-2223,"Shah, Ashiq Ali","Social Psychology/Approaches to Social Psychology/Indigenous, NonWestern and PostColonialist Approaches           "
5793,"Developmental Issues in Indigenous Psychologies: Sustainability and Local Knowledge",1367-2223,"Shams, Manfusa","Social Psychology/Approaches to Social Psychology/Indigenous, NonWestern and PostColonialist Approaches           "
5794,"Changing Perspectives in Social Psychology in India: A Journey Towards Indigenization",1367-2223,"Sinha, Durganand","Social Psychology/Approaches to Social Psychology/Indigenous, NonWestern and PostColonialist Approaches           "
5795,"Psychology for the Third World?",0022-4537,"Sloan, Tod S.","Social Psychology/Approaches to Social Psychology/Indigenous, NonWestern and PostColonialist Approaches           "
5796,"Gender Role Development in Japanese Culture: Diminishing Gender Role Differences in a Contemporary Society",0360-0025,"Sugihara, Yoko; Katsurada, Emiko","Sociology/Culture and Society/Gender           "
5797,"Ideology and Community Social Psychology: Theoretical Considerations and Practical Implications",0091-0562,"Montenegro, Marisela","Social Psychology/Approaches to Social Psychology/Marxist Approaches           "
5798,"Orientalism in Euro-American and Indian Psychology: Historical Representations of Natives in Colonial and Postcolonial Contexts",1093-4510,"Bhatia, Sunil","Social Psychology/Approaches to Social Psychology/Indigenous, NonWestern and PostColonialist Approaches           "
5799,"Rethinking 'Acculturation' in Relation to Diasporic Cultures and Postcolonial Identities",0018-716X,"Bhatia, Sunil; Ram, Anjali","Social Psychology/Approaches to Social Psychology/Indigenous, NonWestern and PostColonialist Approaches           "
5800,"The Other and Other Others: Post-Colonialism, Psychoanalysis and the South African Question",0065-860X,"Van Zyl, Susan","Social Psychology/Approaches to Social Psychology/Indigenous, NonWestern and PostColonialist Approaches           "
5801,"Power and Population in Asia",0146-5945,"Eberstadt, Nicholas","Economics/Development/Population and Quality of Life/Demographic Transition           "
5802,"The Culture of Masculinity in an Australian Indigenous Community",1011-6370,"Hammill, Jan","Sociology/Culture and Society/Gender           "
5803,"The Unbearable Automaticity of Being",0003-066X,"Bargh, John A.; Chartrand, T. L.","Social Psychology/Social Cognition/Perception, Judgment and Mental Representation           "
5804,"Why We Do What We Do: A Biopsychosocial Theory of Human Motivation",0037-7732,"Walter, R. Gove","Social Psychology/Social Cognition/Motivation           "
5805,"Role Theory and Social Cognition: Learning to Think Like a Recycler",1529-8868,"Collier, Peter J.; Callero, Peter J.","Social Psychology/Approaches to Social Psychology/Various Modern Theories           "
5806,"Coping and Subjective Well-Being in Women with Multiple Roles",0020-7640,"Rao, Kiran; Apte, Mridula; Subbakrishna, D. K.","Social Psychology/Approaches to Social Psychology/Feminist Approaches           "
5807,"If Saddam is Hitler then Who is George Bush? Analogical Mapping between Systems of Social Roles",0022-3514,"Spellman, Barbara A.; Holyoak, Keith J.","Social Psychology/Social Cognition/Perception, Judgment and Mental Representation           "
5808,"The Eyes are Silent, The Heart Desires to Speak: Exploring Masculinities in South Asia",1011-6370,"Roy, Rahul","Sociology/Culture and Society/Gender           "
5809,"A Tale of Two Theories: A Critical Comparison of Identity Theory with Social Identity Theory",0190-2725,"Hogg, Michael A.; Terry, Deborah J.; White, Katherine M.","Social Psychology/Approaches to Social Psychology/Various Modern Theories           "
5810,"Value-Based Praxis in Community Psychology: Moving Toward Social Justice and Social Action",0091-0562,"Prilleltensky, Isaac","Social Psychology/Approaches to Social Psychology/Social Psychology and Human Values           "
5811,"A Comparative Study in the levels of Human Values: People's Republic of China, Singapore, Taiwan, and the United States",1367-2223,"Echter, Tamara; Uichol, Kim; Ching-ven, James Kau; Li, Hong-Ceng; Simmons, Carolyn; Ward, Colleen","Social Psychology/Approaches to Social Psychology/Social Psychology and Human Values           "
5812,"Violence and the Crisis of Masculinity in the USA, Australia and Mongolia",1011-6370,"Hurst, Dale","Sociology/Culture and Society/Gender           "
5813,"The Necessity of Observing Real Life Situations: Palestinian-Israeli Violence as a Laboratory for Learning about Social Behavior",0046-2772,"Bar-Tal, Daniel","Social Psychology/Approaches to Social Psychology/Sociological Approaches           "
5814,"Social Structure and Personality: A Quintessentially Sociological Approach to Social Psychology",0037-7732,"Kohn, Melvin L.","Social Psychology/Approaches to Social Psychology/Sociological Approaches           "
5815,"The Consequences of International Migration for the Status of Women: A Turkish Study",0020-7985,"Day, Lincoln H.; Icduygu, Ahmet","Sociology/Culture and Society/Gender           /           /History/World/Global History/Migration/Causes/Consequences"
5816,"Personality in Society: Social Psychology's Contribution to Sociology",0190-2725,"Turner, Ralph H.","Social Psychology/Approaches to Social Psychology/Sociological Approaches           "
5817,"Return Migration: Changing Roles of Men and Women",0020-7985,"Sakka, Despina; Dikaiou, Maria; Kiosseoglou, Grigoris","Sociology/Culture and Society/Gender           "
5818,"Negative Illusions: Conceptual Clarification and Psychological Evidence Concerning False Consciousness",0162-895X,"Jost, John T.","Social Psychology/Group Dynamics/Bandwagon Effects, NIMBY, and Collective Delusions           "
5819,"The Psychology of Political Momentum",1065-9129,"Kenney, Patrick J.; Rice, Tom W.","Social Psychology/Group Dynamics/Bandwagon Effects, NIMBY, and Collective Delusions           "
5820,"Not in My Backyard: The Situational and Personality Determinants of Oppositional Behavior",0021-9029,"Thornton, Bill; Knox, Diana","Social Psychology/Group Dynamics/Bandwagon Effects, NIMBY, and Collective Delusions           "
