3302,"Education, Xenophobia and Nationalism: A Comparative Analysis","Political Science/Comparative Politics/Political Systems, Processes and Transition/Nationalism and Nation Building           "
3303,"Nation-Building and Minority Rights: Comparing West and East","Political Science/Comparative Politics/Cultural, Ethnic and Gender Politics and Movements/Cultural Politics           "
3304,"There is Enough Time: Rethinking the Process of Policy Development","Political Science/Comparative Politics/Elections, Electoral Systems, and Political Participation/Political Participation           "
3305,"Crime and Justice in American Indian Communities","Political Science/Comparative Politics/Political Systems, Processes and Transition/Tribalism and Acephalous Societies           "
3306,"The Nuer Concept of Covenant and Covenantal Way of Life","Political Science/Comparative Politics/Political Systems, Processes and Transition/Tribalism and Acephalous Societies           "
3307,"Ecofeminism in the Twenty-first Century","Economics/Development/Women and Children/Feminism and Organization           "
3308,"Muslims and Democracy: An Empirical Critique of Fukuyama's Culturalist Approach","Political Science/Comparative Politics/Political Systems, Processes and Transition/Democracy           "
3309,"Political Involvement in Transition","Political Science/Comparative Politics/Elections, Electoral Systems, and Political Participation/Political Participation           "
3310,"Democratic Transitions And Consolidation In Contemporary Southern Europe And Latin America","Political Science/Comparative Politics/Political Systems, Processes and Transition/Democracy           "
3311,"Religious Parties and Politics in Pakistan","Political Science/Comparative Politics/Elections, Electoral Systems, and Political Participation/Political Parties, Interest Groups, and Elections           "
3312,"Global Transformation and Local Countermovements: The Prospects for Democracy under Neoliberalism","Political Science/Comparative Politics/Political Systems, Processes and Transition/Democracy           "
3313,"Effective Democracy, Mass Culture, and the Quality of Elites: The Human Development Perspective","Political Science/Comparative Politics/Politics of Mass Society           /           /Sociology/Political Sociology/Democracy"
3314,"Labor Substitution in Philippine Rice Farming Systems: An Analysis of Gender Work Roles","Economics/Growth, Allocation and Distribution/Economics of Discrimination           "
3315,"Reconstructing Sierra Leone","Political Science/Comparative Politics/Political Systems, Processes and Transition/Nationalism and Nation Building           "
3316,"Social Movements amidst Democratic Transitions: Lessons from the Brazilian Countryside","Political Science/Comparative Politics/Social Movements           "
3317,"Europe Against Islam: Islam in Europe","Political Science/Comparative Politics/Cultural, Ethnic and Gender Politics and Movements/Tradition and Modernity           "
3318,"Dictatorships of Virtue? States, NGOs, and the Imposition of Democratic Values","Political Science/Comparative Politics/Political Systems, Processes and Transition/Democracy           "
3319,"Unsheathing the Sword? Germany's and Japan's Fractured Political-Military Cultures and the Problem of Burden Sharing","Political Science/Comparative Politics/Political Systems, Processes and Transition/Dictatorships and Militarism           "
3320,"The Promise of Particularism and the Theology of Culture: Limits and Lessons of “Neo-Boasianism”","Anthropology/Methods and Approaches/Cultural Particularism, Universalism, and Relativism           "
3321,"Civil Society in the Post-Communist Context: Linking Theoretical Concept and Social Transformation","Political Science/Comparative Politics/Political Systems, Processes and Transition/Nationalism and Nation Building           "
3322,"Security, Development and Political Participation in Thailand: Alternative Currencies of Legitimacy","Political Science/Comparative Politics/Elections, Electoral Systems, and Political Participation/Political Participation           "
3323,"Democracy and Ethno-religious Conflict in Iraq","Political Science/Comparative Politics/Cultural, Ethnic and Gender Politics and Movements/Cultural Politics           "
3324,"Green: Ethics and Politics","Political Science/Comparative Politics/Cultural, Ethnic and Gender Politics and Movements/Cultural Politics           "
3325,"Endogenous Democratization","Political Science/Comparative Politics/Political Systems, Processes and Transition/Democracy           "
3326,"Social Science, Communism, and the Dynamics of Political Change","Political Science/Comparative Politics/Political Systems, Processes and Transition/Socialism           "
3327,"Politics Beyond the State: Environmental Activism and World Civic Politics","Political Science/Comparative Politics/Social Movements           "
3328,"Democracy, Indigenous Movements, and the Postliberal Challenge in Latin America","Political Science/Comparative Politics/Cultural, Ethnic and Gender Politics and Movements/Indigenous Rights and Activism           "
3329,"Translating Social Cleavages into Party Systems: The Significance of New Democracy","Political Science/Comparative Politics/Elections, Electoral Systems, and Political Participation/Political Parties, Interest Groups, and Elections           "
3330,"Anti-Imperialist Politics: Class Formation and Socio-Political Action","Political Science/Comparative Politics/Colonialism, Imperialism, and Liberation Struggles           /           /Sociology/Political Sociology/Colonialism and Imperialism"
3331,"Democratization and its Consequences","Political Science/Comparative Politics/Political Systems, Processes and Transition/Democracy           "
3332,"Tending the Grassroots: GSOs and MSOs","Political Science/Comparative Politics/Social Movements           "
3333,"The Renewal of the Radical Right: Between Modernity and Anti-Modernity","Political Science/Comparative Politics/Political Systems, Processes and Transition/Fascism and NeoFascism           "
3334,"Civil Society and Democracy in Global Governance","Political Science/Comparative Politics/Elections, Electoral Systems, and Political Participation/Political Participation           "
3335,"New Contours of Russian Fascization","Political Science/Comparative Politics/Political Systems, Processes and Transition/Fascism and NeoFascism           "
3336,"Nationalism, Militarism and Gender Politics: Women in the Military","Political Science/Comparative Politics/Political Systems, Processes and Transition/Dictatorships and Militarism           "
3337,"Militarism and the Coming Wars","Political Science/Comparative Politics/Political Systems, Processes and Transition/Dictatorships and Militarism           "
3338,"Universals and Particulars: Some Current Contests in Anthropology","Anthropology/Methods and Approaches/Cultural Particularism, Universalism, and Relativism           "
3339,"The Political Economy of Reform: Normative Political Economy","Political Science/Comparative Politics/Elections, Electoral Systems, and Political Participation/Political Parties, Interest Groups, and Elections           "
3340,"Africa's Range of Regimes","Political Science/Comparative Politics/Political Systems, Processes and Transition/Dictatorships and Militarism           "
3341,"Marx's Theory of Historical Transcendence and the Creative Practice of Socialism in China","Political Science/Comparative Politics/Political Systems, Processes and Transition/Socialism           "
3342,"Australia's Judicial Revolution: Aboriginal Land Rights and the Transformation of Liberalism","Political Science/Comparative Politics/Cultural, Ethnic and Gender Politics and Movements/Indigenous Rights and Activism           "
3343,"Justifying Empire: Pericles, Polk, and a Dilemma of Democratic Leadership","Political Science/Comparative Politics/Colonialism, Imperialism, and Liberation Struggles           "
3344,"The Myth of Benign Group Identity: A Critique of Liberal Nationalism","Political Science/Comparative Politics/Political Systems, Processes and Transition/Nationalism and Nation Building           "
3345,"Natural Resources, Governance and Social Justice","Political Science/Comparative Politics/Social Movements           "
3346,"Information Communications Technologies and Violence Against Women","Political Science/Comparative Politics/Social Movements           "
3347,"Environmental Concerns and Virtual Politics: Knowledge and Activism on the Web","Political Science/Comparative Politics/Social Movements           "
3348,"Participatory Internal Learning for Grassroots NGOs in Micro-credit, Livelihoods and Environmental Regeneration","Political Science/Comparative Politics/Social Movements           "
3349,"Reproductive Rights are Human Rights","Political Science/Comparative Politics/Social Movements           "
3350,"Effects of Globalization on the Efforts to Decriminalize Abortion in Mexico","Political Science/Comparative Politics/Social Movements           "
3351,"The Public and the People: Heidegger's Illiberal Politics","Political Science/Comparative Politics/Politics of Mass Society           "
3352,"Transition to Democracy in Eastern Europe and Russia: Impact on Politics, Economy and Culture","Political Science/Comparative Politics/Political Systems, Processes and Transition/Nationalism and Nation Building           "
3353,"Demographic Trends, Pronatalism, and Nationalist Ideologies in the Late Twentieth Century","Political Science/Comparative Politics/Political Systems, Processes and Transition/Nationalism and Nation Building           "
3354,"Coping with Ethnicity in South Asia: Bangladesh, Punjab and Kashmir Compared","Political Science/Comparative Politics/Political Systems, Processes and Transition/Tribalism and Acephalous Societies           "
3355,"The State and the Egalitarian, Ecclesiastical and Liberal Regimes of Gender Relations","Political Science/Comparative Politics/Cultural, Ethnic and Gender Politics and Movements/Gender Politics           "
3356,"Cosmic Reproduction, Economics and Politics among the Kulina of Southwest Amazonia","Political Science/Comparative Politics/Political Systems, Processes and Transition/Tribalism and Acephalous Societies           "
3357,"Recidivist Militarism in Pakistan","Political Science/Comparative Politics/Political Systems, Processes and Transition/Dictatorships and Militarism           "
3358,"Job Gendering: Occupational Choice and the Marriage Market","Economics/Growth, Allocation and Distribution/Economics of Discrimination           /           /Economics/WellBeing/Work"
3359,"Colonialism and Hegemony in Latin America: An Introduction","Political Science/Comparative Politics/Colonialism, Imperialism, and Liberation Struggles           "
3360,"The Utopian Vision, East and West","Political Science/Comparative Politics/Social Movements           "
3361,"The Underestimation of Politics in Green Utopias: The Description of Politics in Huxley's Island, le Guin's the Dispossessed, and Callenbach's Ecotopia","Political Science/Comparative Politics/Social Movements           "
3362,"The Logic of Tools: Labor and the Quality of Life","Political Science/Comparative Politics/Politics of Mass Society           "
3363,"NGOs as Incubators of Participative Democracy in South Korea: Political, Voluntary, and Policy Participation","Political Science/Comparative Politics/Social Movements           "
3364,"Civil Society and Democracy: A Zambian Case Study","Political Science/Comparative Politics/Political Systems, Processes and Transition/Nationalism and Nation Building           "
3365,"South Africa and the Limits of Civil Society","Political Science/Comparative Politics/Colonialism, Imperialism, and Liberation Struggles           "
3366,"Women's Parties in Post-communist Politics","Political Science/Comparative Politics/Elections, Electoral Systems, and Political Participation/Political Parties, Interest Groups, and Elections           "
3367,"Mother Nature / Human Nature: An Environmental Anthropology Drawing on Christian Thought, Psychoanalysis, and Feminism","Anthropology/Methods and Approaches/Ecological Approaches           "
3368,"Gender Inequality in Political Representation: A Worldwide Comparative Analysis","Political Science/Comparative Politics/Elections, Electoral Systems, and Political Participation/Political Participation           "
3369,"Class Structure and Intergenerational Class Mobility: A Comparative Analysis of Nation and Gender","Political Science/Comparative Politics/Cultural, Ethnic and Gender Politics and Movements/Cultural Politics           "
3370,"Pax Democratica: The Gospel According to St. Democracy","Political Science/Comparative Politics/Political Systems, Processes and Transition/Nationalism and Nation Building           "
3371,"Reconciliation and Political Legitimacy: The Old Australia and the New South Africa","Political Science/Comparative Politics/Political Systems, Processes and Transition/Nationalism and Nation Building           "
3372,"The Military: A Threat to Democracy?","Political Science/Comparative Politics/Political Systems, Processes and Transition/Dictatorships and Militarism           "
3373,"Erasing Culture and Race: Practicing Self-Determination","Political Science/Comparative Politics/Cultural, Ethnic and Gender Politics and Movements/Indigenous Rights and Activism           "
3374,"Civil Society, Political Capital, and Democratization in Central America","Political Science/Comparative Politics/Elections, Electoral Systems, and Political Participation/Political Participation           "
3375,"Fighting Words: The Discourse of Insurgency in Latin American History","Political Science/Comparative Politics/Political Systems, Processes and Transition/Nationalism and Nation Building           "
3376,"The Determinants of Success of Special Interests in Redistributive Politics","Political Science/Comparative Politics/Elections, Electoral Systems, and Political Participation/Political Parties, Interest Groups, and Elections           "
3377,"Civil Society in a Postwar Period: Labor in the Salvadoran Democratic Transition","Political Science/Comparative Politics/Elections, Electoral Systems, and Political Participation/Political Parties, Interest Groups, and Elections           "
3378,"A Niche Theory of Interest Representation","Political Science/Comparative Politics/Elections, Electoral Systems, and Political Participation/Political Parties, Interest Groups, and Elections           "
3379,"The Migrant Village Association in Latin America: A Comparative Analysis","Political Science/Comparative Politics/Cultural, Ethnic and Gender Politics and Movements/Cultural Politics           "
3380,"The Reassertion of Indigenous Identity: Mayan Responses to State Intervention in Chiapas","Political Science/Comparative Politics/Cultural, Ethnic and Gender Politics and Movements/Indigenous Rights and Activism           "
3381,"Mass and Elite Political Outlooks in Post-Soviet Russia: How Congruent?","Political Science/Comparative Politics/Politics of Mass Society           "
3382,"Empire or Imperialism: Implications for a “New” Politics of Resistance","Political Science/Comparative Politics/Colonialism, Imperialism, and Liberation Struggles           "
3383,"Opportunities, Organizations, and Ideas: Islamists and Workers in Tunisia and Algeria","Political Science/Comparative Politics/Social Movements           "
3384,"Confronting the Empire","Political Science/Comparative Politics/Colonialism, Imperialism, and Liberation Struggles           "
3385,"Nationalism, Class Conflict and Social Transformation in the Twentieth Century","Political Science/Comparative Politics/Political Systems, Processes and Transition/Nationalism and Nation Building           "
3386,"Jurisdiction Size, Political Participation, and the Allocation of Resources","Political Science/Comparative Politics/Elections, Electoral Systems, and Political Participation/Political Participation           "
3387,"Women and Democracy: A Bangladesh Perspective","Political Science/Comparative Politics/Cultural, Ethnic and Gender Politics and Movements/Gender Politics           "
3388,"A Critical Examination of the Democratic Transition in South Africa: The Question of Public Participation","Political Science/Comparative Politics/Political Systems, Processes and Transition/Democracy           "
3389,"From Social Control Towards Political Self-Determination? Maori Seats And The Politics Of Separate Maori Representation In New Zealand","Political Science/Comparative Politics/Political Systems, Processes and Transition/Democracy           "
3390,"State Feminism and Women's Movements: The Impact of Chile's Servicio Nacional de la Mujer on Women's Activism","Political Science/Comparative Politics/Cultural, Ethnic and Gender Politics and Movements/Gender Politics           "
3391,"The Possibility of Nationalist Feminism","Political Science/Comparative Politics/Cultural, Ethnic and Gender Politics and Movements/Gender Politics           "
3392,"Democratisation under the Military in the Gambia: 1994-2000","Political Science/Comparative Politics/Political Systems, Processes and Transition/Dictatorships and Militarism           "
3393,"Post-Colonialism Compared: Potentials and Limitations in the Middle East and Central Asia","Political Science/Comparative Politics/Colonialism, Imperialism, and Liberation Struggles           "
3394,"Gender Equality And Electoral Politics On The Left: A Comparison of El Salvador and Nicaragua","Political Science/Comparative Politics/Political Systems, Processes and Transition/Democracy           "
3395,"British Imperialism and Australian Nationalism: Manipulation, Conflict and Compromise in the Late Nineteenth Century","Political Science/Comparative Politics/Colonialism, Imperialism, and Liberation Struggles           "
3396,"Race-Making and the Nation-State","Political Science/Comparative Politics/Political Systems, Processes and Transition/Nationalism and Nation Building           "
3397,"Ubu and Ubuntu: On the Dialectics of Apartheid and Nation Building","Political Science/Comparative Politics/Political Systems, Processes and Transition/Nationalism and Nation Building           "
3398,"Conflict and Cooperation between the State and Religious Institutions in Contemporary Egypt","Political Science/Comparative Politics/Cultural, Ethnic and Gender Politics and Movements/Cultural Politics           "
3399,"International Interventions and Imperialism: Lessons from the 1990s","Political Science/Comparative Politics/Colonialism, Imperialism, and Liberation Struggles           "
3400,"Nation/Representation: Ethnic Classification and Mapping Nationhood in Contemporary Laos","Political Science/Comparative Politics/Political Systems, Processes and Transition/Nationalism and Nation Building           "
3401,"Nation-States and Ethnic Boundaries: Modern Turkish Identity and Turkish-Kurdish Conflict","Political Science/Comparative Politics/Political Systems, Processes and Transition/Nationalism and Nation Building           "
3402,"The Rashomon Effect: When Ethnographers Disagree","Anthropology/Methods and Approaches/Ethnological Approaches and Participant Observation           "
3403,"Nationalism and National Identity in Contemporary China: Assessing the Debate","Political Science/Comparative Politics/Political Systems, Processes and Transition/Nationalism and Nation Building           "
3404,"Nationalism, Ideology and China's 'Fourth Generation' Leadership","Political Science/Comparative Politics/Political Systems, Processes and Transition/Nationalism and Nation Building           "
3405,"Venezuela: Participatory Democracy or Government as Usual?","Political Science/Comparative Politics/Political Systems, Processes and Transition/Democracy           "
3406,"Dialect, Language, Nation","Anthropology/Language and Society/Nation and Identity           "
3407,"Linguistic Knowledge and Cultural Knowledge: Some Doubts and Speculations","Anthropology/Language and Society/Knowledge and Discourse           "
3408,"Conceptual Universals in Interpersonal Language","Anthropology/Language and Society/Language Representations and Usage           "
3409,"What Is the Sapir-Whorf Hypothesis?","Anthropology/Language and Society/Approaches and Interpretations           "
3410,"A Discourse-Centered Approach to Language and Culture","Anthropology/Language and Society/Knowledge and Discourse           "
3411,"Cultural Darwinism and Language","Anthropology/Language and Society/Language Evolution and Change           "
3412,"The Wages of Motherhood: Better or Worse?","Economics/Growth, Allocation and Distribution/Economics of Discrimination           "
3413,"Linguistic Magic Bullets in the Making of a Modernist Anthropology","Anthropology/Language and Society/Culture           "
3414,"Language Ideology and Women's Speech: Talking Community in the Northwest Amazon","Anthropology/Language and Society/Gender           "
3415,"Globalizing Languages: Ideologies and Realities of the Contemporary Global System","Anthropology/Language and Society/Globalization           "
3416,"Getting Language Rights: The Rhetorics of Language Endangerment and Loss","Anthropology/Language and Society/Language Loss and Rights           "
3417,"Mongolian Ethnicity and Linguistic Anxiety in China","Anthropology/Language and Society/Nation and Identity           "
3418,"Linguistic Syncretism and Language Ideologies: Transforming Sociolinguistic Hierarchy on Rapa Nui (Easter Island)","Anthropology/Language and Society/Culture           "
3419,"The Politics of Language Equilibrium in a Multilingual Society: Mauritius","Anthropology/Language and Society/Politics and Power           "
3420,"Critical Ethnocentrism and the Ethnology of Ernesto De Martino","Anthropology/Methods and Approaches/Ethnological Approaches and Participant Observation           "
3421,"The Predicament of Ideas in Culture: Translation and Historiography","Anthropology/Language and Society/Identity           "
3422,"Domain Specificity of Trilingual Teachers' Verbal Self-Concepts","Anthropology/Language and Society/Multilingualism           "
3423,"The Evolution of Language","Anthropology/Language and Society/Language Evolution and Change           "
3424,"Cultural Globalization, Global English, and Geography Journals","Anthropology/Language and Society/Globalization           "
3425,"Economic Disempowerment, Women's and Children's Rights in Zimbabwe","Economics/Growth, Allocation and Distribution/Economics of Discrimination           /           /Economics/Development/Women and Children/Labor Issues"
3426,"Gender, Publication and Citation in Sociolinguistics and Linguistic Anthropology: The Construction of a Scholarly Canon","Anthropology/Language and Society/Gender           "
3427,"Garifuna Children's Language Shame: Ethnic Stereotypes, National Affiliation, and Transnational Immigration as Factors in Language Choice in Southern Belize","Anthropology/Language and Society/Identity           "
3428,"Al Fin Que Ya los Cueros no Van a Correr: The Pragmatics of Power in Hnahnu (Otomi) Markets","Anthropology/Language and Society/Politics and Power           "
3429,"Writing as a Problem: African Grassroots Writing, Economies of Literacy, and Globalization","Anthropology/Language and Society/Globalization           "
3430,"Linguistic Capital in Taiwan: The KMT's Mandarin Language Policy and its Perceived Impact on Language Practices of Bilingual Mandarin and Tai-gi Speakers","Anthropology/Language and Society/Politics and Power           "
3431,"Multilingual Play: Children's Code-Switching, Role Play and Agency in Dominica, West Indies","Anthropology/Language and Society/Identity           "
3432,"Creating Speech Register in Thai Conversation","Anthropology/Language and Society/Knowledge and Discourse           "
3433,"Empirical Universals of Language as a Basis for the Study of Other Human Universals and as a Tool for Exploring Cross-Cultural Differences","Anthropology/Language and Society/Approaches and Interpretations           "
3434,"“Salam Tahiyah”: Greetings from the Highlands of Yemen","Anthropology/Language and Society/Language Representations and Usage           "
3435,"When Talk Isn't Cheap: Language and Political Economy","Anthropology/Language and Society/Human Welfare           "
3436,"The Office of Reason: On the Politics of Language and Agency in a Shelter for “The Homeless Mentally Ill”","Anthropology/Language and Society/Human Welfare           "
3437,"The Pidginization of Luguru Politics: Administrative Ethnography and the Paradoxes of Indirect Rule","Anthropology/Language and Society/Politics and Power           "
3438,"Gender, Language, and Modernity: Toward an Effective History of Japanese Women's Language","Anthropology/Language and Society/Gender           "
3439,"Intra-language Discrimination and Linguistic Human Rights: The Case of Singlish","Anthropology/Language and Society/Language Loss and Rights           "
3440,"Reconsidering Cultural Globalization: The English Language in Malaysia","Anthropology/Language and Society/Globalization           "
3441,"Language and Culture Acquisition among Iranians in the United States","Anthropology/Language and Society/Culture           "
3442,"Tribal Languages and the Challenges of Revitalization","Anthropology/Language and Society/Language Loss and Rights           "
3443,"On Opposition to Rent Seeking: Implications for Developing Countries","Economics/Development/Transition from Socialism to Markets           "
3444,"Code Mixing with a Difference","Anthropology/Language and Society/Multilingualism           "
