6612,"Risk, Recommodification and Stratification","Sociology/Political Sociology/Social Stratification           "
6613,"Is the National State the Appropriate Geographical Unit for Class Analysis?","Sociology/Political Sociology/Classes           "
6614,"Global Unionism: A Potential Player","Economics/Globalization/Globalization and Human Capital           "
6615,"Crime and Violence in an Urbanizing World","Sociology/Urban Sociology/Crime and Violence           "
6616,"The Symbolic Power of Ireland's President Robinson","History/Political History/Gender/Leadership           "
6617,"No More Kin Care? Change in Black Mothers' Reliance on Relatives for Child Care, 1977-94","History/Social and Cultural History/Childhood/Childrearing and Parenting           "
6618,"Social Classes, Demographic Transition and Economic Growth","Economics/Growth, Allocation and Distribution/Labor and Employment/Child Labor           "
6619,"Performativity or Performance? Clarifications in the Sociology of Gender","Sociology/Culture and Society/Gender           "
6620,"Just Doing Business: Modern Racism and Obedience to Authority as Explanations for Employment Discrimination","Social Psychology/Social Cognition/Race and Ethnicity           "
6621,"Catholic: The Name and the Thing","History/Social and Cultural History/Systems of Belief/Christianity           "
6622,"Anthropology, Interviewing, and Communicability in Contemporary Society","Anthropology/Methods and Approaches/Other           "
6623,"The Social Dimension of the Urban Village: A Comparison of Models for Sustainable Urban Development","Sociology/Urban Sociology/Sustainable Cities           "
6624,"Inequality, Institutions, and the Rule of Law: The Social and Institutional Bases of Rights","Sociology/Culture and Society/Institutions           "
6625,"Environmental Agreements: Lessons, Effectiveness and Potential for Future Use","History/Environmental History/International Environmental Agreements/Treaties           "
6626,"Mill's Moral and Political Philosophy","Philosophy/Rights and Justice/Ethical Theory/Historical Perspectives           "
6627,"Full Employment in the Industrialized Countries","Political Science/Public Policy/Economic Issues/Employment and Income           "
6628,"Macroeconomics and History","History/Economic History/Economic Planning and Policy           "
6629,"The Corporate Accountability Movement: Lessons and Opportunities","Economics/Globalization/Transnational Corporations           "
6630,"Stolen History: Looting and Illicit Trade","History/Social and Cultural History/Culture as Commodity           "
6631,"Rethinking Thai Masculinity: New Perspectives on Prostitution in Thailand","Anthropology/Methods and Approaches/Gender Orientation           "
6632,"Voltaire: Science and Satire","About Social Science/History and Evolution of Social Science           "
6633,"Autonomous Science And Socially Responsive Science: A Search For Resolution","About Social Science/Scientific Knowledge and Method           "
6634,"The Effects of Public Policy on Private Charity","Political Science/Public Policy/Social Welfare/Social Welfare/Welfare State           "
6635,"Discounting the Future","Philosophy/Rights and Justice/Intergenerational Justice           "
6636,"Harriet Martineau and Beatrice Webb: A Comparison of Empirical Perspectives and Methods of Research","History/Economic History/History of Economic Thought/Marxist/Socialist           "
6637,"Analyses and Interventions","Anthropology/Social/Cultural Anthropology/Ecology and Resource Conservation           "
6638,"Alternatives to the International Monetary Fund","Economics/Globalization/Multilateral Institutions: Bretton Woods System           "
6639,"Capabilities, Resources and Systematic Injustice: A Case Study of Gender Inequality","Philosophy/Rights and Justice/Women's Rights/Gender Issues/Debates           "
6640,"Locating Resources for the Teaching of Local History","History/Social and Cultural History/Local History           "
6641,"Occupational Attainment and Gender Earnings Differentials in Mexico","Economics/Growth, Allocation and Distribution/Economics of Discrimination           "
6642,"The Soviet Union: Reform of the System or Systemic Transformation?","Economics/Development/Transition from Socialism to Markets           "
6643,"Cultural Relativism 2.0","Anthropology/Methods and Approaches/Cultural Particularism, Universalism, and Relativism           "
6644,"International Migration: A Challenge for Humanity","History/World/Global History/Migration/International Issues           "
6645,"The Hearthhold in Pastoral Fulbe Society, Central Mali: Social Relations, Milk and Drought","Sociology/Political Sociology/Gender/Gender Identity           "
6646,"It's a Material World: History, Artifacts, and Anthropology","Anthropology/Archaeology/Historical Archaeology           "
6647,"Watching Alone: Relational Goods, Television and Happiness","Economics/WellBeing/Consumption and WellBeing           "
6648,"The “Red Menace” and the Rise of Italian Fascism","Political Science/Political Theory and Philosophy/Systems, Legitimacy and Law/Fascism and NeoFascism           /           /Political Science/Comparative Politics/Political Systems, Processes and Transition/Fascism and NeoFascism"
6649,"Symmetric Tragedies, Commons and Anticommons","Political Science/Public Administration/Theory and Research           "
6650,"From Nuremburg to Kosovo: The Morality of Illegal International Legal Reform","Political Science/Political Theory and Philosophy/Systems, Legitimacy and Law/Rule of Law           "
6651,"The Truth Will Set You Free: The Making of Amnesty International","History/Political History/International Organizations/Movements/NGOs/Interest Groups           "
6652,"Equality and Human Rights","Philosophy/Rights and Justice/Human Rights/Theory           "
6653,"Industrial Relations and Productivity Growth: A Comparative Perspective","Economics/Growth, Allocation and Distribution/Industrial Relations/Production Systems           "
6654,"Global Educational Expansion and Socio-Economic Development: An Assessment of Findings from the Social Sciences","Economics/Growth, Allocation and Distribution/Factors of Growth/Education           "
6655,"Labor Structures and School Enrollments in Developing Societies: Thailand and Kenya Compared","Economics/Growth, Allocation and Distribution/Factors of Growth/Education           /           /Economics/WellBeing/Human Development/Education"
6656,"Youth and Cultural Practice","Anthropology/Methods and Approaches/Other           "
6657,"Protestantism and Industrialization: An Examination of Three Alternative Models of the Relationship Between Religion and Capitalism","Sociology/Sociology of Religion/Capitalism           "
6658,"The Right to Development as a Human Right?","Philosophy/Rights and Justice/Human Rights/Contemporary Questions           "
6659,"Protestant Theology and Atheism","History/Social and Cultural History/Systems of Belief/Theory and Issues in Religion and Atheism           "
6660,"Systemism: The Alternative to Individualism and Holism","Sociology/Culture and Society/Sociological Theory           "
6661,"Frank Dikotter. Crime, Punishment and the Prison in Modern China, 1895-1949","Political Science/Public Administration/Basic Governmental Services/Justice and Legal Services           "
6662,"A Sociology for the Second Great Transformation?","Sociology/Political Sociology/Theory of Political Sociology           "
6663,"Revisits: An Outline of a Theory of Reflexive Ethnography","Sociology/Culture and Society/Methods of Study           "
6664,"Multiculturalism and Its Discontents: Majorities, Minorities, and Toleration","Sociology/Culture and Society/Ethnicity, Language, and Culture           "
6665,"Exporting Hyperinflation: The Long Arm of Chiang Kai-shek","History/Economic History/Financial Markets, Financial Institutions, and Monetary History/International           "
6666,"The Rise and Stall of Labor Linkage in Globalization Politics","Economics/Globalization/Globalization and Human Capital           "
6667,"Did Banks Cause the German Industrialization?","History/Economic History/Financial Markets, Financial Institutions, and Monetary History/Banks/Banking           "
6668,"An Identity Theory Approach to Commitment","Social Psychology/Social Cognition/Identity           "
6669,"Identity Processes and Social Stress","Social Psychology/Social Cognition/Identity           "
6670,"Local, Global or Globalized?: Child Development and International Child Rights Legislation","History/Social and Cultural History/Childhood/Children's Rights           "
6671,"Irrigated Rice Culture in Monsoon Asia: The Search for an Effective Water Control Technology","Political Science/Public Administration/Efficiency/Technology           "
6672,"The Tasks of a Philosophy of Law","Philosophy/Rights and Justice/Distributive Justice/Political Philosophy and Theories of Justice           "
6673,"Materialism and Well-Being: A Conflicting Values Perspective","Sociology/Culture and Society/Ethics, Norms, and Values           "
6674,"Shaming of the Anthropologist: Ethical Dilemmas During and in the Aftermath of the Fieldwork Process","Anthropology/Methods and Approaches/Ethnological Approaches and Participant Observation           "
6675,"Trends in the Level and Distribution of U.S. Living Standards: 1973-1993","Economics/Growth, Allocation and Distribution/Economics of Distribution           "
6676,"Conflict Provention as a Political System","Social Psychology/Social Cognition/Perception, Judgment and Mental Representation           "
6677,"Chronic Homelessness: Emergence of a Public Policy","Sociology/Urban Sociology/Housing and Homelessness           "
6678,"Nice Strategies in a World of Relative Gains: The Problem of Cooperation under Anarchy","Social Psychology/Applied Social Psychology/Nation, State, and Politics           "
6679,"Does Venting Anger Feed or Extinguish the Flame? Catharsis, Rumination, Distraction, Anger, and Aggressive Responding","Social Psychology/Applied Social Psychology/Aggression, Violence and AntiSocial Behavior           "
6680,"Authoritarian Determinants of Democratic Party Competition: The Communist Authoritarian Determinants of Democratic Party Competition: The Communist","Political Science/Comparative Politics/Elections, Electoral Systems, and Political Participation/Political Parties, Interest Groups, and Elections           "
6681,"Environmental Sociology and the Explanation of Environmental Reform","Sociology/Political Sociology/Social Movements/Environment           "
6682,"Post-Post-Transition Theories:Walking on Multiple Paths","Anthropology/Social/Cultural Anthropology/Culture/Diffusion and Clash of Cultures           "
6683,"Balancing China's Energy, Economic, and Environmental Goals","Economics/Development/Sustainability/Energy Issues and Green Technologies           "
6684,"The Other Human Rights Treaty Body: The Work of the Committee on the Elimination of Discrimination Against Women","Philosophy/Rights and Justice/Women's Rights/Gender Issues/Current Issues           /           /Political Science/International Relations/Poverty, Inequality, and Rights/Women's Issues"
6685,"Anticipations of Biosecurity","Political Science/Public Policy/Health/Biosecurity           "
6686,"Feminization of the Labor Force: The Effects of Long-Term Development and Structural Adjustment","Economics/Economic Policy/Labor Markets           "
6687,"Term Limits","Political Science/Comparative Politics/Elections, Electoral Systems, and Political Participation/Political Parties, Interest Groups, and Elections           "
6688,"Nationalism and Ethnicity","Political Science/Comparative Politics/Political Systems, Processes and Transition/Nationalism and Nation Building           "
6689,"A World of Emergencies: Fear, Intervention, and the Limits of Cosmopolitan Order","Political Science/International Relations/Conflict, Peace, and Security/International Security           "
6690,"Resisting the Norm: Ironic Images of Marx and Confucius","Economics/Economics as a Social Science/Alternatives to Mainstream Economics/Interdisciplinary Approach           "
6691,"Moral Monism in Environmental Ethics Defended","Philosophy/The Environment/Land Ethics           "
6692,"Intrinsic Value in Nature: A Metaethical Analysis","Philosophy/The Environment/Environmental Valuation           "
6693,"Revaluing Peasant Coffee Production: Organic and Fair Trade Markets in Mexico","Economics/Economic Policy/Trade/Social and Environmental Issues           /           /GDAE/Globalization and Trade"
6694,"Consumption: The New Wave of Research in the Humanities and Social Sciences","Economics/Growth, Allocation and Distribution/Theories and Methods/Consumption Theory           "
6695,"Ideas, Politics, and Public Policy","Sociology/Political Sociology/Theory of Political Sociology           "
6696,"Theorizing the Authentic: Identity, Engagement and Public Space","Political Science/Comparative Politics/Political Systems, Processes and Transition/Democracy           "
6697,"Review Article: International Distributive Justice","Philosophy/Rights and Justice/International Justice/Global Issues           "
6698,"Feminist History After the Linguistic Turn: Historicizing Discourse and Experience","History/Social and Cultural History/Gender/Feminist Theory           "
6699,"The Diaspora of Ethnic Economies: Beyond the Pale?","Economics/Economics as a Social Science/Policy           "
6700,"Behind the Rising Meritocracy: Market, Politics, and Cultural Change in Urban China","Sociology/Culture and Society/Social Change and Development           "
6701,"The Austrian Search for Realistic Foundations","Economics/Economics as a Social Science/Economic Ideas/Other           "
6702,"Evolutionary Psychology: Toward a Unifying Theory and a Hybrid Science","Social Psychology/Approaches to Social Psychology/Evolutionary Psychology           "
6703,"Cereal Cultivation at Swifterbant? Neolithic Wetland Farming on the North European Plain","Anthropology/Archaeology/Historical Archaeology           "
6704,"Gendered Conflict","Political Science/Public Policy/International Security and Peacekeeping           "
6705,"From Hands to Tutors: African Expertise in the South Carolina Rice Economy","History/Economic History/Agriculture, Natural Resources, and Extractive Industries/Cash Crops           "
6706,"Sustainable Flexibility: A Prospective Study on Work, Family, and Society in the Information Age","Economics/Growth, Allocation and Distribution/Industrial Relations/Ownership and Management           "
6707,"The Rule of Law Revival","Political Science/Political Theory and Philosophy/Systems, Legitimacy and Law/Rule of Law           "
6708,"Pace versus Type: The Effect of Economic Growth on Unemployment and Wage Patterns","Economics/Growth, Allocation and Distribution/Technology and Technical Change/Impact on Labor           "
6709,"Stark Realities and Eurocentric/androcentric Bias in the Sociology of Religion","Sociology/Sociology of Religion/Study of Religion/Sociology and Philosophy           "
6710,"Periodizing Postmodernism?","Sociology/Culture and Society/Postmodernism and Politics           "
6711,"Rules of Engagement: Public History and the Drama of Legitimation","History/Social and Cultural History/Local History           "
6712,"Level of Playing Fields and Laissez Faire: Postliberal Development Strategy in Inegalitarian Agrarian Economies","Economics/Growth, Allocation and Distribution/Factors of Growth/Agriculture           "
6713,"Moroccan Berberity, Representational Power and Identity in Video Films","Anthropology/Language and Society/Media and Technology           "
6714,"New Locations: The Virtual City","Anthropology/Methods and Approaches/Structuralism and PostStructuralism           "
6715,"Paleoanthropology: Science or Mythological Charter?","Anthropology/Biological/Physical Anthropology/Paleoanthropology           "
6716,"Cross-Country Technology Diffusion: the Case of Computers","History/Economic History/Technology/Innovations           "
6717,"Does Wealth Inequality Reduce the Gains From Trade?","Economics/Growth, Allocation and Distribution/Growth vs. Inequality/CrossCountry Analysis           "
6718,"Intergenerational Transmission of Language Capital and Economic Outcomes","Anthropology/Language and Society/Education           "
6719,"Impediments to Global Surveillance of Infectious Disease: Economic and Social Consequences of Open Reporting","Economics/Globalization/Globalization and Human Capital           "
6720,"Energy Demand and the Composition of Output Growth","Economics/Growth, Allocation and Distribution/Theories and Methods/Balanced Growth           "
6721,"Social Anthropology and Nutrition: A Different Look at Obesity in America","Anthropology/Social/Cultural Anthropology/Health and Medical Anthropology           "
6722,"The Nature of Agricultural Systems: Food Security and Environmental Balance","Economics/Development/Agrarian Economy and Society/Food Security           "
6723,"The Economic Effects of Unions in Latin America: Their Impact on Wages and the Economic Performance of Firms in Uruguay","History/Economic History/Labor and Employment History/Unions and Other Labor Issues           "
6724,"Fiscal Policy and Productivity Growth in the OECD","Economics/Economic Policy/Fiscal Policy/Theory           "
6725,"Towards a Sociology of Forced Migration and Social Transformation","Sociology/Culture and Society/Cultural Politics           "
6726,"Differential Geographies: Place, Indigenous Rights and 'Local' Resources","Political Science/Comparative Politics/Cultural, Ethnic and Gender Politics and Movements/Indigenous Rights and Activism           "
6727,"An Immigration-Pressure Model of Global Distributive Justice","Philosophy/Rights and Justice/International Justice/Global Issues           "
6728,"Migration in Southern Europe and the Case of Greece","History/World/Global History/Migration/Migration Patterns           "
6729,"Labour Market Flexibility in the Transition Countries: How Much Is Too Much?","Economics/Economic Policy/Labor Markets           "
6730,"Competing Identities: An Ecological Model of Nationality Formation","Political Science/Comparative Politics/Political Systems, Processes and Transition/Nationalism and Nation Building           "
6731,"Privatization: A Case Study in Corruption","Political Science/Public Administration/Privatization           "
6732,"Environmental Nongovernmental Organizations, Civil Society, and Democratization in Bulgaria","History/Environmental History/Environmental Movements and Civil Society/Local Activism           "
6733,"Blood and Debt: War and Taxation in Nineteenth-Century Latin America","Sociology/Political Sociology/The State           "
6734,"Natural Resources and the Wealth of Nations in a Globalized World Economy","Economics/Development/Sustainability/Growth vs. Development           "
6735,"Patterns of Prosocial Reasoning in Indian Children","Social Psychology/Social Cognition/Marketing, Persuasion, and Propaganda           "
6736,"Trade, Investment and Deindustrialization: Myth and Reality","Economics/Economic Policy/Trade/Social and Environmental Issues           "
6737,"Editorial: Responsible Well-Being -- A Personal Agenda for Development","Economics/WellBeing/Visions of a Good Life           /           /Philosophy/WellBeing/Concepts of WellBeing/Basic Needs"
6738,"Colonial India: British versus Indian Views of Development","Sociology/Political Sociology/Colonialism and Imperialism           "
6739,"India in the 1990s: The Impact of Globalisation","History/Economic History/Globalization/International/Regional Economic Agreements           "
6740,"The Hazard of Moral Hazard - Untangling the Asian Crisis","Economics/Economic Policy/Financial Crises and Recovery Efforts           "
6741,"Kicking Away the Ladder: “Good Policies” and “Good Institutions” in Historical Perspective","Economics/Economic Policy/Institutions/Theory and Policy           "
6742,"On recent projects and experiences of the sufficiency economy: a critique","Political Science/Public Policy/Resource Use and Environment           "
6743,"Intransitivity and Future Generations: Debunking Parfit's Mere Addition Paradox","Philosophy/Rights and Justice/Ethical Theory/Problems for Modern Ethical Theory           "
6744,"Energy Costs: A Review of Methods","Economics/Economics as a Social Science/Alternatives to Mainstream Economics/Ecological/ Sustainability Approach           "
6745,"Aristotle on Well-Being and Intellectual Contemplation","Philosophy/WellBeing/Classics/Ancient           "
6746,"The Dynamics of Racial Residential Segregation","Sociology/Urban Sociology/Poverty, Inequality, and Discrimination           "
6747,"Community Forestry in Theory and Practice: Where Are We Now?","Anthropology/Social/Cultural Anthropology/Ecology and Resource Conservation           "
6748,"Social Bonds and Posttraumatic Stress Disorder","Social Psychology/Social Cognition/Attitude, Emotions and WellBeing           "
6749,"The Biopolitics of Hindu Nationalism","Anthropology/Social/Cultural Anthropology/Religion           "
6750,"The Challenge of Child Labour in Rural India: A Multi-Dimensional Problem in Need of an Orchestrated Policy Response","Economics/Development/Women and Children/Labor Issues           "
6751,"Schools, Household, Risk, and Gender: Determinants of Child Schooling in Ethiopia","Economics/Development/Poverty and Inequality/Alleviation of Poverty  Programs and Policies           "
6752,"Developing Countries, Donor Leverage, and Access to Bird Flu Vaccines","Economics/WellBeing/Human Development/Health and Welfare           "
6753,"Resource Analysis of the Chinese Society Based on Exergy- Part 1: Fossil Fuels and Energy Minerals","History/Economic History/Agriculture, Natural Resources, and Extractive Industries/Mining           "
6754,"X-Efficiency, Organizational Efficiency and Indian Economic Thought: Thirukkural","History/Economic History/History of Economic Thought/Worldwide           "
6755,"Revolution in Education: China and Cuba in Global Context, 1957-76","Political Science/Comparative Politics/Social Movements           "
6756,"When the Personal Meets the Global at Home: Filipina Domestics and their Female Employers in Taiwan","Economics/Globalization/Globalization and Women           "
6757,"An Inverted-U Relationship between Inequality and Long-Run Growth","Economics/Growth, Allocation and Distribution/Growth vs. Inequality/CrossCountry Analysis           "
6758,"Intra-National versus International Trade in the European Union: Why do National Borders Matter?","Economics/Globalization/Global Trade           "
6759,"Children's Social Competence in Cultural Context","Social Psychology/Applied Social Psychology/Children's Issues           "
6760,"The Politics of Language Acquisition: Language Learning as Social Modeling in the Northwest Amazon","Anthropology/Language and Society/Gender           "
6761,"Happiness: A Look into the Folk Psychology of Four Cultural Groups","Social Psychology/Group Dynamics/Norms, Shared Values, and Beliefs           "
6762,"The Brigades Movement in Botswana: A Model for Replication?","Political Science/Public Policy/Media, Culture, and Society           "
6763,"Young and Old in Sub-Saharan Africa: Who are the Real Democrats","Anthropology/Social/Cultural Anthropology/Political Practices, Organization, and Structure/Civil Society and the State           "
6764,"Renewing the United Nations System","Political Science/Public Policy/Health/Public Health Policy           "
6765,"Reducing Irregular Migration From China","History/World/Global History/Migration/International Issues           "
6766,"Youth Transitions, Gender and Social Change","Sociology/Family and Kinship/Modernization and Family Change           "
6767,"Will Investment Rules Shrink Policy Space for Sustainable Development? Evidence from the Electricity Sector","Economics/Globalization/Globalization: Negative Development Impacts           "
6768,"Framing Theory","Political Science/Political Theory and Philosophy/Concepts/Other           "
6769,"Global Poverty in the Late 20th Century","Economics/Globalization/Globalization: Negative Development Impacts           "
6770,"Analytical Foundations of the Social Sciences: Relevant Comparisons","Political Science/International Relations/Approach, Critique of International Relations Theory, and Methodology           "
6771,"Basic versus Complex Logic in International Relations: Taking Stock via Comparative Inquiry","About Social Science/History and Evolution of Social Science           "
6772,"Bangladesh: A Tough Battle for a National Drug Policy","Political Science/Public Policy/Health/Public Health Policy           "
6773,"Gender Matters: Studying Globalization and Social Change in the 21st Century","Sociology/Culture and Society/Globalization, Cultures, and Communication           /           /Sociology/Family and Kinship/Globalization"
6774,"Historical Roots for Ecological Economics: Biophysical Versus Allocative Approaches","History/Environmental History/Ideas and Thinkers/Historical Roots           "
6775,"Global Freshwater Scarcity: Is Privatization a Solution?","Economics/Economic Policy/Ecology and Natural Resources           "
6776,"Designing Policies that Address the Relationship Between Woman Abuse and Economic Resources","Economics/Economic Policy/Fiscal Policy/Social/Political Issues           "
6777,"Democrats and Dictators: Southeast Asia's Uneven Information Landscape","History/Social and Cultural History/Communication/Media/Other Media           "
