5000,"Origins of the East German Environmental Movement",0149-7952,"Jones, Merrill E.","History/Environmental History/Environmental Movements and Civil Society/Local Activism           "
5001,"Patrons, Clients and Civil Society: A Case Study of Environmental Politics in Postwar Lebanon",0271-3519,"Kingston, Paul","History/Environmental History/Environmental Movements and Civil Society/Local Activism           "
5002,"Environmental Movement in Korea and Its Political Empowerment",0023-3900,"Lee, See-jae","History/Environmental History/Environmental Movements and Civil Society/Local Activism           "
5003,"Deforestation and Popular Resistance in Acre: From Local Social Movement to Global Network",1532-687X,"Schwartzman, Stephan","History/Environmental History/Environmental Movements and Civil Society/Local Activism           "
5004,"The Rise of Environmentalism in Australia",0726-7215,"Young, Liz","History/Environmental History/Environmental Movements and Civil Society/Local Activism           "
5005,"Environmental Justice, Native Rights, Tourism, and Opposition to Military Control: The Case of Kaho'olawe",0021-8723,"Blackford, Mansel G.","History/Environmental History/Environmental Justice           "
5006,"On Their Own: Development Strategies of the Self-Employed Women's Association (SEWA) in India",1011-6370,"Datta, Rekha","Economics/Development/Women and Children/Labor Issues           "
5007,"The Impact of Modern Times",0-631-16178-3,"Roberts, Neil","History/Environmental History/Environmental Destruction           "
5008,"The Impact of the Coal Age on the German Environment: A Review of the Historical Literature",0967-3407,"Cioc, Mark","History/Environmental History/Minerals and Mining           "
5009,"Inequality and Poverty",0674452550,"Sen, Amartya","Economics/Growth, Allocation and Distribution/Poverty/Concepts and Measurement           "
5010,"Mining and the Environment",0-87371-4415,"Sengupta, Mritunjoy","History/Environmental History/Minerals and Mining           "
5011,"Environment and Society: Long-Term Trends in Latin American Mining",0967-3407,"Dore, Elizabeth","History/Environmental History/Minerals and Mining           "
5012,"The Anthropology of Oil: The Impact of the Oil Industry on a Fishing Community in the Niger Delta",1043-1578,"Fentiman, Alicia","History/Environmental History/Minerals and Mining           "
5013,"Causes of Short Stature Among Coalmining Children, 1823-1850",0013-0117,"Kirby, Peter","History/Environmental History/Minerals and Mining           "
5014,"Gardener's Delight",0195-2633,"Bracegirdle, Cyril","History/Environmental History/Gardens, Parks, and Zoos/Gardens           "
5015,"A Garden Enclosed: Botanical Barter in Sydney, 1818-39",0007-0874,"Endersby, Jim","History/Environmental History/Gardens, Parks, and Zoos/Gardens           "
5016,"The History of Moutoa Gardens and Claims of Ownership",0032-4000,"Moon, Paul","History/Environmental History/Gardens, Parks, and Zoos/Gardens           "
5017,"Ethics and Morality, Questions in the History of Garden and Landscape Design: A Preliminary Essay",0144-5170,"Wolschke-Bulmahn, Joachim","History/Environmental History/Gardens, Parks, and Zoos/Gardens           "
5018,"Conservation and Landscape Transformation in Sonora, Mexico",0894-8410,"Burquez, Alberto; Martinez-Yrizar, Angelina","History/Environmental History/Gardens, Parks, and Zoos/Parks and Zoos           "
5019,"Zoo Story",1048-4949,"Marshall, Anthony D.","History/Environmental History/Gardens, Parks, and Zoos/Parks and Zoos           "
5020,"Creating the Garden City: The Singapore Experience",0042-0980,"Yuen, Belinda","History/Environmental History/Gardens, Parks, and Zoos/Parks and Zoos           "
5021,"Environmental Intervention and Water Resource Management in the History of the Mezzogiorno",1353-2944,"Bevilacqua, Piero","History/Environmental History/Water           "
5022,"Fishing Farmers or Farming Fishermen? The Quest for Household Income and Nutritional Security on the Kenyan Shores of Lake Victoria",0001-9909,"Geheb, Kim; Binnis, Tony","History/Environmental History/Water           "
5023,"Environmental Concerns: Kalabagh Dam and Sindh-Punjab Water Dispute in Pakistan",1044-2979,"Laghari, Javaid R.","History/Environmental History/Water           "
5024,"Lake Victoria: Casualty of Capitalism",0027-0520,"MacDougall, A. Kent","History/Environmental History/Water           "
5025,"Policy Response to Poverty and Inequality in the Developing World",0251-2920,"Berry, Albert","Economics/Growth, Allocation and Distribution/Poverty/Poverty Alleviation           "
5026,"Further Reflections on Amazonian Environmental History: Transformations of Rivers and Streams",0023-8791,"Raffles, Hugh; WinklerPrins, Antoinette M. G. A.","History/Environmental History/Water           "
5027,"Central Asia's Dead Sea",0739-1854,"Schaar, Elisa","History/Environmental History/Water           "
5028,"The Environmental Consequences of Independence and Socialism in North Pare, Tanzania, 1961-88",0021-8537,"Sheridan, Michael J.","History/Environmental History/Water           "
5029,"Aquatic Ecotoxicity Due to Oil Pollution in the Ecuadorian Amazon",1463-4988,"Wernersson, Ann-Sofie","History/Environmental History/Water           "
5030,"Poverty Reduction with Growth and Redistribution",0012-155X,"Dagdeviren, Hulya; Van der Hoeven, Rolph; Weeks, John","Economics/Growth, Allocation and Distribution/Poverty/Poverty Alleviation           "
5031,"The Paradox of Redistribution and Strategies of Equality: Welfare State Institutions, Inequality, and Poverty in the Western Countries",0003-1224,"Korpi, Walter; Palme, Joakim","Economics/Growth, Allocation and Distribution/Poverty/Poverty Alleviation           "
5032,"Revisiting Growth and Poverty Reduction in Indonesia: What Do Subnational Data Show?",1655-5252,"Balisacan, Arsenio M.; Pernia, Ernesto M.; Asra, Abuzar","Economics/Growth, Allocation and Distribution/Poverty/Poverty and Economic Growth           "
5033,"Latin America: Poverty as a Challenge for Government and Society",8200226492,"Golbert, Laura; Kessler, Gabriel","Economics/Growth, Allocation and Distribution/Poverty/Poverty and Inequality           "
5034,"Livelihoods and Poverty: The Role of Migration: A Critical Review of the Migration Literature",0022-0388,"De Haan, Arjan","Economics/Development/Population and Quality of Life/Migration           "
5035,"The Great Chain of Poverty Explanations",8200226492,"Miller, S. M.","Economics/Growth, Allocation and Distribution/Poverty/Poverty and Inequality           "
5036,"Conference Review: Spatial Inequality in Africa",0376-835X,"Naude, Willem A; Krugell, Waldo","Economics/Growth, Allocation and Distribution/Poverty/Poverty and Inequality           "
5037,"Can High-Inequality Developing Countries Escape Absolute Poverty?",NO ISBN FOUND,"Ravallion, Martin","Economics/Growth, Allocation and Distribution/Poverty/Poverty and Inequality           "
5038,"The Present Situation in Poverty Research",8200226492,"Samad, Syed Abdus","Economics/Growth, Allocation and Distribution/Poverty/Poverty and Inequality           "
5039,"Balancing Trickle Down and Basic Needs Strategies: Income Distribution Issues in Large Middle-Income Countries with Special Reference to Latin America",0-8213-0524-7,"Selowsky, M.","Economics/Growth, Allocation and Distribution/Poverty/Poverty and Inequality           "
5040,"Transboundary Externalities in the Environmental Transition Hypothesis",0924-6460,"Ansuategi, Alberto; Perrings, Charles","Economics/Growth, Allocation and Distribution/Problems with Growth/Environmental Impacts           "
5041,"Production, Consumption and the World Summit on Sustainable Development",1387-585X,"Barber, Jeffrey","Economics/Growth, Allocation and Distribution/Problems with Growth/Environmental Impacts           "
5042,"Transitional Impacts of Environmental Policy in an Endogenous Growth Model",0020-6598,"Bovenberg, A. Lans; Smulders, Sjak","Economics/Growth, Allocation and Distribution/Problems with Growth/Environmental Impacts           "
5043,"From Growth to Sustainable Development",1559631996,"Brown, Lester R.","Economics/Growth, Allocation and Distribution/Problems with Growth/Environmental Impacts           "
5044,"Reusing and Recycling Materials",0393308235,"Brown, Lester R.; Flavin, Christopher; Postel, Sandra","Economics/Growth, Allocation and Distribution/Problems with Growth/Environmental Impacts           "
5045,"From Growth to Sustainable Progress",0393308235,"Brown, Lester R.; Flavin, Christopher; Postel, Sandra","Economics/Growth, Allocation and Distribution/Problems with Growth/Environmental Impacts           "
5046,"Environmental Preservation, Sectoral Unemployment, and Trade in Resources",1363-6669,"Chao, Chi-Chur; Kerkvliet, Joe R.; Yu, Eden S. H.","Economics/Growth, Allocation and Distribution/Problems with Growth/Environmental Impacts           /           /Economics/Globalization/Global Environmental Issues/Ecology and Resources"
5047,"Sustainable Development: Beyond 'Zero Growth'",0745303129,"Jacobs, Michael","Economics/Growth, Allocation and Distribution/Problems with Growth/Environmental Impacts           "
5048,"Welfare Accounting and the Environment: Reassessing Brazilian Economic Growth, 1965-1993",0012-155X,"Torras, Mariano","Economics/Growth, Allocation and Distribution/Problems with Growth/Environmental Impacts           "
5049,"The Development of Business Archives in the United States: An Overview and a Personal Perspective",0360-9081,"Adkins, Elizabeth W.","History/Social and Cultural History/Archives           "
5050,"The Archive's Door Ajar: The Registration of Company Archives in Antwerp and Flemish Brabant and a First Attempt to Construct a Scientific Acquisition Model for Company Archives in Flanders",0035-0869,"Buntinx, Jeroen; Sas, Bart; DeCaigny, Sofie; Lefebvre, Wim","History/Social and Cultural History/Archives           "
5051,"A Study in Local History: Kirillapone in the 18th Century",1013-9818,"DeSilva, G. P. S. H.","History/Social and Cultural History/Archives           "
5052,"Private Organizations, Public Purposes: Nonprofits and their Archives",0021-8723,"Hammack, David C.","History/Social and Cultural History/Archives           "
5053,"Dust to Dust: A User's Guide to Local Archives in Mali",0361-5413,"Mann, Gregory","History/Social and Cultural History/Archives           "
5054,"Unmasking the Homophile in 1950s Los Angeles: An Archival Record",0299160947,"Quimbly, K.; Williams, Walter L.","History/Social and Cultural History/Archives           "
5055,"Jamaican Archival Resources for Seventeenth and Eighteenth Century Atlantic History",1743-9523,"Robertson, James","History/Social and Cultural History/Archives           "
5056,"The Ghana Public Records and Archives Administration Department-Tamale: A Guide for Users",0361-5413,"Abdulai, Iddirisu","History/Social and Cultural History/Archives           "
5057,"Nature of the Archival Sources for the Study of Modern Indian History",0019-686X,"Sareen, T. R.","History/Social and Cultural History/Archives           "
5058,"Archival Practice and the Foundations of Historical Method",0021-8723,"Grigg, Susan","History/Social and Cultural History/Archives           "
5059,"Theories of the Archive from Across the Disciplines",1531-2542,"Manoff, Marlene","History/Social and Cultural History/Archives           "
5060,"Liberty, Equity, Posterity?: Some Archival Lessons from the Case of the French Revolution",0360-9081,"Panitch, Judith M.","History/Social and Cultural History/Archives           "
5061,"Orphans of Empire: Divided Peoples, Dilemmas of Identity, and Old Imperial Borders in East and Southeast Asia",0010-4175,"Cribb, Robert; Narangoa, Li","History/World/Global History/Borders and Regions/Border Establishment           "
5062,"The History of China's Borders",0130-3864,"Molodin, Viacheslav Ivanovich; Komissarov, Sergei AleksandroviCh.","History/World/Global History/Borders and Regions/Border Establishment           "
5063,"Working through Partition: Making a Living in the Bengal Borderlands",0020-8590,"Schendel, Willem van","History/World/Global History/Borders and Regions/Border Establishment           "
5064,"Borderland Breccia: The Mutant Hero in the Historical Imagination of a Central-African Diamond Frontier",1532-5768,"Boeck, Filip de","History/World/Global History/Borders and Regions/Boundaries and Borderlands           "
5065,"Creating the Frontier: Border, Identity and History in Japan's Far North",1036-6008,"Morris-Suzuki, Tessa","History/World/Global History/Borders and Regions/Boundaries and Borderlands           "
5066,"Beyond the New Borders",1045-5736,"Mungiu, Alina","History/World/Global History/Borders and Regions/Historical Models           "
5067,"Colonial Routes: Reorienting the Northern Frontier of British India",0014-1801,"Haines, Chad","History/World/Global History/Borders and Regions/Boundaries and Borderlands           "
5068,"It's Mine!, No, It's Mine! Early Company Squabbles over the Border Areas of the Tati Concession",0525-5090,"Burrett, Robert S.","History/World/Global History/Borders and Regions/Disputes/Conflicts           "
5069,"Can Economic Growth Be Sustained? A Post-Malthusian Perspective",0098-7921,"Ruttan, Vernon W.","Economics/Growth, Allocation and Distribution/Problems with Growth/Limits to Growth           "
5070,"Building on Bolton: The Spanish Borderlands Seventy-Five Years Later",0023-8791,"Cummins, Victoria H.; Cummins, Light T.","History/World/Global History/Borders and Regions/Historical Models           "
5071,"Empires, Borderlands, and Diasporas: Eurasia as Anti-Paradigm for the Post-Soviet Era",0002-8762,"Hagen, Mark von","History/World/Global History/Borders and Regions/Historical Models           "
5072,"Border Work, Border Trouble: Postcolonial Feminism and the Ayah in Bapsi Sidhwa's Cracking India",0026-7724,"Hai, Ambreen","History/World/Global History/Borders and Regions/Historical Models           "
5073,"Settling the Brazilian Frontier: The Role of Military Colonies, 1849-1889",0886-5655,"Garner, Lydia","History/World/Global History/Borders and Regions/Boundaries and Borderlands           "
5074,"Double Struggle, No Income: Ottoman Borderlands in Northern Albania",0272-7919,"Reinkowski, Maurus","History/World/Global History/Borders and Regions/Boundaries and Borderlands           "
5075,"The Young Turks: Children of the Borderlands?",0272-7919,"Zurcher, Erik-Jan","History/World/Global History/Borders and Regions/Boundaries and Borderlands           "
5076,"The Armenian Question and the Wartime Fate of the Armenians As Documented By the Officials of the Ottoman Empire's World War I Allies: Germany and Austria-Hungary",0020-7438,"Dadrian, Vahakn N.","History/World/Global History/Empires/Imperialism/Historiography           "
5077,"Religious Prerogatives and Policing the Poor in Two Ottoman Contexts",0022-1953,"Ener, Mine","History/World/Global History/Empires/Imperialism/Consequences and Critiques           "
5078,"The Challenge of Growth, Employment and Poverty in the South African Economy Since Democracy: An Exploratory Review of Selected Issues",0376-835X,"Bhorat, Haroon; Cassim, Rashad","Economics/Growth, Allocation and Distribution/Problems with Growth/Visions for the Future           "
5079,"The Costs and Benefits of British Imperialism 1846-1914",0031-2746,"O'Brien, Patrick","History/World/Global History/Empires/Imperialism/Consequences and Critiques           "
5080,"Alexander II's Reforms: Causes and Consequences",0962-9610,"Watts, Carl Peter","History/World/Global History/Empires/Imperialism/Consequences and Critiques           "
5081,"Lessons of Empire: Britain and India",0036-0775,"Misra, Maria","History/World/Global History/Empires/Imperialism/Consequences and Critiques           "
5082,"The Nature of Anti-Soviet Armed Resistance, 1942-44: The North Caucasus, the Kalmyk Autonomous Republic, and Crimea",1531-023X,"Statiev, Alexander","History/World/Global History/Empires/Imperialism/Consequences and Critiques           "
5083,"Corruption, Economic Growth, and Income Inequality in Africa",1435-6104,"Gyimah-Brempong, Kwabena","Economics/Growth, Allocation and Distribution/Problems with Growth/Visions for the Future           "
5084,"Alexander I, the Holy Alliance and Clemens Metternich: A Reappraisal",0012-8449,"Delfiner, Henry A.","History/World/Global History/Empires/Imperialism/Imperial Diplomacy           "
5085,"Philanthropic Activity, Ottoman Patriotism, and the Hamidian Regime 1876-1909",0020-7438,"Zbek, Nadir","History/Political History/Colonial/Postcolonial History           "
5086,"A Century Later",1040-2659,"Chomsky, Noam","History/World/Global History/Empires/Imperialism/Consequences and Critiques           "
5087,"The End of the Ottoman Empire",0022-0094,"Kedourie, Elie","History/World/Global History/Empires/Imperialism/Rise/Fall           "
5088,"Some Reflections on the Decline of the Ottoman Empire",0585-5292,"Lewis, Bernard","History/World/Global History/Empires/Imperialism/Rise/Fall           "
5089,"World History and the Rise and Fall of the West",1045-6007,"McNeill, William H.","History/World/Global History/Empires/Imperialism/Rise/Fall           "
5090,"A History of the Indian Ocean Region: A Conceptual Framework",0156-8698,"McPherson, Kenneth","History/World/Global History/Empires/Imperialism/Rise/Fall           "
5091,"The United States and Spain in 1822",0002-8762,"Robertson, William Spence","History/World/Global History/Empires/Imperialism/Rise/Fall           "
5092,"Japan Joins the Axis",0002-9300,"Stowell, Ellery C.","History/World/Global History/Empires/Imperialism/Rise/Fall           "
5093,"The Italian Colonial Empire",03684016,"Tate, H. R.","History/World/Global History/Empires/Imperialism/Rise/Fall           "
5094,"The Body as Method? Reflections on the Place of the Body in Gender History",0-8014-4357-1,"Canning, Kathleen","History/Social and Cultural History/Gender/Construction of Gender           "
5095,"Politics in an Age of Anxiety: Cold War Political Culture and the Crisis in American Masculinity, 1949-1960",0021-8723,"Cuordileone, Kyle A.","History/Social and Cultural History/Gender/Construction of Gender           "
5096,"Gender vs. Diversity Mainstreaming: A Preliminary Examination of the Role and Transformative Potential of Feminist Theory",0008-4239,"Hankivsky, Olena","History/Social and Cultural History/Gender/Construction of Gender           "
5097,"Conceptualizing the History of Women in Africa, Asia, Latin America and the Caribbean, and the Middle East",1042-7961,"Johnson-Odim, Cheryl; Strobel, Margaret","History/Social and Cultural History/Gender/Construction of Gender           "
5098,"China's Sustainable Development in Global Perspective",0021-9096,"Chow, Peter C. Y.","Economics/Growth, Allocation and Distribution/Problems with Growth/Visions for the Future           "
5099,"Of Boys and Men: Masculinity and Gender in Southern African Studies",0305-7070,"Morrell, Robert","History/Social and Cultural History/Gender/Construction of Gender           "
5100,"What Do We Learn About Difference from the Scholarship on Gender?",0037-7732,"Rosenfeld, Rachel A.","History/Social and Cultural History/Gender/Construction of Gender           "
5101,"From Women and Imperialism to Gendering Colonialism?",0258-2473,"Gaitskell, Deborah","History/Social and Cultural History/Gender/Activism           "
5102,"Multiple Contestations: Pandita Ramabai's Educational and Missionary Activities in Late Nineteenth-Century India and Abroad",0961-2025,"Kosambi, Meera","History/Social and Cultural History/Gender/Activism           "
5103,"Feminist Theory and Historical Practice: Rereading Elizabeth Blackwell",0018-2656,"Morantz-Sanchez, Regina","History/Social and Cultural History/Gender/Feminist Theory           "
5104,"Introduction: History and Feminist Theory, or Talking Back to the Beadle",0018-2656,"Shapiro, Ann-Louise","History/Social and Cultural History/Gender/Feminist Theory           "
5105,"Local Regimes: Does Globalization Challenge the Growth Machine?",0278-4416,"Clark, Cal; Green, Johnny; Grenell, Keenan","Economics/Growth, Allocation and Distribution/Problems with Growth/Visions for the Future           "
5106,"La Theorie qui n'en est pas une or, Why Clio Doesn't Care",0018-2656,"Steedman, Carolyn","History/Social and Cultural History/Gender/Feminist Theory           "
5107,"Feminism, Institutionalism, and Idiom of Failure",1040-7391,"Wiegman, Robyn","History/Social and Cultural History/Gender/Feminist Theory           "
5108,"Feminist Movements: Gender and Sexual Equality",0-631-22393-2,"Winslow, Barbara","History/Social and Cultural History/Gender/Feminist Theory           "
5109,"Women in History. The Modern Period",0031-2746,"Scott, Joan Wallach","History/Social and Cultural History/Gender/Feminist Theory           "
5110,"The Contribution of Women to Modern Historiography in Great Britain, France, and the United States, 1750-1940",0002-8762,"Smith, Bonnie G.","History/Social and Cultural History/Gender/Feminist Theory           "
5111,"Brave New Worlds: Women's and Gender History",0043-5597,"Brown, Kathleen M.","History/Social and Cultural History/Gender/Feminist Theory           "
5112,"Explaining Agricultural and Agrarian Policies in Developing Countries",0022-0515,"Deininger, Klaus","Economics/Development/Agrarian Economy and Society/Agriculture and Industry           "
5113,"Food Security in Less Developed Countries, 1970 to 1990",0003-1224,"Jenkins, J. Craig; Scanlan, Stephen J.","Economics/Growth, Allocation and Distribution/Problems with Growth/Visions for the Future           "
5114,"Gender and the Practices of Scientific History: The Seminar and Archival Research in the Nineteenth Century",0002-8762,"Smith, Bonnie G.","History/Social and Cultural History/Archives           "
5115,"Feminization Revisited: Protestantism and Gender at the Turn of the Century",0-252-06998-6,"Taves, Ann","History/Social and Cultural History/Gender/Feminist Theory           "
5116,"'To Educate Women into Rebellion': Elizabeth Cady Stanton and the Creation of a Transatlantic Network of Radical Suffragists",0002-8762,"Holton, Sandra Stanley","History/Social and Cultural History/Gender/Activism           "
5117,"Revolution, Nationalism, and Anti-Imperialism",0-631-22393-2,"Kaplan, Temma","History/Political History/Crisis/Transitions/Revolutions/Regime Change/Reform           "
5118,"Militarism, Colonialism, and the Trafficking of Women: Comfort Women Forced into Sexual Labor for Japanese Soldiers",0007-4810,"Kazuko, Watanabe","History/Social and Cultural History/Gender/Activism           "
5119,"Gender and the Politics of Class Formation: Rethinking German Labor History",0002-8762,"Canning, Kathleen","History/Social and Cultural History/Gender/Feminist Theory           "
5120,"International Diffusion of Technology and International Trade Competition: Why Growth Rates Differ?",0861878949,"Fagerberg, Jan","Economics/Growth, Allocation and Distribution/Technology and Technical Change/Economic Impacts           "
5121,"Towards a Feminist Framework for the History of Women's Leisure, 1920-1960",0-582-38219X,"Langhamer, Claire","History/Social and Cultural History/Gender/Feminist Theory           "
5122,"Gender and Labor in World History",0-631-22393-2,"Frader, Laura Levine","History/Social and Cultural History/Gender/Work and Family           "
5123,"Class and Gender in Modern British Labour History",0031-2746,"Harrison, Brian","History/Social and Cultural History/Gender/Work and Family           "
5124,"On Language, Gender, and Working-Class History",0-231-11857-0,"Scott, Joan Wallach","History/Social and Cultural History/Gender/Work and Family           "
5125,"Toward the New Wife",0-06-019338-7,"Yalom, Marilyn","History/Social and Cultural History/Gender/Work and Family           "
5126,"Local History in Japan",0024-5585,"Komatsu, Y.; Shoda, K.","History/Social and Cultural History/Local History           "
5127,"The Study of Local History in Hong Kong: A Review",0085-5774,"Sinn, Elizabeth","History/Social and Cultural History/Local History           "
5128,"History and Information Technology: Some Implications for the Local Historian",0024-5585,"Jordan, Spencer","History/Social and Cultural History/Local History           "
5129,"The Repercussions of Nuclearization on Pakistani Women",1011-6370,"Khattak, Saba Gul","Economics/Growth, Allocation and Distribution/Technology and Technical Change/Economic Impacts           "
5130,"Provincialism Austrian Style: Commemorative and Local History Exhibitions",1215-735X,"Lovei, Pal","History/Social and Cultural History/Local History           "
5131,"Notes on the Sources for Local History in North India",0021-9118,"Metcalf, Thomas R.","History/Social and Cultural History/Local History           "
5132,"Locality, Women, and History: Local History Research from a Feminist Perspective",0700-3226,"Yoon, Taek-Lim","History/Social and Cultural History/Local History           "
5133,"Missing Heads: Public History in South Africa",0165-1153,"Worden, Nigel","History/Social and Cultural History/Local History           "
5134,"Past and Present in Local Histories of the Ottoman Period from Syria and Lebanon",0026-3206,"Reily, James A.","History/Social and Cultural History/Local History           "
5135,"Black History from the Community: The Strategies of Fieldwork",0022-2984,"Sitton, Thad","History/Social and Cultural History/Local History           "
5136,"Voices of South Asian Women: Immigration and Mental Health",0363-0242,"Ahmad, Farah; Shik, A.; Vanza, R.; Cheung, A. M.; George, U.; Stewart, Donna E.","History/World/Global History/Migration/Causes/Consequences           "
