4713,"Redressing School Inequalities in the Eastern Cape, South Africa",0305-7070,"Lemon, Anthony","History/Social and Cultural History/Health, Education, and WellBeing           "
4714,"Government Expenditure on Education, Economic Growth and Long Waves: The Case of Portugal",0030-9230,"Nunes, Ana Bela","History/Social and Cultural History/Health, Education, and WellBeing           "
4715,"Literacy, Schooling and Economic Modernization: A Historian's Approach",0030-9230,"Nunez, Clara Eugenia","History/Social and Cultural History/Health, Education, and WellBeing           "
4716,"The Economic Impact of HIV/AIDS on Rural Households in Limpopo Province",0038-2280,"Oni, S. A.; Obi, C. L.; Okorie, A.; Thabede, D.; Jordan, A.","History/Social and Cultural History/Health, Education, and WellBeing           "
4717,"Poverty and Economics in the Qur'an",0022-1953,"Bonner, Michael","History/Economic History/History of Economic Thought/Worldwide           "
4718,"The Political Economy of Equitable Development in Thailand",0737-6650,"Kuhonta, Erik M.","Economics/Economic Policy/Development Policy           "
4719,"Randomization and Social Program Evaluation: The Case of Progresa",0002-7162,"Parker, Susan W.; Teruel, Graciela M.","Political Science/Public Policy/Social Welfare/Social Welfare/Welfare State           "
4720,"The Evolution of Social Policy in Sri Lanka 1833-1970: The British Colonial Legacy",1013-9818,"Jayasuriya, Laksiri","History/Political History/Colonial/Postcolonial History           "
4721,"Empire of the Young: The Legacies of State Agricultural Policy on Local Capitalism and Social Support Networks in Ghana and Cote D'Ivoire",0010-4175,"MacLean, Lauren Morris","History/Economic History/Economic Development, Growth, and Aggregate Productivity/National Development           "
4722,"On the Welfare Cost of Economic Fluctuations in Developing Countries",0020-6598,"Pallage, Stephane; Robe, Michel A.","Economics/Growth, Allocation and Distribution/Income Inequality           "
4723,"Pushing for Social Care Expansion: Demography, Gender, and the New Politics of the Welfare State in Japan",0737-6650,"Peng, Ito","History/Social and Cultural History/Gender/Activism           "
4724,"Self-reliance before the Welfare State: Evidence from the Charity Organization Movement in the United States",0022-0507,"Ziliak, Stephen T.","History/Social and Cultural History/Health, Education, and WellBeing           "
4725,"Competitive Collaboration and Market Contestability: Cases in Mexican and UK Banking, 1945-75",0958-5206, 0958-5260,"Batiz-Lazo, Bernardo; DelAngel, Gustavo A.","History/Economic History/Financial Markets, Financial Institutions, and Monetary History/Banks/Banking           "
4726,"Branch Banking Restrictions and Finance Constraints in Early-Twentieth-Century America",0022-0507,"Giedeman, Daniel C.","History/Economic History/Financial Markets, Financial Institutions, and Monetary History/Banks/Banking           "
4727,"Pride and Prejudice in Prague: Understanding Early Policy Error and Belated Reform in the Czech Economic Transition",0888-3254,"Horowitz, Shale; Petras, Martin","History/Economic History/Financial Markets, Financial Institutions, and Monetary History/Banks/Banking           "
4728,"The Foreign and Native Banks in China: Chop Loans in Shanghai and Hankow before 1914",0026-749X,"Nishimura, Shizuya","History/Economic History/Financial Markets, Financial Institutions, and Monetary History/Banks/Banking           "
4729,"Finance of Industry in Hong Kong 1950-70: A Case of Market Failure?",0007-6791,"Schenk, Catherine R.","History/Economic History/Financial Markets, Financial Institutions, and Monetary History/Banks/Banking           "
4730,"Financial Integration, Dis-integration and Emerging Re-integration in the Eastern Mediterranean, c.1850 to the Present",1468-0416, 0963-8008,"Tschoegl, Adrian E.","History/Economic History/Financial Markets, Financial Institutions, and Monetary History/Banks/Banking           "
4731,"Informal Financial Service Institutions for Survival: African Women and Stokvels in Urban South Africa, 1930-1998",1467-2227,"Verhoef, Grietjie","History/Economic History/Financial Markets, Financial Institutions, and Monetary History/Banks/Banking           "
4732,"Banking from the Bottom Up: The Case of Migrant Savers at the Philadelphia Saving Fund Society during the Late Nineteenth Century",1474-0052, 0968-5650,"Wadhwani, Rohit Daniel","History/Economic History/Financial Markets, Financial Institutions, and Monetary History/Banks/Banking           "
4733,"A Note on the Evolution of Inequality in Poland, 1992-99",0309-166X,"Podkaminer, Leon","Economics/Growth, Allocation and Distribution/Income Inequality           "
4734,"Economics and Depression",0-415-11819-0,"Rothermund, Dietmar","History/Economic History/Financial Markets, Financial Institutions, and Monetary History/Crisis/Transition           "
4735,"The Fate of Africa",0-415-11819-0,"Rothermund, Dietmar","History/Economic History/Financial Markets, Financial Institutions, and Monetary History/Crisis/Transition           "
4736,"The New Role of the State in Latin America",0-415-11819-0,"Rothermund, Dietmar","History/Economic History/Financial Markets, Financial Institutions, and Monetary History/Crisis/Transition           "
4737,"Round up the Usual Suspects: The Latest Latin American Debt Crisis",0030-4387,"Schuker, Stephen A.","History/Economic History/Financial Markets, Financial Institutions, and Monetary History/Crisis/Transition           "
4738,"Women's Energy Crisis",1853830038,"Dankelman, Irene","Economics/Development/Sustainability/Energy Issues and Green Technologies           "
4739,"Distribution of Incomes in Eastern Europe",0020-7152,"Domanski, Henryk","Economics/Growth, Allocation and Distribution/Income Inequality           "
4740,"Northwest of Suez: The 1956 Crisis and the IMF",1020-7635,"Boughton, James M.","History/Economic History/Financial Markets, Financial Institutions, and Monetary History/International           "
4741,"Emergence and Development of Capital Market in Pre-war Japan",NO ISBN FOUND,"Hamao, Yasushi; Hoshi, Takeo; Okazaki, Tetsuji","History/Economic History/Financial Markets, Financial Institutions, and Monetary History/Markets/Stock Exchange           "
4742,"Work Units and Income Inequality: The Effect of Market Transition in Urban China",0037-7732,"Wu, Xiaogang","Economics/Growth, Allocation and Distribution/Income Inequality           "
4743,"The Philadelphia Stock Exchange: Adapting to Survive in Changing Markets",0007-6805,"Caskey, John P.","History/Economic History/Financial Markets, Financial Institutions, and Monetary History/Markets/Stock Exchange           "
4744,"The Supply of Gold under the Pre-1914 Gold Standard",0013-0117,"Eichengreen, Barry; McLean, Ian W.","History/Economic History/Financial Markets, Financial Institutions, and Monetary History/Monetary Policy           "
4745,"Revisiting the Song Monetary Revolution: A Review Essay",1479-5922,"Von Glahn, Richard","History/Economic History/Financial Markets, Financial Institutions, and Monetary History/Monetary Policy           "
4746,"Monetization and Financial Development in Southeast Asia before the Second World War",0013-0117,"Huff, W. Gregg","History/Economic History/Financial Markets, Financial Institutions, and Monetary History/International           "
4747,"Bibliography of Female Economic Thought to 1940",041523817X,"Madden, Kirsten K.; Seiz, Janet A.; Pujol, M.","History/Economic History/History of Economic Thought/Worldwide           /           /Economics/Economics as a Social Science/Economic Ideas/Topics in the History of Thought"
4748,"Healing Ourselves, Healing Our Economy: Paid Work, Unpaid Work, and the Next Stage of Feminist Economic Transformation",0486-6134,"Matthaei, Julie","History/Social and Cultural History/Gender/Work and Family           "
4749,"A Prosperous Existence in Every Town: The Exchange Idea Spreads Throughout the Nation",252067037,"Sander, Kathleen W.","History/Social and Cultural History/Gender/Work and Family           "
4750,"Introduction: How Gender Works, in the Practice of Theory and Other Social Processes",0759102457,"Clark, Garcia","History/Social and Cultural History/Gender/Work and Family           "
4751,"Going Public through Education: Female Reformers and Girls' Schools in Late Qing Beijing",1086-3257,"Cheng, Weikun","History/Social and Cultural History/Gender/Work and Family           "
4752,"Youth Garment Workers in Bangladesh: Raising the Rights Question",1011-6370,"Bissell, Susan","Economics/Growth, Allocation and Distribution/Labor and Employment/Child Labor           /           /Economics/Development/Women and Children/Labor Issues"
4753,"Female Hands: Embroidery as a Knowledge Field in Women's Everyday Life in Late Imperial and Early Republican China",1086-3257,"Fong, Grace S.","History/Social and Cultural History/Gender/Work and Family           "
4754,"Why More Work for Mother? Knowledge and Household Behavior, 1870-1945",0022-0507,"Mokyr, Joel","History/Social and Cultural History/Gender/Work and Family           "
4755,"The Uses of Chastity: Sex, Law, and the Property of Widows in Qing China",1086-3257,"Sommer, Matthew Harvey","History/Social and Cultural History/Gender/Work and Family           "
4756,"Women Workers in the Soviet Interwar Economy : From 'Protection' to 'Equality'",312217803,"Ilic, Melanie","History/Social and Cultural History/Gender/Work and Family           "
4757,"Neither Mothers nor Breadwinners: African-American Women's Exclusion from US Minimum Wage Policies, 1912-38",1354-5701,"Mutari, Ellen; Power, Marilyn; Figart, Deborah M.","History/Social and Cultural History/Gender/Work and Family           "
4758,"Women and Labour in Late Colonial India: The Bengal Jute Industry",521453631,"Sen, Samita","History/Social and Cultural History/Gender/Work and Family           "
4759,"Global Imperatives and Economic Reform in the Pacific Island States",0012-155X,"Sutherland, William","History/Economic History/Globalization/Economic Integration           "
4760,"Back to the Future: The Globalization of Agriculture in Historical Context",0036-0775,"Coclanis, Peter A.","History/Economic History/Globalization/Cause/Effects           "
4761,"Globalization in History: a Geographical Perspective",0-226-06598-7,"Crafts, Nicholas; Venables, Anthony J.","History/Economic History/Globalization/Economic Integration           "
4762,"Forging and Breaking Global Capital Markets",0-262-15049-2,"O'Rourke, Kevin H.; Williamson, Jeffrey G.","History/Economic History/Globalization/Economic Integration           /           /History/Economic History/Financial Markets, Financial Institutions, and Monetary History/Crisis/Transition"
4763,"Transport Revolutions and Commodity Market Integration",0-262-15049-2,"O'Rourke, Kevin H.; Williamson, Jeffrey G.","History/Economic History/Globalization/Economic Integration           "
4764,"Globalization, Convergence, and History",0022-0507,"Williamson, Jeffrey G.","History/Economic History/Globalization/Economic Integration           "
4765,"Standard of Living in the Soviet Union, 1928-1940",0022-0507,"Allen, Robert C.","History/Social and Cultural History/Consumerism/Consumption           "
4766,"On the Global Repercussions of East African Consumerism",0002-8762,"Prestholdt, Jeremy","History/Social and Cultural History/Consumerism/Consumption           "
4767,"Review of Consumer Activism in Korea, 1910-1995: A Political-Economic Approach",0342-5843,"Rhee, Kee-Choon; Lee, Jinkook","History/Social and Cultural History/Consumerism/Consumption           "
4768,"Plurality of Taste: Food and Consumption in West Germany During the 1950s",0309-2984,"Wildt, Michael","History/Social and Cultural History/Consumerism/Consumption           "
4769,"Child Labour, Fertility, and Economic Growth",0013-0133,"Hazan, Moshe; Berdugo, Binyamin","Economics/Growth, Allocation and Distribution/Labor and Employment/Child Labor           "
4770,"Consumerism Then and Now",0-7619-5215-2,"Miles, Steven","History/Social and Cultural History/Consumerism/Consumption           "
4771,"The Emergence of Consumerism",0-415-24409-9,"Stearns, Peter N.","History/Social and Cultural History/Consumerism/Consumption           "
4772,"The Poverty of Impoverishment Theory: The Economic Well-Being of the Elderly, 1890-1950",0022-0507,"Gratton, Brian","History/Social and Cultural History/Family/Household           "
4773,"A Century of Family Budgets in the United States",0098-1818,"Johnson, David S.; Rogers, John M.; Tan, Lucilla","History/Social and Cultural History/Family/Household           "
4774,"Economic and Ecologic Determinants of Household Organisation in the Northeastern Baltic Region",0358-5522,"Moring, Beatrice","History/Social and Cultural History/Family/Household           "
4775,"Filial Obligations and Child Labor",1363-6669,"Lopez-Calva, Luis Felipe; Miyamoto, Koji","Economics/Growth, Allocation and Distribution/Labor and Employment/Child Labor           "
4776,"From Workshop to Wasteland: De-Industrialization and Fragmentation of the Black Working Class on the East Rand (South Africa), 1990-1999",0020-8590,"Barchiesi, Franco; Kenny, Bridget","History/Economic History/Economic Development, Growth, and Aggregate Productivity/Industrialization           "
4777,"Towards a New Political Economy of State Industrialization in the Arab Middle East",0020-7438,"Chatelus, Michel; Schemeil, Yves","History/Economic History/Economic Development, Growth, and Aggregate Productivity/Industrialization           "
4778,"Boom-or-Bust Commodities and Industrialization in Pre-World War II Malaya",0022-0507,"Huff, W. Gregg","History/Economic History/Economic Development, Growth, and Aggregate Productivity/Industrialization           "
4779,"The Second Industrial Revolution: The History of a Concept",0392-8926,"Hull, James","History/Economic History/Economic Development, Growth, and Aggregate Productivity/Industrialization           "
4780,"Enforcing Property Rights through Reputation: Mexico's Early Industrialization, 1878-1913",0022-0507,"Maurer, Noel; Sharma, Tridib","History/Economic History/Economic Development, Growth, and Aggregate Productivity/Industrialization           "
4781,"Child Mortality, Child Labour and Economic Development",0013-0133,"Strulik, Holger","Economics/Growth, Allocation and Distribution/Labor and Employment/Child Labor           "
4782,"Industrialization in South Africa: A Historiographical Debate?",0379-9867,"Verhoef, Grietjie","History/Economic History/Economic Development, Growth, and Aggregate Productivity/Industrialization           "
4783,"Motivation and Achievement: Technological Change and Creative Response in Comparative Industrial History",0391-5115,"Inkster, Ian","History/Economic History/Economic Development, Growth, and Aggregate Productivity/Industrialization           "
4784,"Integration and Disintegration in North China's Grain Markets, 1738-1911",0022-0507,"Li, Lillian M.","History/Economic History/International and Domestic Trade/Globalization           "
4785,"Globalization in Historical Perspective",0007-666X,"Bordo, Michael D.","History/Economic History/International and Domestic Trade/Globalization           "
4786,"The Rise and Fall of World Trade, 1870-1939",0033-5533,"Estevadeordal, Antoni; Frantz, Brian; Taylor, Alan M.","History/Economic History/International and Domestic Trade/Globalization           "
4787,"Industrial Development in the Colonial Empire and the Imperial Economic Conference at Ottawa 1932",0308-6534,"Miners, Norman","History/Economic History/International and Domestic Trade/Globalization           "
4788,"Twentieth Century International Debt Problem in Historical Perspective",0391-5115,"Aldcroft, Derek H.","History/Economic History/International and Domestic Trade/International           "
4789,"Economic Co-Operation between India and the United Arab Emirates in the 1990s",0026-3206,"Azhar, Muhammad","History/Economic History/International and Domestic Trade/International           "
4790,"Imperial China and Capitalist Europe in the Eighteenth-Century Global Economy",0147-9032,"Hung, Ho-Fung","History/Economic History/International and Domestic Trade/International           "
4791,"Trade Agreements and the Continuation of Tariff Protection Policy in Mandate Palestine in the 1930s",0026-3206,"El-Eini, Roza I. M.","History/Economic History/International and Domestic Trade/Tariffs           "
4792,"Rotgut and Revenue: Fiscal Aspects of the Liquor Trade in Southern Nigeria, 1890-1919",0165-1153,"Olukoju, Ayodeji","History/Economic History/International and Domestic Trade/Tariffs           "
4793,"The United States, Argentina, and the Customs Union with Brazil, 1935-42",0327-4063,"Tirre, Emilce","History/Economic History/International and Domestic Trade/Tariffs           "
4794,"The Capital Revolution: A Case Study of Chinese Student Movements in the 1920s",0021-910X,"Yuan, Zheng","History/Economic History/International and Domestic Trade/Tariffs           "
4795,"The Impact of Trade Liberalization on China's Agriculture and Rural Economy",0036-0775,"Huang, Jikun","History/Economic History/International and Domestic Trade/Trade           "
4796,"Disguised Unemployment of Labor: A Suggested Methodology of Measurement",0003-6846,"Kalirajan, Kaliappa","Economics/Growth, Allocation and Distribution/Labor and Employment/Unemployment           "
4797,"Developing Multilateralism: The Havana Charter and the Fight for the International Trade Organization, 1947-1948",0707-5332,"Toye, Richard","History/Economic History/Globalization/International/Regional Economic Agreements           "
4798,"Women and Forests: Fuel, Food, and Fodder",1853830038,"Dankelman, Irene","Economics/Development/Women and Children/Labor Issues           "
4799,"Child Labor: Lessons from the Historical Experience of Today's Industrial Economies",0258-6770,"Humphries, Jane","History/Economic History/Labor and Employment History/Child Labor           "
4800,"Markets for Children in Early America: A Political Economy of Pauper Apprenticeship",0022-0507,"Murray, John E.; Herndon, Ruth Wallis","History/Economic History/Labor and Employment History/Child Labor           "
4801,"First-Generation Factory Children: Child Labour in Textile Manufacturing in Nineteenth-Century Finland",0358-5522,"Rahikainen, Marjatta","History/Economic History/Labor and Employment History/Child Labor           "
4802,"The Rural Labour Market in the Early Nineteenth Century: Women's and Children's Employment, Family Income and the 1834 Poor Law Report",0013-0117,"Verdon, Nicola","History/Economic History/Labor and Employment History/Child Labor           "
4803,"Industrialization and Child Labor",0-7656-0936-3,"Hindman, Hugh D.","History/Economic History/Labor and Employment History/Child Labor           "
4804,"Child Labour and British Industrialization",0-312-21811-7,"Horrell, Sara; Humphries, Jane","History/Economic History/Labor and Employment History/Child Labor           "
4805,"South Africa",0-313-32277-5,"Stakeman, Catherine","History/Economic History/Labor and Employment History/Child Labor           "
4806,"Disguised Unemployment",883-558122,"Robinson, Joan","Economics/Growth, Allocation and Distribution/Labor and Employment/Unemployment           "
4807,"South Korea",0-313-32277-5,"Traver, Elizabeth KimJin","History/Economic History/Labor and Employment History/Child Labor           "
4808,"Learning from the History of Poor and Working-Class Women's Activism",0002-7162,"Abramovitz, Mimi","History/Economic History/Labor and Employment History/Gender           "
4809,"Cleaning the Revolutionary Household: Domestic Servants and Public Welfare in Mexico City, 1900-1935",1042-7961,"Blum, Ann S.","History/Economic History/Labor and Employment History/Gender           "
4810,"Mothers and Sons: Preference Formation and Female Labor Force Dynamics",0033-5533,"Fernandez, Raquel; Fogli, Alessandra; Olivetti, Claudia","History/Economic History/Labor and Employment History/Gender           "
4811,"Gendering Work, (Re)Working Gender: The Contested Terrain of Women And Work",1042-7961,"Fitzgerald, Jenrose","History/Economic History/Labor and Employment History/Gender           "
4812,"Working-time Reduction and Employment: Experiences in Europe and Economic Policy Recommendations",0309-166X,"Bosch, G.; Lehndorff, S.","Economics/Growth, Allocation and Distribution/Labor and Employment/Theory and Practice           "
4813,"Historical Analysis of African Women Workers in South Africa During the Period 1900 to 2000",1015-8812,"Lalthapersad, Pinky","History/Economic History/Labor and Employment History/Gender           "
4814,"Beyond the Paradigm: Tea-Picking Women in Imperial China",1042-7961,"Lu, Weijing","History/Economic History/Labor and Employment History/Gender           "
4815,"Work, Family, and Organising: An Overview of the Emergence of the Economic, Social and Political Roles of Women in British Guiana",0037-7651,"Trotz, D. Alissa; Peake, Linda","History/Economic History/Labor and Employment History/Gender           "
4816,"The Arab-Jewish Economic Presence in San Pedro Sula, the Industrial Capital of Honduras: Formative Years, 1880s-1930s",0261-9288,"Euraque, Dario A.","History/Economic History/Labor and Employment History/Unions and Other Labor Issues           "
4817,"Unions and Management in Engineering: A Case Study, 1964-79",0007-6791,"Brown, Kenneth D.","History/Economic History/Labor and Employment History/Unions and Other Labor Issues           "
4818,"Collective Bargaining and Economic Performance-A Short Review of the Theory",0-8213-5080-3,"Aidt, Toke; Tzannatos, Zafiris","History/Economic History/Labor and Employment History/Unions and Other Labor Issues           "
4819,"Impact of AIDS on Family Composition, Welfare, and Investment: Evidence from Uganda",1363-6669,"Deininger, Klaus; Crommelynck, Anja; Kempaka, Gloria","History/Social and Cultural History/Health, Education, and WellBeing           "
4820,"The Global Reach of HIV/AIDS: Science, Politics, Economics, and Research",0-8078-2830-0,"Gostin, Larry O.","History/Social and Cultural History/Health, Education, and WellBeing           "
4821,"The Economic Cost of AIDS in Sub-Saharan Africa: A Reassessment",0-262-12276-6,"Philipson, Tomas J.; Soares, Rodrigo R.","History/Social and Cultural History/Health, Education, and WellBeing           "
4822,"Income Distribution in the Mirror of Height Differences: The Case of Spain: 1895-1950",0926-6437,"Quiroga, Gloria; Coll, Sebastian","History/Social and Cultural History/Health, Education, and WellBeing           "
4823,"Exports and Inequality: Evidence from the Brazilian Frontier, 1870-1937",0022-0507,"Frank, Zephyr L.","History/Economic History/International and Domestic Trade/Trade           "
4824,"Equality, Employment, and Budgetary Restraint: the Trilemma of the Service Economy",0043-8871,"Iversen, Torben; Wren, Anne","Economics/Growth, Allocation and Distribution/Labor and Employment/Theory and Practice           "
4825,"The Worldwide Standard of Living since 1800",0895-3309,"Easterlin, Richard A.","History/Economic History/Poverty, Inequality, and Standard of Living           /           /Economics/WellBeing/Evaluation of WellBeing"
4826,"Pessimism Perpetuated: Real Wages and the Standard of Living in Britain during and after the Industrial Revolution",0022-0507,"Feinstein, Charles H.","History/Economic History/Poverty, Inequality, and Standard of Living           "
4827,"Irving Fisher and the Contribution of Improved Longevity to Living Standards",0002-9246,"Nordhaus, William D.","History/Economic History/Poverty, Inequality, and Standard of Living           "
4828,"The Origins of the Pioneer Cotton Mills in Minas Gerais, Brazil, 1868-1879: A Reassessment",1467-2227,"De Oliveira, M. Teresa Ribeiro","History/Economic History/Business and Corporations/Local Industry           "
4829,"Postwar Japanese Cotton Textile Investment in Brazil, 1955-1980",1467-2227,"Delanghe, Henri","History/Economic History/International and Domestic Trade/International           "
4830,"The Improbability of Full Employment: A Perspective from India of the Emperor's New Clothes",1856493709,"Mathur, Ajeet N.","Economics/Growth, Allocation and Distribution/Labor and Employment/Theory and Practice           "
4831,"Type and Building Type: Newspaper/Office Buildings in Nineteenth-Century New York",521624215,"Gray, Lee E.","History/Economic History/Business and Corporations/Construction           "
4832,"A Pipe Dream Come True: The International Expansion of the Hume Pipe Company in the 1920s",0007-6791,"Emerson-Elliott, Richard","History/Economic History/Business and Corporations/Models and Structures           "
4833,"Riding the Tiger: Merchant-State Alliance in a Coalmine Modernisation Scheme",0007-6791,"Hornibrook, Jeff","History/Economic History/Business and Corporations/Models and Structures           "
4834,"Work and Benefits: the Multiple Problems of Service Sector Employment",0037-7791,"Nelson, Joel I.","Economics/Growth, Allocation and Distribution/Labor and Employment/Theory and Practice           "
4835,"Indo-Japan Cooperative Ventures in Match Manufacturing in India: Muslim Merchant Networks in and Beyond the Bengal Bay Region 1900-1930",1479-5922,"Oishi, Takashi","History/Economic History/Globalization/Economic Integration           "
4836,"Cross-Disciplinary Technology Transfer in Trans-World War II Japan: The Japanese High-Speed Bullet Train as a Case Study",1543-3404,"Nishiyama, Takashi","History/Economic History/Business and Corporations/Industry           "
