3000,"Gender Politics and the Contradictions of Nurturance: Moral Authority and Constraints to Action for Female Abortion Activists","Sociology/Political Sociology/Gender/Gender Identity           "
3001,"Beyond the Nation State","Sociology/Political Sociology/Nationalism           "
3002,"The Pitfalls of Convergence Analysis: Is the Income Gap Really Widening?","Economics/Growth, Allocation and Distribution/Convergence/Divergence           "
3003,"The Nation and Nationalism in Germany","Sociology/Political Sociology/Nationalism           "
3004,"Social Categories and Claims in the Liberal State","Sociology/Political Sociology/Social Stratification           "
3005,"Science and Citizenship under Post-socialism","Sociology/Political Sociology/Theory of Political Sociology           "
3006,"Social Policy and the Transition","Sociology/Political Sociology/Transition Countries           "
3007,"Human Rights and Democracy: Expanding or Contracting","Sociology/Political Sociology/Democracy           /           /Political Science/Political Theory and Philosophy/Systems, Legitimacy and Law/Democracy"
3008,"Hearts and Minds: Bringing Symbolic Politics Back In","Sociology/Political Sociology/Social Movements/Theory           "
3009,"Turning the Tables: State and Society in South America's Economic Integration","Sociology/Political Sociology/The State           "
3010,"Workers and Supervisors: St. Petersburg 1905-1917 and Shanghai 1895-1927","Sociology/Political Sociology/Classes           "
3011,"A View from Elsewhere: Locating Difference and the Politics of Representation from a Transnational Feminist Perspective","Sociology/Political Sociology/Gender/Gender Identity           "
3012,"The Falun Gong in China: A Sociological Perspective","Sociology/Political Sociology/Social Movements/Theory           "
3013,"The Scientific Nature of Postprocessualism","Anthropology/Methods and Approaches/Cognitive Approaches           "
3014,"Strengthening the Rights of Children and Women in Bolivia","Sociology/Political Sociology/Human Rights           "
3015,"The Institute for Human Rights and Development: Ethics and Partnership in Africa","Sociology/Political Sociology/Human Rights           "
3016,"The Woman Friendly Hospital Initiative in Bangladesh: A Strategy for Addressing Violence Against Women","Sociology/Family and Kinship/Domestic Violence           "
3017,"Reproductive Health for Migrant Burmese Women in Ranong Fishing Community","Sociology/Political Sociology/Human Rights           "
3018,"Breaking Cultural and Social Taboos: The Fight Against FGM in Egypt","Sociology/Political Sociology/Human Rights           "
3019,"Legal Responses to Rape in Mexico: Lessons From the Year 2000","Sociology/Political Sociology/Human Rights           "
3020,"Women and Children's Well-being in the Age of Globalization: A Focus on St. Vincent and the Grenadines and Small Island Developing States","Sociology/Political Sociology/Human Rights           "
3021,"Linking Children's and Women's Rights: An Early Childhood Perspective","Sociology/Political Sociology/Human Rights           "
3022,"Guest Editorial: Women's Rights and Children's Rights: Challenges and Opportunities","Sociology/Political Sociology/Human Rights           "
3023,"Children's Rights and Women's Rights: Some Connections and Disconnections","Sociology/Political Sociology/Human Rights           "
3024,"Economic Growth and Convergence in Latin America","Economics/Growth, Allocation and Distribution/Convergence/Divergence           "
3025,"Gender Equality and the Rights of Women and Girls","Sociology/Family and Kinship/Gender Inequality           "
3026,"Possibilities for the Future","Sociology/Political Sociology/Organizations and Institutions/Multilateral           "
3027,"Ethics of Care and Health Policy Change: Indian Women's Movement Mobilizes Against Quinacrine Sterilization","Sociology/Political Sociology/Social Movements/Feminism           "
3028,"Violence Against Women: Men and the Social Imaginary","Sociology/Political Sociology/Social Movements/Violence Against Women           "
3029,"Men's Collective Anti-violence Activism and the Struggle for Gender Justice","Sociology/Political Sociology/Social Movements/Violence Against Women           "
3030,"Countering Violence Against Women in Rajasthan: Problems, Strategies and Hazards","Sociology/Political Sociology/Social Movements/Violence Against Women           "
3031,"Men Stopping Men's Violence to Women","Sociology/Political Sociology/Social Movements/Violence Against Women           "
3032,"Violence Against Women: Initiatives in the 1990s","Sociology/Political Sociology/Social Movements/Violence Against Women           "
3033,"The Men Against Violence Against Women Movement in Namibia","Sociology/Political Sociology/Social Movements/Violence Against Women           "
3034,"Postwar Land Dispute Resolution: Land Tenure and the Peace Process in Mozambique","Sociology/Political Sociology/Land Tenure           "
3035,"Conflict Research in Africa","Sociology/Political Sociology/Theory of Political Sociology           "
3036,"The Solitude of Edward Said: The Fate of Gibb, Lane, and Massignon in 'Orientalism'","Sociology/Political Sociology/Colonialism and Imperialism           "
3037,"The Formation of an 'Islamic Sphere' in French Colonial West Africa","Sociology/Political Sociology/Colonialism and Imperialism           "
3038,"Postcolonialism and its Discontents","Sociology/Political Sociology/Colonialism and Imperialism           "
3039,"Technologies of Social Control: Crowd Management in Liberal Democracy","Sociology/Political Sociology/Democracy           "
3040,"Humanity, Military Humanism and the New Moral Order","Sociology/Political Sociology/Human Rights           "
3041,"Human Rights for Women: An Argument for 'Deconstructive Equality'","Sociology/Political Sociology/Human Rights           "
3042,"Post-Panopticism","Sociology/Urban Sociology/Crime and Violence           "
3043,"From Hegemony to Affinity: The Political Logic of the Newest Social Movements","Sociology/Political Sociology/Social Movements/Against Modern Concentrations of Power           "
3044,"Self-determination from Marx to Mao","Sociology/Political Sociology/The State           "
3045,"'Somewhere Over the Rainbow': The Post-Soviet Transition, the Market and the Mythical Process of Convergence","Economics/Growth, Allocation and Distribution/Convergence/Divergence           "
3046,"Interpersonal Trust and Voluntary Associations: Examining Three Approaches","Sociology/Political Sociology/Theory of Political Sociology           "
3047,"The Evolution of a Field","Sociology/Political Sociology/Theory of Political Sociology           "
3048,"Black Politics and the Web of Joined-up Governance: Compromise, Ethnic Minority Mobilization and the Transitional Public Sphere","Sociology/Political Sociology/Social Movements/Struggles of the Oppressed           "
3049,"Housing and Poverty: The 'Missing Link'","Sociology/Political Sociology/Social Stratification           "
3050,"Metaphors of the Natural and the Artificial in Czech Political Discourse","Sociology/Political Sociology/Legitimation           "
3051,"Politics and Gastropolitics: Gender and the Power of Food in Two African Pastoralist Societies","Sociology/Political Sociology/Gender/Power           "
3052,"Taking Sides and Constructing Identities: Reflections on Conflict Theory","Sociology/Political Sociology/Theory of Political Sociology           "
3053,"Cultural Materialism: A Theoretical Review","Anthropology/Methods and Approaches/Cultural Materialism           "
3054,"National Inequality and the Catch-Up Period: Some “Growth Alone” Scenarios","Economics/Growth, Allocation and Distribution/Convergence/Divergence           "
3055,"Sungusungu: The Role of Preexisting and Evolving Social Institutions Among Tanzanian Vigilante Organizations","Sociology/Political Sociology/Organizations and Institutions/Political Institutions           "
3056,"Reform in Eastern Europe: Promise and Problems, An Introduction","Sociology/Political Sociology/Modernization/Modernity           "
3057,"Is Persistent Abject Poverty Now a Policy Choice?","Sociology/Political Sociology/Armed Conflict           "
3058,"In Search of Usable Pasts: Poland's Effort to Overlook its Communist History as Part of its Resurrection of Past National Identity Symbols","Sociology/Political Sociology/Transition Countries           "
3059,"Immigrant Women Challenge the Role of Men: How the Changing Power Relationship within Iranian Families in Sweden Intensifies Family Conflicts after Immigration","Sociology/Political Sociology/Gender/Power           "
3060,"The Impact of Ethnicity and Socialization on Definitions of Democracy: The Case of Mexican Americans and Mexicans","Sociology/Political Sociology/Democracy           "
3061,"The Geopolitics of Tolerance: Minority Rights under EU Expansion in East-Central Europe","Sociology/Political Sociology/Human Rights           "
3062,"Paradoxes of Transnational Civil Societies Under Neoliberalism: The Coalition for Justice in the Maquiladoras","Sociology/Political Sociology/Social Movements/Against Modern Concentrations of Power           "
3063,"Fighting “Frankenfoods”: Industry Opportunity Structures and the Efficacy of the Anti-biotech Movement in Western Europe","Sociology/Political Sociology/Social Movements/Against Modern Concentrations of Power           "
3064,"Neglected Citizens and Willing Traders: The Villas del Norte (Tamaulipas) in Mexico's Northern Borderlands, 1749-1846","Sociology/Political Sociology/Social Stratification           "
3065,"Slow Convergence? The New Endogenous Growth Theory and Regional Development","Economics/Growth, Allocation and Distribution/Convergence/Divergence           "
3066,"The MST and the Media: Competing Images of the Brazilian Landless Farmworkers' Movement","Sociology/Political Sociology/Social Movements/Media and Education           "
3067,"Decomposing the Intellectuals' Class Power: Conversion of Cultural Capital to Income, Hungary, 1986","Sociology/Political Sociology/Elites           "
3068,"Modernization, Elites, and the Distribution of Educational Resources in Thailand","Sociology/Political Sociology/Modernization/Modernity           "
3069,"Political Institutions, Minorities, and Punishment: A Pooled Cross-national Analysis of Imprisonment Rates","Sociology/Political Sociology/Organizations and Institutions/Political Institutions           "
3070,"Power and Social Structure in Community Elites","Sociology/Political Sociology/Elites           "
3071,"The Impact of Political Parties, Interest Groups, and Social Movement Organizations on Public Policy: Some Recent Evidence and Theoretical Concerns","Sociology/Political Sociology/The State           "
3072,"Unions, Solidarity, and Striking","Sociology/Political Sociology/Social Movements/Struggles of the Oppressed           /           /History/Economic History/Labor and Employment History/Unions and Other Labor Issues"
3073,"Postindustrialization and Environmental Quality: An Empirical Analysis of the Environmental State","Sociology/Political Sociology/The State           "
3074,"Agriculture and the Transition to the Market","Economics/Development/Transition from Socialism to Markets           "
3075,"The Marriage of Marx and Darwin?","Anthropology/Methods and Approaches/Cultural Materialism           "
3076,"Is Political Sociology Informed by Political Science?","Sociology/Political Sociology/Theory of Political Sociology           "
3077,"Teaching Democracy and Human Rights","Sociology/Political Sociology/Citizenship           "
3078,"Personnel Discipline and Industrial Relations on the Railways of Republican China","Sociology/Political Sociology/Classes           "
3079,"How Many Separated Aboriginal Children?","Sociology/Political Sociology/Colonialism and Imperialism           "
3080,"Media, Bureaucracy, and the Success of Social Protest: Newspaper Coverage of Environmental Movement Groups","Sociology/Political Sociology/Social Movements/Media and Education           "
3081,"The Metropolitan Connection: Foreign and Semiforeign Elites in Haiti, 1900-1915","Sociology/Political Sociology/Elites           "
3082,"Global Catholicism and the Politics of Civil Society","Sociology/Political Sociology/Organizations and Institutions/Religion           "
3083,"Walden Two, Postmodern Utopia, and the Problems of Power, Choice, and the Rule of Law","Sociology/Political Sociology/Power           "
3084,"Income Inequality in the Caribbean: Case Study of Jamaica","Economics/Growth, Allocation and Distribution/Convergence/Divergence           "
3085,"The Games of Ethnopolitics in Latvia","Sociology/Political Sociology/Citizenship           "
3086,"Comparison of Elite Groups in Tatarstan, Sakha, Magadan, and Orenburg","Sociology/Political Sociology/Elites           "
3087,"Racism, Xenophobia and Human Rights","Sociology/Political Sociology/Human Rights           "
3088,"Transfer of Planning Technology and Local Political Economy: A Retrospective Analysis of Calcutta's Planning","Economics/Economic Policy/Technology           "
3089,"Mexico's Liberalization Strategy, 10 Years On: Results and Alternatives","Economics/Economic Policy/Neoliberal Regime           "
3090,"Aid Conditionality as a Tool for Peacebuilding: Opportunities and Constraints","Economics/Globalization/Multilateral Institutions: Other           /           /Political Science/International Relations/NorthSouth Relations and Politics of Development"
3091,"Technological Maturity and Development without Research: The Challenge for Malaysian Manufacturing","Economics/Economic Policy/Technology           "
3092,"Changing Welfare Regimes in East and Southeast Asia: Crisis, Change and Challenge","Economics/Economic Policy/Governance and Forms of Governments           "
3093,"Conditionality and Aid Effectiveness Re-evaluated","Economics/Globalization/Multilateral Institutions: Other           /           /Political Science/International Relations/NorthSouth Relations and Politics of Development"
3094,"Developing Countries as Plaintiffs and Defendants in GATT/WTO Trade Disputes","Economics/Globalization/Multilateral Institutions: Bretton Woods System           "
3095,"Food Safety Issues, Trade and WTO Rules: A Developing Country Perspective","Economics/Globalization/Multilateral Institutions: Bretton Woods System           "
3096,"Debt Relief and the Current Account: An Analysis of the HIPC Initiative","Economics/Economic Policy/Fiscal Policy/Government Policies           "
3097,"Politics, Evidence and the New Aid Agenda","Economics/Globalization/Economic Assistance           /           /Political Science/International Relations/NorthSouth Relations and Politics of Development"
3098,"Distant Voices: The Views of the Field Workers of NGOs in Bangladesh on Microcredit","Economics/Economic Policy/Market Formation and Regulation           "
3099,"Social and Environmental Litigation Against Transnational Firms in Africa","Economics/Development/Markets/Corporate Social and Environmental Impacts           /           /History/Environmental History/Environmental Movements and Civil Society/Transnationalism/           /Political Science/International Relations/Globalization/Transnational Corporations and Sovereignty"
3100,"International Structural Adjustment and its Sectoral and Spatial Impacts","Economics/Economic Policy/Economic Management and Reforms           "
3101,"Impacts of Structural Adjustment on the Sustainability of Developing Countries","Economics/Globalization/Multilateral Institutions: Other           /           /Economics/Development/Sustainability/Policy, Politics and Theory"
3102,"The Role of the State","Economics/Economic Policy/Development Policy           "
3103,"Neoliberalism and Its Discontents","Economics/Economic Policy/Neoliberal Regime           "
3104,"The Search for the Key: Aid, Investment and Policies in Africa","Economics/Globalization/Economic Assistance           "
3105,"Technology Choice in Agriculture in India over the Past Three Decades","Economics/Economic Policy/Technology           "
3106,"Institutions and Culture: Neo-Weberian Economic Anthropology","Anthropology/Methods and Approaches/Cultural Materialism           "
3107,"The Choice of Technology in Public Enterprise: A Comparative Study of Manufacturing Industry in Kenya and Tanzania","Economics/Economic Policy/Technology           "
3108,"Recipient Country's 'Policies' and the Effect of Foreign Aid on Economic Growth in Developing Countries: Additional Evidence","Economics/Globalization/Economic Assistance           /           /Political Science/International Relations/NorthSouth Relations and Politics of Development"
3109,"Ghost of Financing the Gap: An Overlooked Aspect of the Aid Debate","Economics/Globalization/Economic Assistance           "
3110,"Practice, Power, and Meaning: Frameworks for Studying Organizational Culture in Multi-Agency Rural Development Projects","Economics/Economic Policy/Development Policy           "
3111,"Move to Markets? An Empirical Analysis of Privatization in Developing Countries","Economics/Economic Policy/Neoliberal Regime           "
3112,"Environmental Reform and the Multilateral Banks","Economics/Globalization/Multilateral Institutions: Other           /           /Economics/Development/Sustainability/Policy, Politics and Theory"
3113,"The Worldwide Movement in Private Universities: Revolutionary Growth in Post-Secondary Higher Education","Political Science/Public Administration/Privatization           "
3114,"Access to Clean Water and Sanitation Pose 21st-Century Challenge for Millions","Political Science/Public Administration/Basic Governmental Services/Sanitation and Waste Control           "
3115,"American Federalism and the Search for Models of Management","Political Science/Public Administration/Civil Administration/Social Organization           "
3116,"Governance at Ground Level: The Frontline Bureaucrat in the Age of Markets and Networks","Political Science/Public Administration/Citizens, Bureaucrats, and Politicians           "
3117,"Bank Supervision and the Limits of Political Influence over Bureaucracy","Political Science/Public Administration/Citizens, Bureaucrats, and Politicians           "
3118,"Bureaucracy and Democracy: The Case for More Bureaucracy and Less Democracy","Political Science/Public Administration/Citizens, Bureaucrats, and Politicians           "
3119,"Promoting the Utilization of Performance Measures in Public Organizations: An Empirical Study of Factors Affecting Adoption and Implementation","Political Science/Public Administration/Civil Administration/Social Organization           "
3120,"The New Public Service: Serving Rather Than Steering","Political Science/Comparative Politics/Political Systems, Processes and Transition/Democracy           "
3121,"Democracy, Bureaucracy, and Hypocrisy Redux: A Search for Sympathy and Compassion","Political Science/Comparative Politics/Political Systems, Processes and Transition/Democracy           "
3122,"From Responsiveness to Collaboration: Governance, Citizens, and the Next Generation of Public Administration","Political Science/Comparative Politics/Political Systems, Processes and Transition/Democracy           "
3123,"A Partial Revolution: The Diplomatic Ethos and Transparency in Intergovernmental Organizations","Political Science/International Relations/Global Treaties and Institutions/Multilateral Institutions and Treaties           "
3124,"Play It Again, Sam; It's Still Not Right: Searching for the Right Notes in Administrative Reform","Political Science/Public Administration/Efficiency/Reform/Improvement           "
3125,"Managerialism and Social Welfare: A Challenge to Public Administration","Political Science/Public Administration/Justice and Rights/Social Welfare/Welfare State           /           /Political Science/Public Policy/Social Welfare/Social Welfare/Welfare State"
3126,"Realizing the Promise: Government Information Systems and the Fourth Generation of Information Technology","Political Science/Public Administration/Efficiency/Technology           "
3127,"Police Information Technology: Assessing the Effects of Computerization on Urban Police Functions","Political Science/Public Administration/Efficiency/Technology           "
3128,"The Future of Public Administration: End of a Short Stay in the Sun? Or a New Day A-Dawning","Political Science/Public Administration/Theory and Research           "
3129,"Bringing Politics Back In: Defense Policy and the Theoretical Study of Institutions and Processes","Political Science/Public Administration/Theory and Research           "
3130,"Achieving Coordination in Public Utility Industries: A Critique of Troublesome Options","Political Science/Public Administration/Basic Governmental Services/Public Utilities           "
3131,"Institutionalising Accountability: A Commentary","Political Science/Public Administration/Efficiency/Corruption           "
3132,"Performance Indicators in Academia: An X-Efficiency Approach?","Political Science/Public Administration/Theory and Research           "
3133,"Evidence and Policy: Towards a New Politico-Administrative Settlement","Political Science/Public Administration/Citizens, Bureaucrats, and Politicians           "
3134,"Developments in Policy Analysis and Evaluation in Israeli Public Administration","Political Science/Public Administration/Civil Administration/Social Organization           "
3135,"At the Commission's Discretion: Cartelbusting and Fining Infringements Under the EU's Restrictive Practices Policy","Political Science/Public Administration/Efficiency/Commerce and Economic Policy           "
3136,"Anti-racism and the Limits of Equal Opportunities Policy in the Criminal Justice System","Political Science/Public Administration/Basic Governmental Services/Justice and Legal Services           "
3137,"Looking Inwards, Looking Outwards: Dismantling the “Berlin Wall” Between Health and Social Services?","Political Science/Public Administration/Basic Governmental Services/Public Health           "
3138,"The Crisis of Public Administration in Russia","Political Science/Public Administration/Efficiency/Reform/Improvement           "
3139,"The Dynamics of Technological Learning in Industrialisation","Political Science/Public Administration/Efficiency/Technology           "
3140,"Administration and Society: Beyond Public Choice?","Political Science/Public Administration/Theory and Research           "
3141,"Theory, Stylized Heuristic or Self-Fulfilling Prophecy? The Status of Rational Choice Theory in Public Administration","Political Science/Public Administration/Theory and Research           "
3142,"Public Administration Education and Europeanization: Prospects for the Emancipation of a Discipline?","Political Science/Public Administration/Theory and Research           "
3143,"Regimes on Pillars: Alternatives Welfare State Logics and Dynamics","Political Science/Public Administration/Theory and Research           "
3144,"Policy Networks","Political Science/Comparative Politics/Political Systems, Processes and Transition/Democracy           "
3145,"The Evolution of Consciousness? Transpersonal Theories in Light of Cultural Relativism","Anthropology/Methods and Approaches/Cultural Particularism, Universalism, and Relativism           "
3146,"New BMA Book Highlights Human Rights Abuses","Political Science/Public Administration/Justice and Rights/Human Rights           "
3147,"Sustainable Public/Private Partnerships for Public Service Delivery","Political Science/Public Administration/Civil Administration/Social Organization           "
3148,"Citizens, Public Administration and the Search for Theoretical Foundations","Political Science/Public Administration/Citizens, Bureaucrats, and Politicians           "
3149,"Political Institutions and Corruption: The Role of Unitarism and Parliamentarism","Political Science/Public Administration/Efficiency/Corruption           "
3150,"COCOM is Dead, Long Live COCOM: Persistence and Change in Multilateral Security Institutions","Political Science/International Relations/Global Treaties and Institutions/Multilateral Institutions and Treaties           "
3151,"Negotiating Boundaries of Refugee Resettlement: A Study of Settlement Patterns and Social Support","Political Science/Public Administration/Justice and Rights/Refugees and Immigrants           "
3152,"Trial and Error in Privatisation: Experiences in Urban Solid Waste Collection in Accra (Ghana) and Hyderabad (India)","Political Science/Public Administration/Privatization           "
3153,"Multilateral Meltdown: It's Time for Another Walk in the Bretton Woods","Political Science/International Relations/Global Treaties and Institutions/Multilateral Institutions and Treaties           "
3154,"People's Courts, Postmodern Difference, and Socialist Justice in South Africa","Political Science/Public Administration/Basic Governmental Services/Justice and Legal Services           "
3155,"Centro Femenil: A Women's Prison in Mexico","Political Science/Public Administration/Basic Governmental Services/Justice and Legal Services           "
3156,"Bureaucracy and Development In The Sudan","Political Science/Public Administration/Civil Administration/Social Organization           "
3157,"Development Alternatives for Tropical Rain Forests","Economics/Development/Ecology and Habitat           "
3158,"Pathologizing Possession: An Essay on Mind, Self, and Experience in Dissociation","Anthropology/Methods and Approaches/Cultural Particularism, Universalism, and Relativism           "
