5685,"Transforming Community Psychology","Social Psychology/Applied Social Psychology/Community, Ethics, and Society           "
5686,"The Industry of Fear","Social Psychology/Applied Social Psychology/Aggression, Violence and AntiSocial Behavior           "
5687,"Policing Culture, Cultural Policing: Law and Social Order in Postcolonial South Africa","Social Psychology/Applied Social Psychology/Aggression, Violence and AntiSocial Behavior           "
5688,"Beyond Anomalies: Rethinking the Conflict Perspective on Race and Criminal Punishment","Social Psychology/Applied Social Psychology/Aggression, Violence and AntiSocial Behavior           "
5689,"From Microcredit to Microfinance: Evolution of Savings Products by MFIs in Bangladesh","Economics/Development/Poverty and Inequality/Finance and Microfinance           "
5690,"I Am Moral, but You Are Deterred: Differential Attributions About Why People Obey the Law","Social Psychology/Applied Social Psychology/Aggression, Violence and AntiSocial Behavior           "
5691,"Predicting Support for Welfare Policies: The Impact of Attributions and Beliefs about Inequality","Social Psychology/Social Cognition/Attitude, Emotions and WellBeing           "
5692,"Attributing Third World Poverty in Australia and Malawi: A Case of Donor Bias?","Social Psychology/Social Cognition/Perception, Judgment and Mental Representation           "
5693,"Underdevelopment in a North African Tribe: Toward a Psychology of Peripheral Social Orders","Social Psychology/Social Cognition/Eurocentrism, Colonial and PostColonial Issues           "
5694,"Symbolic Interactionism Approach to Study Socio-Economic Development in Slovenia","Social Psychology/Applied Social Psychology/Economics and Psychology           "
5695,"The Satisfied Poor","Social Psychology/Applied Social Psychology/Economics and Psychology           "
5696,"Social Capital, Satisfaction and Quality of Life in the Workplace","Social Psychology/Applied Social Psychology/Economics and Psychology           "
5697,"An Afrocentric Perspective on Social Welfare Philosophy and Policy","Social Psychology/Social Cognition/Eurocentrism, Colonial and PostColonial Issues           "
5698,"The Effect of Education on Nationalism and Ethnic Exclusionism: An International Comparison","Social Psychology/Applied Social Psychology/Education and Socialization           "
5699,"Distributed Cognition and the Shared Knowledge Model of the Mazahua: A Cultural Approach","Social Psychology/Applied Social Psychology/Education and Socialization           "
5700,"Anti-Smoking Socialization Beliefs among Rural Native American and White Parents of Young Children","Social Psychology/Applied Social Psychology/Education and Socialization           "
5701,"Rethinking Literacy and Women's Health: A Bangladesh Case Study","Social Psychology/Applied Social Psychology/Education and Socialization           "
5702,"The French Colonial Policy of Assimilation and the Civility of the Originaires of the Four Communes (Senegal): A Nineteenth Century Globalization Project","Sociology/Culture and Society/Cultural Politics           "
5703,"Changes in Euro-American Values Needed for Sustainability","Social Psychology/Applied Social Psychology/Environment and Sustainability           "
5704,"Global Concern for the Environment: Is Affluence a Prerequisite?","Social Psychology/Applied Social Psychology/Environment and Sustainability           "
5705,"Cognitive Dissonance and Energy Conservation","Social Psychology/Applied Social Psychology/Environment and Sustainability           "
5706,"The Social Psychology of Sustainability","Social Psychology/Applied Social Psychology/Environment and Sustainability           "
5707,"Sustainability and Systemic Issues in a New Era","Economics/Economic Policy/Welfare           "
5708,"US Environmental NGOs and the Cree: An Unnatural Alliance for the Preservation of Nature?","Sociology/Culture and Society/Cultural Politics           "
5709,"Using Cognitive Dissonance to Encourage Water Conservation","Social Psychology/Applied Social Psychology/Environment and Sustainability           "
5710,"Human Resilience in a Degrading Environment: A Case Study in China","Social Psychology/Applied Social Psychology/Environment and Sustainability           "
5711,"Social Psychology and the Cultural Frame. A Road towards New Perspectives and Developments","Social Psychology/Group Dynamics/InGroup/OutGroup Dynamics           "
5712,"Ethnocentrism as a Social-Psychological Phenomenon: Findings of a Study of Ethnic Groups in Uzbekistan","Social Psychology/Group Dynamics/Inter and IntraGroup Dynamics           "
5713,"The Case for the Global Commons","Economics/Globalization/Globalization: Positive Development Impacts           "
5714,"Psychology and the Study of Differences in Human Functioning Some Reflections","Social Psychology/Group Dynamics/InGroup/OutGroup Dynamics           "
5715,"Apologetics and Ethnocentrism: Psychology and Religion within an Ideological Surround","Social Psychology/Group Dynamics/Peer Groups, Reference Groups and Group Identity           "
5716,"Stigma, Identity Dissonance, and the Nonresidential Mother","Social Psychology/Applied Social Psychology/Gender Issues           "
5717,"Psychology, Population, and Reproductive Behavior","Social Psychology/Applied Social Psychology/Gender Issues           "
5718,"Rape: Scope, Impact, Interventions, and Public Policy Responses","Social Psychology/Applied Social Psychology/Gender Issues           "
5719,"Development Connections: The Hedgerow Model","Economics/Development/Institutions           /           /GDAE/Globalization and Trade/           /GDAE/Economic Theory"
5720,"Being Born Female Is Dangerous for Your Health","Social Psychology/Applied Social Psychology/Gender Issues           "
5721,"Infanticide: Contrasting Views","Social Psychology/Applied Social Psychology/Gender Issues           "
5722,"Gender and Nature: A Psychological Analysis of Ecofeminist Theory","Social Psychology/Applied Social Psychology/Gender Issues           "
5723,"Promoting Mental Health and Emotional Well-being Among Children and Youth: A Role for Community Child Health?","Social Psychology/Applied Social Psychology/Health and WellBeing           "
5724,"Housing and Health: Psychosocial and Situational Effects in a Rural Disease Control Program","Social Psychology/Applied Social Psychology/Health and WellBeing           "
5725,"Wealth, Poverty, and Sustainable Development","Economics/Development/Poverty and Inequality/Environment and Poverty           "
5726,"The Good Society","Sociology/Culture and Society/Cultural Politics           "
5727,"Optimism across Cultures: In Response to the Severe Acute Respiratory Syndrome Outbreak","Social Psychology/Applied Social Psychology/Health and WellBeing           "
5728,"Interventions to Prevent HIV/AIDS among Adolescents in less Developed Countries: Are They Effective?","Social Psychology/Applied Social Psychology/Health and WellBeing           "
5729,"Therapy with Victims of Political Repression in Chile: The Challenge of Social Reparation","Social Psychology/Applied Social Psychology/Human Rights and Social Justice           "
5730,"The Developmental Dialectic of International Human-Rights Advocacy","Social Psychology/Applied Social Psychology/Human Rights and Social Justice           "
5731,"Free Trade or Sustainable Trade? An Ecological Economics Perspective","Economics/Economic Policy/Trade/Social and Environmental Issues           /           /GDAE/Globalization and Trade/           /GDAE/Environmental Policy and Sustainable Development"
5732,"Humiliation and Human Rights: Mapping a Minefield","Social Psychology/Applied Social Psychology/Human Rights and Social Justice           "
5733,"Human Rights and Mental Health in the United States: Lessons from Latin America","Social Psychology/Applied Social Psychology/Human Rights and Social Justice           "
5734,"Canada as a New Place: The Immigrant's Experience","Social Psychology/Applied Social Psychology/Nation, State, and Politics           "
5735,"Migration and Caste Formation in Europe: The Belgian Case","Social Psychology/Group Dynamics/Caste, Class, Status, and Hierarchy           "
5736,"Stories People Tell: The Cultural Construction of Environmental Policy in Africa","Economics/Development/Poverty and Inequality/Environment and Poverty           "
5737,"Must Nations Become States?","Sociology/Culture and Society/Cultural Politics           "
5738,"Political Power and Environmental Sustainability in Agriculture","Economics/Economic Policy/Food and Agricultural Policies           "
5739,"Reactions to Organizational Politics: A Cross-Cultural Examination in Israel and Britain","Sociology/Culture and Society/Cultural Politics           "
5740,"Skin Color as Post-Colonial Hierarchy: A Global Strategy for Conflict Resolution","Social Psychology/Applied Social Psychology/Nation, State, and Politics           "
5741,"Tradition in the Political Culture of Developing Countries","Social Psychology/Applied Social Psychology/Nation, State, and Politics           "
5742,"Social Representations of History in Malaysia and Singapore: On the Relationship between National and Ethnic Identity","Social Psychology/Applied Social Psychology/Nation, State, and Politics           "
5743,"Democratization, Psychology, and the Construction of Cultures of Peace","Social Psychology/Applied Social Psychology/Nation, State, and Politics           "
5744,"The Appropriation of Difference: State and the Construction of Ethnic Identities in Nigeria","Social Psychology/Applied Social Psychology/Nation, State, and Politics           "
5745,"'The Only Proper Scale of Representation': The Politics of Statistics and Stories","Social Psychology/Applied Social Psychology/Nation, State, and Politics           "
5746,"A Cognitive Approach to International Organization: Perspective and Application","Social Psychology/Applied Social Psychology/Nation, State, and Politics           "
5747,"Toward a Learning Paradigm: New Professionalism and Institutions for Agriculture","Economics/Economic Policy/Food and Agricultural Policies           "
5748,"Fertility, Education, and Development: Evidence from India","Economics/Development/Population and Quality of Life/Family Planning and Structure           "
5749,"Affirmative Action in Theory and Practice: Issues of Power, Ambiguity, and Gender versus Race","Social Psychology/Applied Social Psychology/Human Rights and Social Justice           /           /Social Psychology/Group Dynamics/Race, Religion, and Ethnicity/           /Social Psychology/Applied Social Psychology/Gender Issues"
5750,"The Myth of Third World Solidarity: Hypergamy by Skin Colour as a Vehicle of Racism vis--vis African Americans","Social Psychology/Social Cognition/Eurocentrism, Colonial and PostColonial Issues           "
5751,"Why Is There No Study of Cultural Equivalence in Standardized Cognitive Ability Testing?","Social Psychology/Approaches to Social Psychology/Cultural Psychology and CrossCultural Issues           "
5752,"Talk Does Not Cook Rice: Beyond Anti-Racism Rhetoric to Strategies for Social Action","Social Psychology/Social Cognition/Race and Ethnicity           "
5753,"Does Food Security Require Local Food Systems?","Economics/Development/Agrarian Economy and Society/Food Security           "
5754,"Chinua Achebe Writing Culture: Representations of Gender and Tradition in Things Fall Apart","Sociology/Culture and Society/Gender           "
5755,"Religion as an Instrument of Psychological Warfare","Social Psychology/Applied Social Psychology/Religion and Ideology           "
5756,"The Doctrine of Karma: Its Psychosocial Consequences","Social Psychology/Applied Social Psychology/Religion and Ideology           "
5757,"Is Religion Adaptive?","Social Psychology/Applied Social Psychology/Religion and Ideology           "
5758,"Turning-Point Decisions: A Cognitive-Dissonance Analysis of Conflict Reduction in Israel-West German Relations","Social Psychology/Applied Social Psychology/War, Conflict, and Terrorism           "
5759,"Community, Ecology, and Landscape Change in Zambrana-Chacuey","Economics/Economic Policy/Food and Agricultural Policies           "
5760,"American and Chinese College Students' Predictions of People's Occupations, Housework Responsibilities, and Hobbies as a Function of Cultural and Gender Influences","Sociology/Culture and Society/Gender           "
5761,"Ethnic Conflict and the Psychology of Liberation in Guatemala, Peru, and Puerto Rico","Social Psychology/Applied Social Psychology/War, Conflict, and Terrorism           "
5762,"The Psychocultural Roots of Genocide: Legitimacy and Crisis in Rwanda","Social Psychology/Applied Social Psychology/War, Conflict, and Terrorism           "
5763,"A Duplex Theory of Hate: Development and Application to Terrorism, Massacres, and Genocide","Social Psychology/Applied Social Psychology/War, Conflict, and Terrorism           "
5764,"The Prophecy of Place: A Labor Market Study of Young Women and Education","Sociology/Culture and Society/Gender           "
5765,"Enhancement of Enemy's Power Motivation as a Dynamic of Escalation in Conflict Situations","Social Psychology/Applied Social Psychology/War, Conflict, and Terrorism           "
5766,"The Rediscovery of the Human Mind: The Discursive Approach","Social Psychology/Approaches to Social Psychology/Cognitive Theory           "
5767,"The Category of the Mind: Folk Psychology of Belief, Desire, and Intention","Social Psychology/Approaches to Social Psychology/Cognitive Theory           "
5768,"The Cognitive Self and the Psychoanalytic Self: Can We Put Ourselves Together?","Social Psychology/Approaches to Social Psychology/Cognitive Theory           "
5769,"Toward a Dialectical Model of Family Gender Discourse: Body, Identity and Sexuality","Sociology/Culture and Society/Gender           "
5770,"Developmental Psychology and the Relevance of a Critical Metatheoretical Reflection","Social Psychology/Approaches to Social Psychology/Critical Psychology           "
5771,"Three Approaches to the Psychology of Culture: Where Do They Come From? Where Can They Go?","Social Psychology/Approaches to Social Psychology/Cultural Psychology and CrossCultural Issues           /           /History/Social and Cultural History/Festivals/Celebrations"
5772,"Why is Multiculturalism Good?","Social Psychology/Approaches to Social Psychology/Cultural Psychology and CrossCultural Issues           "
5773,"Critique of the Methodology of Empirical Research on Individual Modernity in Taiwan","Social Psychology/Approaches to Social Psychology/Cultural Psychology and CrossCultural Issues           "
5774,"Dialectics between Cultural and Cross-Cultural Psychology","Social Psychology/Approaches to Social Psychology/Cultural Psychology and CrossCultural Issues           "
5775,"Analyzing Gender, Health and Communicable Disease: Guidelines from the Liverpool School of Tropical Medicine","Sociology/Culture and Society/Gender           "
5776,"Human Nature and Culture: an Evolutionary Psychological Perspective","Social Psychology/Approaches to Social Psychology/Evolutionary Psychology           "
5777,"The Evolution of Truly Social Cognition: The Core Configurations Model","Social Psychology/Approaches to Social Psychology/Evolutionary Psychology           "
5778,"Feminist Approaches to Social Science: Epistemological and Methodological Tenets","Social Psychology/Approaches to Social Psychology/Feminist Approaches           "
5779,"The Science and Politics of Comparing Women and Men","Social Psychology/Approaches to Social Psychology/Feminist Approaches           /           /Social Psychology/Approaches to Social Psychology/Gender Issues"
5780,"The Psychology of Women and Conservatism: Rediscovering Social Change","Social Psychology/Approaches to Social Psychology/Feminist Approaches           "
5781,"Self-Determination and Empowerment: A Feminist Standpoint Analysis of Talk about Disability","Social Psychology/Approaches to Social Psychology/Feminist Approaches           "
5782,"Why Are Some People Happier Than Others? The Role of Cognitive and Motivational Processes in Well-Being","Social Psychology/Approaches to Social Psychology/Positive Psychology           "
5783,"Psychological Hedonism and the Nature of Motivation: Bertrand Russell's Anhedonic Desires","Social Psychology/Social Cognition/Motivation           "
5784,"Developments in Satisfaction-Research","Social Psychology/Approaches to Social Psychology/Positive Psychology           "
5785,"Essentialism, Culture, and Beliefs about Gender among the Aravanis of Tamil Nadu, India","Sociology/Culture and Society/Gender           "
5786,"Scientists in the Swamp: Narrowing the Language-Practice Gap in Community Psychology","Social Psychology/Approaches to Social Psychology/Deconstructionism and PostModernism           "
5787,"Working with Korean-American Families: Multicultural Hermeneutics in Understanding and Dealing with Marital Domestic Violence","Social Psychology/Approaches to Social Psychology/Deconstructionism and PostModernism           "
5788,"Islam, Gender, Culture and Democracy","Sociology/Culture and Society/Gender           "
5789,"A Philosophical Reflection on the Epistemology and Methodology of Indigenous Psychologies","Social Psychology/Approaches to Social Psychology/Indigenous, NonWestern and PostColonialist Approaches           "
5790,"Indigenous Theorizing in a Complex World","Social Psychology/Approaches to Social Psychology/Indigenous, NonWestern and PostColonialist Approaches           "
5791,"Modulative and Generative Orientations in Psychology: Implications for Psychology in the Three Worlds","Social Psychology/Approaches to Social Psychology/Indigenous, NonWestern and PostColonialist Approaches           "
5792,"Measuring Attitudes in Test-Alien Cultures: When Illiteracy and Unfamiliarity Do Not Matter","Social Psychology/Approaches to Social Psychology/Indigenous, NonWestern and PostColonialist Approaches           "
5793,"Developmental Issues in Indigenous Psychologies: Sustainability and Local Knowledge","Social Psychology/Approaches to Social Psychology/Indigenous, NonWestern and PostColonialist Approaches           "
5794,"Changing Perspectives in Social Psychology in India: A Journey Towards Indigenization","Social Psychology/Approaches to Social Psychology/Indigenous, NonWestern and PostColonialist Approaches           "
5795,"Psychology for the Third World?","Social Psychology/Approaches to Social Psychology/Indigenous, NonWestern and PostColonialist Approaches           "
5796,"Gender Role Development in Japanese Culture: Diminishing Gender Role Differences in a Contemporary Society","Sociology/Culture and Society/Gender           "
5797,"Ideology and Community Social Psychology: Theoretical Considerations and Practical Implications","Social Psychology/Approaches to Social Psychology/Marxist Approaches           "
5798,"Orientalism in Euro-American and Indian Psychology: Historical Representations of Natives in Colonial and Postcolonial Contexts","Social Psychology/Approaches to Social Psychology/Indigenous, NonWestern and PostColonialist Approaches           "
5799,"Rethinking 'Acculturation' in Relation to Diasporic Cultures and Postcolonial Identities","Social Psychology/Approaches to Social Psychology/Indigenous, NonWestern and PostColonialist Approaches           "
5800,"The Other and Other Others: Post-Colonialism, Psychoanalysis and the South African Question","Social Psychology/Approaches to Social Psychology/Indigenous, NonWestern and PostColonialist Approaches           "
5801,"Power and Population in Asia","Economics/Development/Population and Quality of Life/Demographic Transition           "
5802,"The Culture of Masculinity in an Australian Indigenous Community","Sociology/Culture and Society/Gender           "
5803,"The Unbearable Automaticity of Being","Social Psychology/Social Cognition/Perception, Judgment and Mental Representation           "
5804,"Why We Do What We Do: A Biopsychosocial Theory of Human Motivation","Social Psychology/Social Cognition/Motivation           "
5805,"Role Theory and Social Cognition: Learning to Think Like a Recycler","Social Psychology/Approaches to Social Psychology/Various Modern Theories           "
5806,"Coping and Subjective Well-Being in Women with Multiple Roles","Social Psychology/Approaches to Social Psychology/Feminist Approaches           "
5807,"If Saddam is Hitler then Who is George Bush? Analogical Mapping between Systems of Social Roles","Social Psychology/Social Cognition/Perception, Judgment and Mental Representation           "
5808,"The Eyes are Silent, The Heart Desires to Speak: Exploring Masculinities in South Asia","Sociology/Culture and Society/Gender           "
5809,"A Tale of Two Theories: A Critical Comparison of Identity Theory with Social Identity Theory","Social Psychology/Approaches to Social Psychology/Various Modern Theories           "
5810,"Value-Based Praxis in Community Psychology: Moving Toward Social Justice and Social Action","Social Psychology/Approaches to Social Psychology/Social Psychology and Human Values           "
5811,"A Comparative Study in the levels of Human Values: People's Republic of China, Singapore, Taiwan, and the United States","Social Psychology/Approaches to Social Psychology/Social Psychology and Human Values           "
5812,"Violence and the Crisis of Masculinity in the USA, Australia and Mongolia","Sociology/Culture and Society/Gender           "
5813,"The Necessity of Observing Real Life Situations: Palestinian-Israeli Violence as a Laboratory for Learning about Social Behavior","Social Psychology/Approaches to Social Psychology/Sociological Approaches           "
5814,"Social Structure and Personality: A Quintessentially Sociological Approach to Social Psychology","Social Psychology/Approaches to Social Psychology/Sociological Approaches           "
5815,"The Consequences of International Migration for the Status of Women: A Turkish Study","Sociology/Culture and Society/Gender           /           /History/World/Global History/Migration/Causes/Consequences"
5816,"Personality in Society: Social Psychology's Contribution to Sociology","Social Psychology/Approaches to Social Psychology/Sociological Approaches           "
5817,"Return Migration: Changing Roles of Men and Women","Sociology/Culture and Society/Gender           "
5818,"Negative Illusions: Conceptual Clarification and Psychological Evidence Concerning False Consciousness","Social Psychology/Group Dynamics/Bandwagon Effects, NIMBY, and Collective Delusions           "
5819,"The Psychology of Political Momentum","Social Psychology/Group Dynamics/Bandwagon Effects, NIMBY, and Collective Delusions           "
5820,"Not in My Backyard: The Situational and Personality Determinants of Oppositional Behavior","Social Psychology/Group Dynamics/Bandwagon Effects, NIMBY, and Collective Delusions           "
5821,"The Group Psychology of Mass Madness: Jonestown","Social Psychology/Group Dynamics/Bandwagon Effects, NIMBY, and Collective Delusions           "
5822,"Collective and Elective Ethnicity: Caste Among Urban Muslims in India","Social Psychology/Group Dynamics/Caste, Class, Status, and Hierarchy           "
5823,"Own-Group Bias in Social Perception: The Role of Caste and Class Membership","Social Psychology/Group Dynamics/Caste, Class, Status, and Hierarchy           "
5824,"Vocal Indicators of Status: Effects of Caste and Language","Social Psychology/Group Dynamics/Caste, Class, Status, and Hierarchy           "
5825,"Some Observations on the Development of Caste Awareness in Indian Children","Social Psychology/Group Dynamics/Caste, Class, Status, and Hierarchy           "
5826,"Nandanar: Untouchable Saint and Caste Hindu Anomaly","Social Psychology/Group Dynamics/Caste, Class, Status, and Hierarchy           "
5827,"Dispositional and Organizational Influences on Sustained Volunteerism: An Interactionist Perspective","Social Psychology/Group Dynamics/Charity, Volunteerism, and Prosocial Behavior           "
5828,"Altruism and Selfishness","Social Psychology/Group Dynamics/Charity, Volunteerism, and Prosocial Behavior           "
5829,"Developing Concepts of Peace and War: Aspects of Gender and Culture","Sociology/Culture and Society/Gender           "
5830,"How Religious Groups Promote Forgiving: A National Study","Social Psychology/Group Dynamics/Charity, Volunteerism, and Prosocial Behavior           "
5831,"Ethnic Identity and Prosocial Attitudes","Social Psychology/Group Dynamics/Charity, Volunteerism, and Prosocial Behavior           "
5832,"Social Influence in the Crowd: Attitudinal and Behavioural Effects of De-Individuation in Conditions of High and Low Group Salience","Social Psychology/Group Dynamics/Deindividuation and Dehumanization           "
5833,"Deindividuation, Anonymity, and Violence: Findings From Northern Ireland","Social Psychology/Group Dynamics/Deindividuation and Dehumanization           "
5834,"Terrorist Mindsets: Destructive Effects of Victimisation and Humiliation","Social Psychology/Group Dynamics/Deindividuation and Dehumanization           "
5835,"Empowerment and Communication: Lessons Learned from Organizing for Social Change","Social Psychology/Group Dynamics/Group Communication           "
5836,"Motivation for Collective Action: Group Consciousness as Mediator of Personality, Life Experiences, and Women's Rights Activism","Social Psychology/Group Dynamics/Peer Groups, Reference Groups and Group Identity           "
5837,"Barriers of Silence: Reproductive Rights for Women in Jordan","Sociology/Culture and Society/Gender           "
